44505, ECOS , ECOS, NOT FOUND, XAR. 15 MG 120 ML x 1 (/ML), U_Q
48622, EMOFORM , EMOFORM, NOT FOUND, CR.DENT CLOR 90 G x 1, U_Q
47676, EMOFORM , EMOFORM, NOT FOUND, CREME DENTAL 90 G x 1, U_Q
49824, EMOFORM AP , EMOFORM AP, NOT FOUND, CREME DENTAL 90 G x 1, U_Q
49826, EMOFORM AT , EMOFORM AT, NOT FOUND, CREME DENTAL 90 G x 1, U_Q
50061, ERGOMETRIN , ERGOMETRIN, NOT FOUND, AMP. 0.20 MG 1 ML x 50 (/ML), U_Q
48449, ESPASMODID CPTO , ESPASMODID CPTO, NOT FOUND, DRAG x 20, U_Q
48550, ESPASMODID CPTO , ESPASMODID CPTO, NOT FOUND, GOTAS 10 ML x 1, U_Q
50855, ESPASMODID CPTO IN , ESPASMODID CPTO IN, NOT FOUND, AMP. 5 ML x 50, U_Q
63686, ETILEFRIL , ETILEFRIL, NOT FOUND, A.IV 10 MG 1 ML x 6 (/ML), U_Q
