103011, HEVELAIR , HEVELAIR, NOT FOUND, XAR 7 MG 100 ML x 1 (/ML), TAK
49109, HIDRAFIX , HIDRAFIX, NOT FOUND, FLACO.FRAMB. 25 ML x 2, TAK
49110, HIDRAFIX , HIDRAFIX, NOT FOUND, FLACO.LARANJ 25 ML x 2, TAK
49112, HIDRAFIX , HIDRAFIX, NOT FOUND, FLACO.UVA 25 ML x 2, TAK
52512, HIDRAFIX , HIDRAFIX, NOT FOUND, LIQD FRAMB. 250 ML x 1, TAK
52513, HIDRAFIX , HIDRAFIX, NOT FOUND, LIQD LARANJA 250 ML x 1, TAK
52514, HIDRAFIX , HIDRAFIX, NOT FOUND, LIQD UVA 250 ML x 1, TAK
49003, HIDRAFIX 90 , HIDRAFIX 90, NOT FOUND, FLACONETES 25 ML x 2, TAK
52515, HIDRAFIX 90 , HIDRAFIX 90, NOT FOUND, SOLN ORAL 250 ML x 1, TAK
