128293, OLEO DE CARTAMO , OLEO CARTAMO, NOT FOUND, CAPS 1000 MG x 60, MXU
128296, OLEO DE CHIA , OLEO CHIA, NOT FOUND, CAPS 500 MG x 60, MXU
145814, OLEO DE COCO , OLEO COCO, OLEO COCO, CAPS 1000 MG x 60, MXU
126120, OLEO DE LINHACA , OLEO LINHACA, NOT FOUND, CAPS x 60, MXU
160488, OLEO FIG BACALHAU , OLEO FIG BACALHAU, OLEO FIGADO BACALHAU, CAPS 250 MG x 60, MXU
126113, OMEGA 3 , OMEGA 3, NOT FOUND, CAP OL PEIXE 500 MG x 60, MXU
148230, OMEGA 3 , OMEGA 3, NOT FOUND, CAPS 1000 MG x 120, MXU
114280, OMEGA 3 , OMEGA 3, NOT FOUND, CAPS 1000 MG x 90, MXU
126116, OMEGA 3 , OMEGA 3, NOT FOUND, CAPS O PEIXE 1000 MG x 60, MXU
137046, OMEGA 3 FEMME , OMEGA 3 FEMME, NOT FOUND, CAP S 1000 MG x 80, MXU
131272, OMEGA GLA TRIPLO , OMEGA GLA TRIPLO, NOT FOUND, CAPS 1000 MG x 60, MXU
