59674; SUSTAIN ; SUSTAIN; NOT FOUND; LATA BAUNIL. 450 G x 1; DN_
59675; SUSTAIN ; SUSTAIN; NOT FOUND; LATA CHOCOLA 450 G x 1; DN_
59676; SUSTAIN ; SUSTAIN; NOT FOUND; LATA MORANGO 450 G x 1; DN_
67193; SUSTAIN JR ; SUSTAIN JR; NOT FOUND; PO BANANA 350 G x 1; DN_
67194; SUSTAIN JR ; SUSTAIN JR; NOT FOUND; PO BAUNILHA 350 G x 1; DN_
67195; SUSTAIN JR ; SUSTAIN JR; NOT FOUND; PO CHOCOLATE 350 G x 1; DN_
67192; SUSTAIN JR ; SUSTAIN JR; NOT FOUND; PO MORANGO 350 G x 1; DN_
77907; SUSTAIN JR ; SUSTAIN JR; NOT FOUND; SACHE CHOC 200 G x 1; DN_
