76102; BIALUDEX ; BIALUDEX; NOT FOUND; SOLN OFTAL 5 ML x 1; LG6

153458; BERINJELA ; BERINJELA; NOT FOUND; CAPS 400 MG x 60; LHV

32355; BICARBONATO SODIO ; BICARBONATO SODIO; BICARBONATO SODIO; PO 100 G x 1; LIF

89716; BICARBONATO SODIO ; BICARBONATO SODIO; BICARBONATO SODIO; PO 100 G x 1; LO1

146231; BERINJELA ; BERINJELA; NOT FOUND; CAPS 500 MG x 50; LQN

91867; BICARBONATO DE SOD ; BICARBONATO SOD; BICARBONATO SODIO; PO 50 G x 1; LQN

113881; BICARBONATO DE SOD ; BICARBONATO SOD; BICARBONATO SODIO; PO 100 G x 1; LQN

55591; BACTERINIL ; BACTERINIL; NOT FOUND; PO P/SUSP 250 MG 150 ML x 1 (/5ML); LR3

58910; BACINEO ; BACINEO; NOT FOUND; POM. 15 G x 1; LR3

63584; BLUMEN ; BLUMEN; NOT FOUND; POM. 45 G x 1; LR3

69514; BEQUIDEX ; BEQUIDEX; NOT FOUND; XAR. AD 8 MG 120 ML x 1 (/5ML); LR3

75117; BLUMEL HEDERA ; BLUMEL HEDERA; NOT FOUND; XAR. 15 MG 100 ML x 1 (/ML); LR3

49532; BELUP ; BELUP; NOT FOUND; DRAG x 20; LR3

33434; BETALIVER ; BETALIVER; NOT FOUND; FLACONETES 10 ML x 12; LR3

53612; BLUMEN ; BLUMEN; NOT FOUND; CREME 30 G x 1; LR3

69515; BEQUIDEX ; BEQUIDEX; NOT FOUND; XAR. PED. 4 MG 120 ML x 1 (/5ML); LR3

49533; BELUP ; BELUP; NOT FOUND; LIQD 100 ML x 1; LR3

69876; BLUMEL GUACO ; BLUMEL GUACO; NOT FOUND; XAR. 120 ML x 1; LR3

47174; BETALIVER ; BETALIVER; NOT FOUND; FLACONETES 10 ML x 50; LR3

74257; BIOMEDIC ; BIOMEDIC; NOT FOUND; CR PRO MAX 30 ML x 1; LRP

74258; BIOMEDIC ; BIOMEDIC; NOT FOUND; CREME H RECO 40 ML x 1; LRP

74433; BIOMEDIC ; BIOMEDIC; NOT FOUND; SOLN 200 ML x 1; LRP

73537; BIOMEDIC ; BIOMEDIC; NOT FOUND; GEL. 200 ML x 1; LRP

76103; BIOMEDIC ; BIOMEDIC; NOT FOUND; LIQ PIG CONT 30 ML x 1; LRP

73538; BIOMEDIC ; BIOMEDIC; NOT FOUND; GEL SERUM 30 ML x 1; LRP

142895; BIOFORTTIN ; BIOFORTTIN; NOT FOUND; LIQ FER FOSF 400 ML x 1; LUU

87465; BICARBONATO DE SOD ; BICARBONATO SOD; BICARBONATO SODIO; PO 100 G x 1; LYY

88396; BICARBONATO DE SOD ; BICARBONATO SOD; BICARBONATO SODIO; PO 50 G x 1; LYY

73601; BELLEZA INTIMA ; BELLEZA INTIMA; NOT FOUND; SAB LIQD INT 120 ML x 1; LYY

76055; BELLEZA INTIMA ; BELLEZA INTIMA; NOT FOUND; K S LIQ.INT 210 ML x 1; LYY

92372; BROMOPRIDA MG ; BROMOPRIDA; BROMOPRIDA; GOTAS 4 MG 20 ML x 1 (/ML); M1L

92376; BROMOPRIDA MG ; BROMOPRIDA; BROMOPRIDA; GOTAS 4 MG 20 ML x 96 (/ML); M1L

62730; BES ANLODIPINO MG ; BES ANLODIPINO; BESILATO ANLODIPINO; CPR 5 MG x 30; M_S

68617; BROMAZEPAM MG ; BROMAZEPAM; BROMAZEPAM; CPR 6 MG x 20; M_S

61833; BES ANLODIPINO MG ; BES ANLODIPINO; BESILATO ANLODIPINO; CPR 10 MG x 20; M_S

57013; BICONCOR ; BICONCOR; NOT FOUND; CPR 10 MG x 30 (/6.2); M_S

62731; BES ANLODIPINO MG ; BES ANLODIPINO; BESILATO ANLODIPINO; CPR 10 MG x 30; M_S

53026; BICONCOR ; BICONCOR; NOT FOUND; CPR 2.50 MG x 30 (/6.2); M_S

68616; BROMAZEPAM MG ; BROMAZEPAM; BROMAZEPAM; CPR 3 MG x 20; M_S

66478; BROMOPRIDA MG ; BROMOPRIDA; BROMOPRIDA; GOTAS 4 MG 20 ML x 1 (/ML); M_S

58351; BES ANLODIPINO MG ; BES ANLODIPINO; BESILATO ANLODIPINO; CPR 5 MG x 60; M_S

154152; BION 3 ; BION 3; NOT FOUND; TABLETES x 30; M_S

53027; BICONCOR ; BICONCOR; NOT FOUND; CPR 5 MG x 30 (/6.2); M_S

33436; BICARBONATO SODIO ; BICARBONATO SODIO; BICARBONATO SODIO; PO 100 G x 1; MAV

70751; BUPROVIL ; BUPROVIL; NOT FOUND; CPR REVEST 300 MG x 30; MB9

70752; BUPROVIL 600 ; BUPROVIL 600; NOT FOUND; CPR REVEST 600 MG x 30; MB9

71651; BUPROVIL ; BUPROVIL; NOT FOUND; CPR REVEST 300 MG x 600; MB9

96651; BUPROVIL 600 ; BUPROVIL 600; NOT FOUND; CPR REVEST 600 MG x 20; MB9

71652; BUPROVIL 600 ; BUPROVIL 600; NOT FOUND; CPR REVEST 600 MG x 600; MB9

96529; BUPROVIL ; BUPROVIL; NOT FOUND; CPR REVEST 300 MG x 20; MB9

70754; BUPROVIL ; BUPROVIL; NOT FOUND; GOTAS 50 MG 30 ML x 1 (/ML); MB9

76367; BUPROVIL ; BUPROVIL; NOT FOUND; CPR REVEST 300 MG x 200; MB9

70753; BUPROVIL ; BUPROVIL; NOT FOUND; SUSP 20 MG 100 ML x 1 (/ML); MB9

77321; BRONCOFEDRIN ; BRONCOFEDRIN; NOT FOUND; XAR. 0.40 MG 100 ML x 1 (/ML); MB9

76368; BUPROVIL 600 ; BUPROVIL 600; NOT FOUND; CPR REVEST 600 MG x 200; MB9

64162; BRONFILIL ; BRONFILIL; NOT FOUND; XAR. AD 50 MG 120 ML x 1 (/5ML); MBR

64163; BRONFILIL ; BRONFILIL; NOT FOUND; XAR. INF 25 MG 120 ML x 1 (/5ML); MBR

69875; BMETRO+NIS+BENZ MG ; BMETRO NIS BENZ; NOT FOUND; CR.VAG.10APL 40 G x 1; MD7

83973; BECARVE ; BECARVE; NOT FOUND; CPR 6.25 MG x 30; MD7

1365; BENTYL ; BENTYL; NOT FOUND; GOTAS 20 MG 15 ML x 1 (/ML); MD7

59049; BES ANLODIPINO MG ; BES ANLODIPINO; BESILATO ANLODIPINO; CPR 10 MG x 30; MD7

62885; BROMOPRIDA MG ; BROMOPRIDA; BROMOPRIDA; CAPS 10 MG x 20; MD7

58820; BROMAZEPAM MG ; BROMAZEPAM; BROMAZEPAM; CPR 6 MG x 30; MD7

58821; BROMOPRIDA MG ; BROMOPRIDA; BROMOPRIDA; GOTAS 4 MG 20 ML x 1 (/ML); MD7

59047; BES ANLODIPINO MG ; BES ANLODIPINO; BESILATO ANLODIPINO; CPR 5 MG x 30; MD7

83978; BECARVE ; BECARVE; NOT FOUND; CPR 25 MG x 30; MD7

58819; BROMAZEPAM MG ; BROMAZEPAM; BROMAZEPAM; CPR 6 MG x 20; MD7

59048; BES ANLODIPINO MG ; BES ANLODIPINO; BESILATO ANLODIPINO; CPR 10 MG x 20; MD7

83975; BECARVE ; BECARVE; NOT FOUND; CPR 12.5 MG x 30; MD7

58823; BROMOPRIDA MG ; BROMOPRIDA; BROMOPRIDA; SOLN ORAL 1 MG 120 ML x 1 (/ML); MD7

115560; BIMATOPROSTA MG ; BIMATOPROSTA; BIMATOPROSTA; SOLN OFTAL 0.30 MG 3 ML x 1 (/ML); MD7

83980; BECARVE ; BECARVE; NOT FOUND; CPR 3.12 MG x 15; MD7

83974; BECARVE ; BECARVE; NOT FOUND; CPR 12.5 MG x 15; MD7

83972; BECARVE ; BECARVE; NOT FOUND; CPR 6.25 MG x 15; MD7

76690; BENESTARE ; BENESTARE; NOT FOUND; CPR REVEST 625 MG x 30; MD7

63892; BUTILB ES+D SOD MG ; BUTILB ES D SOD; NOT FOUND; GOTAS 20 ML x 1; MD7

58818; BROMAZEPAM MG ; BROMAZEPAM; BROMAZEPAM; CPR 3 MG x 30; MD7

61335; BETAMETASONA MG ; BETAMETASONA; BETAMETASONA; ELIXIR 0.10 MG 120 ML x 1 (/ML); MD7

83981; BECARVE ; BECARVE; NOT FOUND; CPR 3.12 MG x 30; MD7

58817; BROMAZEPAM MG ; BROMAZEPAM; BROMAZEPAM; CPR 3 MG x 20; MD7

59046; BES ANLODIPINO MG ; BES ANLODIPINO; BESILATO ANLODIPINO; CPR 5 MG x 20; MD7

83976; BECARVE ; BECARVE; NOT FOUND; CPR 25 MG x 15; MD7

64199; BOLDOBEBA ; BOLDOBEBA; NOT FOUND; FLACONETES 10 ML x 12; MDQ

86848; BOLDOBEBA ; BOLDOBEBA; NOT FOUND; FLACONETES 10 ML x 60; MDQ

44833; BOLDOBEBA ; BOLDOBEBA; NOT FOUND; LIQD 100 ML x 1; MDQ

67283; BICARBONATO SODIO ; BICARBONATO SODIO; BICARBONATO SODIO; PO 100 G x 1; MF_

72142; BUPICAN ; BUPICAN; NOT FOUND; F.AMP S/VAS 5 MG 20 ML x 1 (/ML); MIZ

115843; BARIVIT ; BARIVIT; NOT FOUND; CPR MAST MEN x 60; MJA

77503; BUONA ; BUONA; NOT FOUND; CAPS 60 MG x 10; MMF

99986; BART H ; BART H; NOT FOUND; CPR 300 MG x 30 (/12.); MMF

95667; BEUM ; BEUM; NOT FOUND; CPR REVEST 300 MG x 20; MMF

78470; BEUM ; BEUM; NOT FOUND; CPR REVEST 300 MG x 30; MMF

65154; BUONA ; BUONA; NOT FOUND; CAPS 60 MG x 30; MMF

99985; BART H ; BART H; NOT FOUND; CPR 150 MG x 30 (/12.); MMF

77045; BAMBAIR ; BAMBAIR; NOT FOUND; SOLN ORAL 1 MG 60 ML x 1 (/ML); MQF

80203; BLANCY ; BLANCY; NOT FOUND; GEL CREME 20 G x 1; MQF

75969; BAMBAIR ; BAMBAIR; NOT FOUND; SOLN ORAL 1 MG 120 ML x 1 (/ML); MQF

78190; BRIDION ; BRIDION; NOT FOUND; F AMP IV 200 MG 2 ML x 10; MSD

93228; BACTERIAN ; BACTERIAN; NOT FOUND; SOL ANT SEP 50 ML x 1; MUS

153536; BERINJELA ; BERINJELA; NOT FOUND; CAPS 450 MG x 60; MXU

61061; BORAG ; BORAG; NOT FOUND; CAPS GELATIN x 30; MYL

114508; BIOFLAN ; BIOFLAN; NOT FOUND; CPR REVE G R 250 MG x 30; MYL

46776; BIOHULIN NPH ; BIOHULIN NPH; NOT FOUND; F.AMP S.C 100 IU 10 ML x 1 (/ML); N_N

46778; BIOHULIN REGULAR ; BIOHULIN REGULAR; NOT FOUND; F.AMP S.C 100 IU 10 ML x 1 (/ML); N_N

58172; BAC-SULFITRIN ; BAC SULFITRIN; NOT FOUND; AMP. 480 MG 5 ML x 50; N_Q

53457; BUCLIMAX ; BUCLIMAX; NOT FOUND; SUSP ORAL 120 ML x 1; N_Q

85401; BROMAZEPAM MG ; BROMAZEPAM; BROMAZEPAM; CPR 6 MG x 30; N_Q

42459; BAC-SULFITRIN ; BAC SULFITRIN; NOT FOUND; CPR 400 MG x 20 (/80); N_Q

77546; BABYNEO PREVENT ; BABYNEO PREVENT; NOT FOUND; CREME DERM 45 G x 1; N_Q

73055; BRONDYNEO ; BRONDYNEO; NOT FOUND; XAR. PED. 25 MG 120 ML x 1 (/5ML); N_Q

57685; BETSONA ; BETSONA; NOT FOUND; POM. 1 MG 30 G x 1 (/G); N_Q

85399; BROMAZEPAM MG ; BROMAZEPAM; BROMAZEPAM; CPR 3 MG x 30; N_Q

73054; BRONDYNEO ; BRONDYNEO; NOT FOUND; XAR. AD 50 MG 120 ML x 1 (/5ML); N_Q

67281; BROMETO IPRATRO.MG ; BROMETO IPRATRO; BROMETO IPRATROPIO; SOLN INALT 0.25 MG 20 ML x 1 (; N_Q

74256; BABYNEO ; BABYNEO; NOT FOUND; POM. 60 G x 1; N_Q

52314; BENZOAX ; BENZOAX; NOT FOUND; SABAO 10 % 60 G x 1; N_Q

69828; BACTRONEO ; BACTRONEO; NOT FOUND; POM. 2 % 15 G x 1; N_Q

67279; BES ANLODIPINO MG ; BES ANLODIPINO; BESILATO ANLODIPINO; CPR 5 MG x 30; N_Q

85400; BROMAZEPAM MG ; BROMAZEPAM; BROMAZEPAM; CPR 6 MG x 20; N_Q

75553; BROMOPRIDA MG ; BROMOPRIDA; BROMOPRIDA; GOTAS 4 MG 20 ML x 1 (/ML); N_Q

57227; BROMIFEN ; BROMIFEN; NOT FOUND; GOTAS 20 ML x 1; N_Q

67280; BES ANLODIPINO MG ; BES ANLODIPINO; BESILATO ANLODIPINO; CPR 10 MG x 30; N_Q

56555; BECLONATO ; BECLONATO; NOT FOUND; AMP. 1 ML x 1; N_Q

85398; BROMAZEPAM MG ; BROMAZEPAM; BROMAZEPAM; CPR 3 MG x 20; N_Q

58675; BACTRONEO ; BACTRONEO; NOT FOUND; CREME 2 % 15 G x 1; N_Q

64726; BENZOILMETRONID.MG ; BENZOILMETRONID; NOT FOUND; SUSP ORAL 40 MG 80 ML x 1 (/ML); N_Q

84486; BONTOSS ; BONTOSS; NOT FOUND; XAR INF 0.80 MG 120 ML x 1 (/ML); N_Q

52313; BENZOAX ; BENZOAX; NOT FOUND; EMULS 25 % 100 ML x 1; N_Q

57684; BETSONA ; BETSONA; NOT FOUND; CREME 1 MG 30 G x 1 (/G); N_Q

84333; BONTOSS ; BONTOSS; NOT FOUND; XAR AD. 1.60 MG 120 ML x 1 (/ML); N_Q

76107; BUTALAB ; BUTALAB; NOT FOUND; XAR. 2 MG 120 ML x 50 (/5ML); NAU

72216; BIOSENG ; BIOSENG; NOT FOUND; CAPS STRES/P 250 MG x 30; NAU

102186; BIOSENG ; BIOSENG; NOT FOUND; CAPS 105 MG x 20; NAU

72215; BIOSENG ; BIOSENG; NOT FOUND; CAPS 100 MG x 30; NAU

70586; BUTALAB ; BUTALAB; NOT FOUND; XAR. 2 MG 100 ML x 1 (/5ML); NAU

87806; BEVITER ; BEVITER; NOT FOUND; CPR REVEST 300 MG x 30; NAU

69652; BRONQTRAT ; BRONQTRAT; NOT FOUND; XAR. AD 30 MG 100 ML x 50 (/5ML); NAU

76106; BRONQTRAT ; BRONQTRAT; NOT FOUND; XAR. AD 30 MG 120 ML x 50 (/5ML); NAU

93144; BRONQTRAT ; BRONQTRAT; NOT FOUND; XAR PED 3 MG 100 ML x 1 (/ML); NAU

78223; BIOSENG ; BIOSENG; NOT FOUND; CAPS 105 MG x 30; NAU

93148; BRONQTRAT ; BRONQTRAT; NOT FOUND; XAR. AD 6 MG 100 ML x 1 (/ML); NAU

65280; BRONCOMIX ; BRONCOMIX; NOT FOUND; XAR. 2 MG 120 ML x 1 (/5ML); NCK

62520; BES ANLODIPINO MG ; BES ANLODIPINO; BESILATO ANLODIPINO; CPR 10 MG x 30; NQA

62519; BES ANLODIPINO MG ; BES ANLODIPINO; BESILATO ANLODIPINO; CPR 5 MG x 30; NQA

123844; BIMATOPROSTA MG ; BIMATOPROSTA; BIMATOPROSTA; SOLN OFTAL 0.30 MG 5 ML x 1 (/ML); NQA

145106; BIMATOPROSTA MG ; BIMATOPROSTA; BIMATOPROSTA; SOLN OFTAL 0.30 MG 3 ML x 1 (/ML); NQA

69909; BROMOPRIDA MG ; BROMOPRIDA; BROMOPRIDA; GOTAS 4 MG 20 ML x 1 (/ML); NQA

79001; BROMETO IPRATO MG ; BROMETO IPRATO; NOT FOUND; SOLN INALT 0.25 MG 20 ML x 1 (/; NQA

57182; BENEFIBER ; BENEFIBER; NOT FOUND; PO.SACHET 5 G x 10; NV1

76825; BENEFIBER NF ; BENEFIBER NF; NOT FOUND; KIT PO+CAN 155 G x 1; NV1

61657; BUFFERIN CARDIO ; BUFFERIN CARDIO; NOT FOUND; CPR 81 MG x 30; NV1

57181; BENEFIBER ; BENEFIBER; NOT FOUND; PO.LATA 200 G x 1; NV1

74895; BENEFIBER NF ; BENEFIBER NF; NOT FOUND; SACHET STICK 3.50 G x 10; NV1

74894; BENEFIBER NF ; BENEFIBER NF; NOT FOUND; SACHET STICK 3.50 G x 28; NV1

52264; BUFFERIN ; BUFFERIN; NOT FOUND; CPR REVEST 500 MG x 30; NV1

73085; BENEFIBER NF ; BENEFIBER NF; NOT FOUND; POTE 155 G x 1; NV1

56107; BUFFERIN ; BUFFERIN; NOT FOUND; CPR RE.AL/AL 500 MG x 200; NV1

74896; BENZORAL ; BENZORAL; NOT FOUND; SPRAY 30 ML x 1; NV7

75551; BROM.PANCURONIO MG ; BROM PANCURONIO; BROMETO PANCURONIO; AMP. 2 MG 2 ML x 50 (/ML); NVA

69595; BIOZATIN ; BIOZATIN; NOT FOUND; F.AMP 1200 K x 50; NVA

69594; BIOZATIN ; BIOZATIN; NOT FOUND; F.AMP 600 K x 50; NVA

76692; BROMOPRIDA MG ; BROMOPRIDA; BROMOPRIDA; AMP. 5 MG 2 ML x 50 (/ML); NVA

78438; BESIL.ATRACURIO MG ; BESIL ATRACURIO; BESILATO ATRACURIO; A.IV 10 MG 2.50 ML x 25 (/ML); NVA

78166; BESIL.ATRACURIO MG ; BESIL ATRACURIO; BESILATO ATRACURIO; A.IV 10 MG 5 ML x 25 (/ML); NVA

94278; BROM.ROCURONIO MG ; BROM ROCURONIO; BROMETO ROCURONIO; F AMP IV 10 MG 5 ML x 10 (/ML); NVA

1868; BUTAZOLIDINA ; BUTAZOLIDINA; NOT FOUND; AMP. 600 MG 3 ML x 5; NVR

46483; BUSPANIL ; BUSPANIL; NOT FOUND; CPR 5 MG x 20; NVR

1870; BUTAZOLIDINA ; BUTAZOLIDINA; NOT FOUND; DRAG 200 MG x 20; NVR

65452; BIPROSLAN ; BIPROSLAN; NOT FOUND; AMP. 4 MG 1 ML x 1; P7B

84737; BISOLPHAR ; BISOLPHAR; NOT FOUND; XAR.PED 0.80 MG 120 ML x 1 (/ML); P7B

76959; BIPROSLAN ; BIPROSLAN; NOT FOUND; AMP. 5 MG 1 ML x 50 (/2); P7B

89254; BISOLPHAR ; BISOLPHAR; NOT FOUND; XAR AD. 1.60 MG 120 ML x 1 (/ML); P7B

98557; BUSILVEX ; BUSILVEX; NOT FOUND; F AMP . 6 MG 10 ML x 8 (/ML); P_F

148331; BERINJELA ; BERINJELA; NOT FOUND; CAPS 300 MG x 60; PEI

62840; BEXTRA ; BEXTRA; NOT FOUND; F.AMP S/DILU 40 MG x 10; PFZ

62839; BEXTRA ; BEXTRA; NOT FOUND; F.AMP C/DILU 40 MG x 1; PFZ

131828; BERINJELA ; BERINJELA; NOT FOUND; CAPS 300 MG x 50; PKS

67343; BENZODERM ; BENZODERM; NOT FOUND; SABAO 60 G x 1; PLB

70745; BIOHEPATON ; BIOHEPATON; NOT FOUND; FLACONETES 10 ML x 12; PLB

70748; BIOHEPATON ; BIOHEPATON; NOT FOUND; LIQD 150 ML x 1; PLB

70463; BIOFORTONICO ; BIOFORTONICO; NOT FOUND; SOLN ORAL 500 ML x 1; PLB

70746; BIOHEPATON ; BIOHEPATON; NOT FOUND; FLACONETES 10 ML x 60; PLB

84470; BABYTOL ; BABYTOL; NOT FOUND; POM. 500 MG 30 G x 1 (/G); PLB

67344; BENZODERM ; BENZODERM; NOT FOUND; LOC. 100 ML x 1; PLB

1828; BUCLIFEN VIT ; BUCLIFEN VIT; NOT FOUND; CPR x 20; PRB

1829; BUCLIFEN VIT ; BUCLIFEN VIT; NOT FOUND; SUSP 100 ML x 1; PRB

63916; BABY BALM ; BABY BALM; NOT FOUND; UNGT 30 G x 1; PRG

63074; BUTILB ES+D SOD MG ; BUTILB ES D SOD; NOT FOUND; GOTAS 10 ML x 200; PZ8

107737; BENZOILMETRONID MG ; BENZOILMETRONID; NOT FOUND; SUSP ORAL 40 MG 80 ML x 50 (/ML; PZ8

64624; BROMOPRIDA MG ; BROMOPRIDA; BROMOPRIDA; SOLN ORAL 1 MG 120 ML x 1 (/ML); PZ8

64622; BROMETO IPRATRO.MG ; BROMETO IPRATRO; BROMETO IPRATROPIO; SOLN INALT 0.25 MG 20 ML x 1; PZ8

66258; BUTILB ESCOPOLA MG ; BUTILB ESCOPOLA; BUTILBROMETO ESCOPOLAMINA; GOTAS 10 MG 20 ML x 200 (/ML); PZ8

64618; BETAMETASONA MG ; BETAMETASONA; BETAMETASONA; GOTAS 0.50 MG 15 ML x 1 (/ML); PZ8

95439; BROMOPRIDA MG ; BROMOPRIDA; BROMOPRIDA; CPR 10 MG x 120; PZ8

73539; BROMOPRIDA MG ; BROMOPRIDA; BROMOPRIDA; CPR 10 MG x 20; PZ8

75271; BES ANLODIPINO MG ; BES ANLODIPINO; BESILATO ANLODIPINO; CPR 5 MG x 20; PZ8

73873; BROMOPRIDA MG ; BROMOPRIDA; BROMOPRIDA; CPR 10 MG x 800; PZ8

69448; BROM.FENOTEROL MG ; BROM FENOTEROL; NOT FOUND; GOTAS 5 MG 20 ML x 200 (/ML); PZ8

64623; BROMETO IPRATRO.MG ; BROMETO IPRATRO; BROMETO IPRATROPIO; SOLN INALT 0.25 MG 20 ML x 200; PZ8

63072; BUTILB ES+D SOD MG ; BUTILB ES D SOD; NOT FOUND; GOTAS 20 ML x 1; PZ8

90259; BES ANLODIPINO MG ; BES ANLODIPINO; BESILATO ANLODIPINO; CPR 10 MG x 400; PZ8

64617; BETAMETASONA MG ; BETAMETASONA; BETAMETASONA; ELIXIR 0.50 MG 120 ML x 1 (/5ML); PZ8

76919; BENZIDROL ; BENZIDROL; NOT FOUND; SPRAY MENTA 1.50 MG 30 ML x 1 (/ML); PZ8

66259; BUTILB ESCOPOLA MG ; BUTILB ESCOPOLA; BUTILBROMETO ESCOPOLAMINA; GOTAS 10 MG 10 ML x 200 (/ML); PZ8

67447; BROM.FENOTEROL MG ; BROM FENOTEROL; NOT FOUND; GOTAS 5 MG 20 ML x 1 (/ML); PZ8

77189; BES ANLODIPINO MG ; BES ANLODIPINO; BESILATO ANLODIPINO; CPR 10 MG x 30; PZ8

73235; BMETRO+NIS+BENZ MG ; BMETRO NIS BENZ; NOT FOUND; CR.VAG.10APL 40 G x 1; PZ8

74465; BENZOILMETRONID MG ; BENZOILMETRONID; NOT FOUND; SUSP ORAL 40 MG 100 ML x 1 (/ML; PZ8

75272; BES ANLODIPINO MG ; BES ANLODIPINO; BESILATO ANLODIPINO; CPR 5 MG x 30; PZ8

64626; BROMOPRIDA MG ; BROMOPRIDA; BROMOPRIDA; GOTAS 4 MG 20 ML x 1 (/ML); PZ8

74466; BENZOILMETRONID MG ; BENZOILMETRONID; NOT FOUND; SUSP ORAL 40 MG 120 ML x 1 (/ML; PZ8

66260; BUTILB ESCOPOLA MG ; BUTILB ESCOPOLA; BUTILBROMETO ESCOPOLAMINA; GOTAS 10 MG 20 ML x 1 (/ML); PZ8

70585; BROMOPRIDA MG ; BROMOPRIDA; BROMOPRIDA; GOTAS 4 MG 20 ML x 200 (/ML); PZ8

89603; BEBE TESTE ; BEBE TESTE; NOT FOUND; TIRA TESTE x 1; QML

60951; BES ANLODIPINO MG ; BES ANLODIPINO; BESILATO ANLODIPINO; CPR 5 MG x 30; RBY

60952; BES ANLODIPINO MG ; BES ANLODIPINO; BESILATO ANLODIPINO; CPR 10 MG x 30; RBY

1155; BAICURU ; BAICURU; NOT FOUND; ELIXIR 150 ML x 1; REU

48527; BACTRIM-F ; BACTRIM F; NOT FOUND; SUSP 400 MG 100 ML x 1 (/80M); ROC

1152; BACTRIM ; BACTRIM; NOT FOUND; SUSP 200 MG 100 ML x 1 (/40M); ROC

31853; BACTRIM-F ; BACTRIM F; NOT FOUND; CPR 800 MG x 10 (/160); ROC

31695; BACTRIM ; BACTRIM; NOT FOUND; A.IV 400 MG 5 ML x 50 (/80M); ROC

69378; BONVIVA ; BONVIVA; NOT FOUND; CPR REVEST 150 MG x 1; ROC

1149; BACTRIM ; BACTRIM; NOT FOUND; CPR 400 MG x 20 (/80); ROC

76070; BONVIVA ; BONVIVA; NOT FOUND; SER.PRELL 3 MG 3 ML x 1; ROC

88319; BICARBONATO DE SOD ; BICARBONATO SOD; BICARBONATO SODIO; PO 100 G x 1; RQQ

70114; BICARBONATO SODIO ; BICARBONATO SODIO; BICARBONATO SODIO; PO 100 G x 1; RVI

117281; BRILUX ; BRILUX; NOT FOUND; GEL ALCO LAV 500 G x 1; RYF

117280; BRILUX ; BRILUX; NOT FOUND; GEL ALCOOL 500 G x 1; RYF

144367; BIOPOLIMAX SIL 50+ ; BIOPOLIMAX SIL 50; NOT FOUND; CAPS A-Z 1350 MG x 60; S5R

138837; BIPOLIMAX A-Z ; BIPOLIMAX A Z; NOT FOUND; CAPS 1250 MG x 60; S5R

76525; BENOFLEX P ; BENOFLEX P; NOT FOUND; CPR x 200; S_A

155058; BGSTAR ; BGSTAR; NOT FOUND; TIRAS TESTE x 50; S_A

155055; BGSTAR ; BGSTAR; NOT FOUND; MON GL S/T x 1; S_A

51534; BI-PROFENID ; BI PROFENID; NOT FOUND; CPR 150 MG x 10; S_A

86088; BENOFLEX P ; BENOFLEX P; NOT FOUND; CPR x 120; S_A

76524; BENOFLEX P ; BENOFLEX P; NOT FOUND; CPR x 12; S_A

155057; BGSTAR ; BGSTAR; NOT FOUND; LANCETAS x 100; S_A

155056; BGSTAR ; BGSTAR; NOT FOUND; DISPO S/T x 1; S_A

1830; BUCLINA ; BUCLINA; NOT FOUND; CPR 25 MG x 20; S_A

74581; BENZOILMETRONID.MG ; BENZOILMETRONID; NOT FOUND; SUSP PED 40 MG 100 ML x 1 (/ML); S_A

1393; BENZO-GYNOEST A.P. ; BENZO GYNOEST A P; NOT FOUND; AMP. 5 MG 1 ML x 2; S_A

73718; BROMAZEPAM MG ; BROMAZEPAM; BROMAZEPAM; CPR 3 MG x 30; SDZ

61240; BES ANLODIPINO MG ; BES ANLODIPINO; BESILATO ANLODIPINO; CPR 10 MG x 30; SDZ

61237; BES ANLODIPINO MG ; BES ANLODIPINO; BESILATO ANLODIPINO; CPR 5 MG x 20; SDZ

63848; BINKO ; BINKO; NOT FOUND; CPR REVEST 80 MG x 60; SDZ

62063; BINKO ; BINKO; NOT FOUND; CPR REVEST 80 MG x 20; SDZ

71818; BINKO ; BINKO; NOT FOUND; CPR REVEST 80 MG x 30; SDZ

77964; BONEPREV ; BONEPREV; NOT FOUND; CPR REVEST 70 MG x 4; SDZ

73716; BROMAZEPAM MG ; BROMAZEPAM; BROMAZEPAM; CPR 6 MG x 30; SDZ

62062; BINKO ; BINKO; NOT FOUND; CPR REVEST 120 MG x 20; SDZ

61238; BES ANLODIPINO MG ; BES ANLODIPINO; BESILATO ANLODIPINO; CPR 5 MG x 30; SDZ

73717; BROMAZEPAM MG ; BROMAZEPAM; BROMAZEPAM; CPR 6 MG x 20; SDZ

73871; BROMALEX ; BROMALEX; NOT FOUND; CPR 3 MG x 30; SDZ

73719; BROMAZEPAM MG ; BROMAZEPAM; BROMAZEPAM; CPR 3 MG x 20; SDZ

73872; BROMALEX ; BROMALEX; NOT FOUND; CPR 6 MG x 30; SDZ

132938; BENZOCID ; BENZOCID; NOT FOUND; EMULSAO TOP 25 % 100 ML x 1; SEZ

101769; BLEMISH+AGE DEFENS ; BLEMISH AGE DEFENS; NOT FOUND; LIQ 30 ML x 1; SK9

161195; BLEMISH-AGE SOLUTI ; BLEMISH AGE SOLUTI; NOT FOUND; SOL ESFOL 400 ML x 1; SK9

57842; BROMOXON ; BROMOXON; NOT FOUND; CPR 6 MG x 20; SNV

55181; BARBITRON ; BARBITRON; NOT FOUND; SOLN ORAL 40 MG 20 ML x 1 (/ML); SNV

49302; BACTRISAN ; BACTRISAN; NOT FOUND; CPR 400 MG x 20 (/80); SNV

57841; BROMOXON ; BROMOXON; NOT FOUND; CPR 3 MG x 20; SNV

43866; BACTRISAN ; BACTRISAN; NOT FOUND; SUSP 240 MG 50 ML x 1 (/5ML); SNV

54824; BENZOTISAN ; BENZOTISAN; NOT FOUND; LIQD 25 % 100 ML x 1; SNV

76635; BENZOTISAN ; BENZOTISAN; NOT FOUND; LIQD 25 % 60 ML x 1; SNV

48984; BARBITRON ; BARBITRON; NOT FOUND; CPR 100 MG x 20; SNV

66682; BENZOBEN ; BENZOBEN; NOT FOUND; LIQD TOP. 60 ML x 1; SOB

78374; BACSULFAPRIM ; BACSULFAPRIM; NOT FOUND; SUSP 240 MG 50 ML x 1 (/5ML); SOB

66808; BACSULFAPRIM ; BACSULFAPRIM; NOT FOUND; CPR 400 MG x 20 (/80); SOB

67640; BENZOBEN ; BENZOBEN; NOT FOUND; LIQD TOP. 60 ML x 100; SOB

66810; BACSULFAPRIM ; BACSULFAPRIM; NOT FOUND; SUSP 240 MG 100 ML x 1 (/5ML); SOB

59869; BIOFLAC ; BIOFLAC; NOT FOUND; CPR 7.50 MG x 10; SP0

61353; BENZETACIL ; BENZETACIL; NOT FOUND; SUSP INJ. 1200 K 4 ML x 10; SP0

59870; BIOFLAC ; BIOFLAC; NOT FOUND; CPR 15 MG x 10; SP0

93550; BENZETACIL ; BENZETACIL; NOT FOUND; SUSP INJ. 1200 K 4 ML x 1; SP0

59868; BIOFLAC ; BIOFLAC; NOT FOUND; AMP. 15 MG 1.50 ML x 5; SP0

64540; BIOFLAC ; BIOFLAC; NOT FOUND; A.IM+SER. 15 MG 1.50 ML x 1; SP0

61354; BENZETACIL ; BENZETACIL; NOT FOUND; SUSP INJ. 600 K 4 ML x 10; SP0

43960; BABIX ; BABIX; NOT FOUND; CREME 60 G x 1; STF

1492; BETNOVATE ; BETNOVATE; NOT FOUND; CREME 1 MG 15 G x 1 (/G); STF

1502; BETNOVATE N ; BETNOVATE N; NOT FOUND; CREME 30 G x 1; STF

48731; BABIX ; BABIX; NOT FOUND; XAMP 200 ML x 1; STF

48261; BETNOVATE ; BETNOVATE; NOT FOUND; SOLN CAPIL 1 MG 50 G x 1 (/ML); STF

47984; BETADERM ; BETADERM; NOT FOUND; LOC.CAPILAR 1 MG 60 ML x 1 (/ML); STF

48032; BETNOVATE ; BETNOVATE; NOT FOUND; LOC. 1 MG 50 G x 1 (/ML); STF

1489; BETNOVATE ; BETNOVATE; NOT FOUND; CREME 1 MG 30 G x 1 (/G); STF

47983; BETADERM ; BETADERM; NOT FOUND; CREME 1 MG 30 G x 1 (/G); STF

48262; BETNOVATE Q ; BETNOVATE Q; NOT FOUND; CREME 5 MG 30 G x 1; STF

51156; BETADERM N ; BETADERM N; NOT FOUND; CREM.BISNAGA 30 G x 1; STF

1495; BETNOVATE ; BETNOVATE; NOT FOUND; POM. 1 MG 30 G x 1 (/G); STF

1509; BETNOVATE N ; BETNOVATE N; NOT FOUND; POM. 30 G x 1; STF

48031; BETADERM ; BETADERM; NOT FOUND; POM. 1 MG 30 G x 1 (/G); STF

51077; BABIX ; BABIX; NOT FOUND; SABAO 100 G x 1; STF

1496; BETNOVATE ; BETNOVATE; NOT FOUND; POM. 1 MG 15 G x 1 (/G); STF

48945; BABIX ; BABIX; NOT FOUND; CREME EMOLIE 200 ML x 1; STF

76937; BICARBONATO SODIO ; BICARBONATO SODIO; BICARBONATO SODIO; A.IV 8.40 % 10 ML x 200; STT

48664; BALS.ALEM.NOHASCHE ; BALS ALEM NOHASCHE; NOT FOUND; SOL TOP INAL 10 ML x 1; SUD

54821; BENZO-BRAS ; BENZO BRAS; NOT FOUND; SABAO 50 G x 1; SUD

82226; BETA CAROTENO ; BETA CAROTENO; NOT FOUND; CAPS 6 K x 60; SUV

112619; BCAA ; BCAA; NOT FOUND; CAPS SOFTGEL 800 MG x 120; SUV

76282; B COMPLEX ; B COMPLEX; NOT FOUND; CPR x 180; SUV

56357; B COMPLEX ; B COMPLEX; NOT FOUND; CPR x 100; SUV

53217; BRONCHO VAXOM ; BRONCHO VAXOM; NOT FOUND; CAPS 7 MG x 10 (ADLT); TAK

53216; BRONCHO VAXOM ; BRONCHO VAXOM; NOT FOUND; CAPS 3.50 MG x 10 (INF); TAK

80120; BRONCHO VAXOM ; BRONCHO VAXOM; NOT FOUND; CAPS 7 MG x 30 (ADLT); TAK

77980; BRONCHO VAXOM ; BRONCHO VAXOM; NOT FOUND; SACHET. 3.50 MG x 30 (INF); TAK

89044; BRATOR ; BRATOR; NOT FOUND; CPR REVEST 80 MG x 30; TNT

89051; BRATOR H ; BRATOR H; NOT FOUND; CPR REVEST 80 MG x 10 (/12.); TNT

89056; BRATOR H ; BRATOR H; NOT FOUND; CPR REVEST 320 MG x 30 (/25); TNT

75777; BRANTA ; BRANTA; NOT FOUND; CPR REVEST 50 MG x 30 (/5); TNT

89055; BRATOR H ; BRATOR H; NOT FOUND; CPR REVEST 80 MG x 30 (/12.); TNT

89046; BRATOR ; BRATOR; NOT FOUND; CPR REVEST 160 MG x 30; TNT

69220; BETACARD PLUS ; BETACARD PLUS; NOT FOUND; CPR 25 MG x 30 (/100); TNT

89058; BRATOR H ; BRATOR H; NOT FOUND; CPR REVEST 160 MG x 30 (/12.); TNT

89059; BRATOR H ; BRATOR H; NOT FOUND; CPR REVEST 160 MG x 30 (/25); TNT

89048; BRATOR ; BRATOR; NOT FOUND; CPR REVEST 320 MG x 30; TNT

89061; BRATOR H ; BRATOR H; NOT FOUND; CPR REVEST 320 MG x 30 (/12.); TNT

69219; BETACARD PLUS ; BETACARD PLUS; NOT FOUND; CPR 12.5 MG x 30 (/50); TNT

136119; BERINJELA ; BERINJELA; NOT FOUND; CAP 60+10G x 70; TRJ

72780; BROMAZEPAM MG ; BROMAZEPAM; BROMAZEPAM; CPR 6 MG x 30; TTB

72845; BROMAZEPAM MG ; BROMAZEPAM; BROMAZEPAM; CPR 3 MG x 100; TTB

148478; BIOLENN ; BIOLENN; NOT FOUND; CAPS GEL x 90; TTB

48095; BACTERACIN ; BACTERACIN; NOT FOUND; CPR 400 MG x 12 (/80); TTB

53149; BENZAPEN G ; BENZAPEN G; NOT FOUND; F.AMP LIOF 400 K 2 ML x 50; TTB

74499; BROMETO IPRATRO.MG ; BROMETO IPRATRO; BROMETO IPRATROPIO; SOLN INALT 0.25 MG 20 ML x 100; TTB

56253; BUTILB ESCOPOLA MG ; BUTILB ESCOPOLA; BUTILBROMETO ESCOPOLAMINA; AMP. 20 MG 1 ML x 6 (/ML); TTB

68407; BROMETO IPRATRO.MG ; BROMETO IPRATRO; BROMETO IPRATROPIO; SOLN INALT 0.25 MG 20 ML x 1 (; TTB

65526; BROMOPRIDA MG ; BROMOPRIDA; BROMOPRIDA; GOTAS 4 MG 20 ML x 1 (/ML); TTB

76547; BROM.FENOTEROL MG ; BROM FENOTEROL; NOT FOUND; GOTAS 5 MG 20 ML x 100 (/ML); TTB

53147; BEPEBEN ; BEPEBEN; NOT FOUND; F.AMP LIOF 600 K x 50; TTB

53081; BENEVAT ; BENEVAT; NOT FOUND; CREME 1 MG 30 G x 1 (/G); TTB

67891; BENZOILMETRONID.MG ; BENZOILMETRONID; NOT FOUND; SUSP ORAL 40 MG 100 ML x 1 (/ML; TTB

48948; BACTERACIN ; BACTERACIN; NOT FOUND; SUSP 480 MG 100 ML x 1 (/5ML); TTB

52420; BENCOCAN ; BENCOCAN; NOT FOUND; LIQD 25 % 100 ML x 1; TTB

52181; BACLOFEN ; BACLOFEN; NOT FOUND; CPR 10 MG x 20; TTB

53082; BENEVAT ; BENEVAT; NOT FOUND; POM. 1 MG 30 G x 1 (/G); TTB

80423; BIO SOAK ; BIO SOAK; NOT FOUND; KIT 360+120 480 ML x 1; TTB

109734; BIO SOAK ; BIO SOAK; NOT FOUND; SOL OFTAL 120 ML x 1; TTB

109736; BIO SOAK ; BIO SOAK; NOT FOUND; SOL OFTAL 60 ML x 1; TTB

104616; BROM PINAVERIO MG ; BROM PINAVERIO; BROMETO PINAVERIO; CPR REV 50 MG x 60; TTB

72778; BROMAZEPAM MG ; BROMAZEPAM; BROMAZEPAM; CPR 3 MG x 30; TTB

61288; BES ANLODIPINO MG ; BES ANLODIPINO; BESILATO ANLODIPINO; CPR 5 MG x 20; TTB

71843; BENEUM ; BENEUM; NOT FOUND; CPR REVEST 300 MG x 50; TTB

76546; BROM.FENOTEROL MG ; BROM FENOTEROL; NOT FOUND; GOTAS 5 MG 20 ML x 1 (/ML); TTB

74039; BEPEBEN ; BEPEBEN; NOT FOUND; F.AMP S/DILU 600 K x 50; TTB

69376; BENZAPEN G ; BENZAPEN G; NOT FOUND; F.AMP S/DILU 400 K x 50; TTB

32628; BRONTOSS ; BRONTOSS; NOT FOUND; XAR. 100 ML x 1; TTB

72777; BROMAZEPAM MG ; BROMAZEPAM; BROMAZEPAM; CPR 3 MG x 20; TTB

104614; BROM PINAVERIO MG ; BROM PINAVERIO; BROMETO PINAVERIO; CPR REV 50 MG x 20; TTB

53148; BEPEBEN ; BEPEBEN; NOT FOUND; F.AMP LIOF 1.20 M 4 ML x 50; TTB

48947; BACTERACIN ; BACTERACIN; NOT FOUND; CPR 800 MG x 10 (/160); TTB

62802; BENEUM ; BENEUM; NOT FOUND; CPR REVEST 300 MG x 30; TTB

72846; BROMAZEPAM MG ; BROMAZEPAM; BROMAZEPAM; CPR 6 MG x 100; TTB

104615; BROM PINAVERIO MG ; BROM PINAVERIO; BROMETO PINAVERIO; CPR REV 50 MG x 30; TTB

72578; BEPEBEN ; BEPEBEN; NOT FOUND; F.AMP S/DILU 1.20 M x 50; TTB

78200; BES ANLODIPINO MG ; BES ANLODIPINO; BESILATO ANLODIPINO; CPR 10 MG x 30; TTB

