49539, EXPECTUSS , EXPECTUSS, NOT FOUND, XAR. INF 15 MG 100 ML x 1 (/5ML), E3S

69674, ESPIRONOLACTONA MG , ESPIRONOLACTONA, ESPIRONOLACTONA, CPR 50 MG x 60, E3S

78469, EMSEXPECTOR , EMSEXPECTOR, NOT FOUND, XAR. 120 ML x 1, E3S

52872, EMIDRAT , EMIDRAT, NOT FOUND, SOLN GUARANA 500 ML x 1, E3S

60377, ESTRINOLON , ESTRINOLON, NOT FOUND, DRAG 0.625 MG x 28, E3S

70599, EXPECDILAT , EXPECDILAT, NOT FOUND, XPE INF. 25 MG 120 ML x 1 (/5ML), E3S

52088, ENERGIL C , ENERGIL C, NOT FOUND, ROSE HIPS 1 G x 10, E3S

77681, ENERGIL ZINCO , ENERGIL ZINCO, NOT FOUND, CPR EFERV 1 G x 30 (/10), E3S

103031, ESOMEX , ESOMEX, NOT FOUND, CPR REVEST 40 MG x 28, E3S

3773, EMISTIN , EMISTIN, NOT FOUND, ELIXIR 1 MG 100 ML x 1 (/0.5), E3S

51813, ECTRIN , ECTRIN, NOT FOUND, SUSP 240 MG 100 ML x 1 (/5ML), E3S

71963, ENERGIL C , ENERGIL C, NOT FOUND, GOTAS 200 MG 20 ML x 1 (/ML), E3S

76474, ENERGIL C , ENERGIL C, NOT FOUND, CPR EFER 1 G x 30, E3S

75203, ENERGIL C AMINO , ENERGIL C AMINO, NOT FOUND, CPR EFERV 1 G x 16, E3S

33419, EMICILIN , EMICILIN, NOT FOUND, CPR 500 MG x 12, E3S

63156, ESPASMO DIMETILIV , ESPASMO DIMETILIV, NOT FOUND, GOTAS 20 ML x 1, E3S

68105, ESPIRONOLACTONA MG , ESPIRONOLACTONA, ESPIRONOLACTONA, CPR 100 MG x 30, E3S

58396, ENDCOFF , ENDCOFF, NOT FOUND, PAST MENTA x 12, E3S

56838, ENERGIL C , ENERGIL C, NOT FOUND, CPR EF.S/ACU 1 G x 10, E3S

71266, EUPROSTATIN , EUPROSTATIN, NOT FOUND, CPR 2 MG x 90, E3S

68104, ESPIRONOLACTONA MG , ESPIRONOLACTONA, ESPIRONOLACTONA, CPR 100 MG x 16, E3S

128818, ESOGASTRO , ESOGASTRO, NOT FOUND, CPR REVEST 20 MG x 28, E3S

100444, ESCILEX , ESCILEX, NOT FOUND, CPR REV . 10 MG x 30, E3S

130542, ESOGASTRO , ESOGASTRO, NOT FOUND, CPR REVEST 40 MG x 28, E3S

53233, EMISTIN , EMISTIN, NOT FOUND, CREME 20 G x 1, E3S

60101, ENERGIL C , ENERGIL C, NOT FOUND, CPR A/P x 20, E3S

60032, EMSGRIP , EMSGRIP, NOT FOUND, SACH.MACA/CA 5 G x 50, E3S

49540, EXPECTUSS , EXPECTUSS, NOT FOUND, XAR. AD 30 MG 100 ML x 1 (/5ML), E3S

63842, ESPIRONOLACTONA MG , ESPIRONOLACTONA, ESPIRONOLACTONA, CPR 50 MG x 30, E3S

85986, ELO , ELO, NOT FOUND, CPR REVEST x 21, E3S

57987, EMSGRIP , EMSGRIP, NOT FOUND, SACH.MEL/LIM 5 G x 50, E3S

103034, ESOMEX , ESOMEX, NOT FOUND, CPR REVEST 20 MG x 14, E3S

62452, ESTRINOLON , ESTRINOLON, NOT FOUND, DRAG 0.625 MG x 21, E3S

62451, EMIDRAT , EMIDRAT, NOT FOUND, SOLN CEREJA 500 ML x 1, E3S

3780, EMS EXPECTORANTE , EMS EXPECTORANTE, NOT FOUND, XAR. 100 ML x 1, E3S

71265, EUPROSTATIN , EUPROSTATIN, NOT FOUND, CPR 2 MG x 30, E3S

103033, ESOMEX , ESOMEX, NOT FOUND, CPR REVEST 20 MG x 28, E3S

100446, ESCILEX , ESCILEX, NOT FOUND, CPR REV . 10 MG x 15, E3S

137507, ESCILEX , ESCILEX, NOT FOUND, CPR REV . 10 MG x 60, E3S

51357, ENERGIL C , ENERGIL C, NOT FOUND, CPR MASC 0.50 G x 20, E3S

3772, EMISTIN , EMISTIN, NOT FOUND, CPR 1 MG x 20 (/0.5), E3S

50236, ENERGIL C , ENERGIL C, NOT FOUND, CPR EFER 1 G x 10, E3S

58395, ENDCOFF , ENDCOFF, NOT FOUND, PAST MEL LIM x 12, E3S

33197, ECTRIN , ECTRIN, NOT FOUND, CPR 400 MG x 20 (/80), E3S

82221, ENTARKIN , ENTARKIN, NOT FOUND, CPR REVEST 200 MG x 30, E3S

63655, ESPIRONOLACTONA MG , ESPIRONOLACTONA, ESPIRONOLACTONA, CPR 25 MG x 30, E3S

52089, ENERGIL C EFERVESC , ENERGIL C EFERVESC, NOT FOUND, ROSE HIPS 2 G x 10, E3S

62778, E-TABS , E TABS, NOT FOUND, CAPS 400 IU x 30, E3S

33067, EXPECTOCILIN , EXPECTOCILIN, NOT FOUND, F.AMP LIOF 500 MG x 1 (ADLT), E3S

155031, ENERGIL LIFE , ENERGIL LIFE, NOT FOUND, CPR REV x 30, E3S

51814, ECTRIN BALSAMICO , ECTRIN BALSAMICO, NOT FOUND, SUSP 100 ML x 1, E3S

51356, ENERGIL C EFERVESC , ENERGIL C EFERVESC, NOT FOUND, CPR EFER 2 G x 10, E3S

161179, ESCILEX , ESCILEX, NOT FOUND, CPR REV 15 MG x 30, E3S

100447, ESCILEX , ESCILEX, NOT FOUND, CPR REV . 20 MG x 30, E3S

103032, ESOMEX , ESOMEX, NOT FOUND, CPR REVEST 40 MG x 14, E3S

62779, E-TABS , E TABS, NOT FOUND, CAPS 1000 IU x 30, E3S

100139, ESOMEPRAZOL MAG MG , ESOMEPRAZOL MAG, ESOMEPRAZOL MAGNESICO, CPR REVEST 40 MG x 14, E3S

60376, ESTRINOLON , ESTRINOLON, NOT FOUND, CREME VAG. 0.62 MG 25 G x 1 (/G), E3S

70598, EXPECDILAT , EXPECDILAT, NOT FOUND, XPE ADLT 50 MG 120 ML x 1 (/5ML), E3S

58394, ENDCOFF , ENDCOFF, NOT FOUND, PAST FRAMBUE x 12, E3S

154091, ESOGASTRO IBP , ESOGASTRO IBP, NOT FOUND, KIT 7X8+28 x 84, E3S

100136, ESOMEPRAZOL MAG MG , ESOMEPRAZOL MAG, ESOMEPRAZOL MAGNESICO, CPR REVEST 40 MG x 28, E3S

63656, ESPIRONOLACTONA MG , ESPIRONOLACTONA, ESPIRONOLACTONA, CPR 100 MG x 15, E3S

100137, ESOMEPRAZOL MAG MG , ESOMEPRAZOL MAG, ESOMEPRAZOL MAGNESICO, CPR REVEST 20 MG x 14, E3S

56839, ENERGIL C EFERVESC , ENERGIL C EFERVESC, NOT FOUND, CPR EF.S/ACU 2 G x 10, E3S

100138, ESOMEPRAZOL MAG MG , ESOMEPRAZOL MAG, ESOMEPRAZOL MAGNESICO, CPR REVEST 20 MG x 28, E3S

77680, ENERGIL ZINCO , ENERGIL ZINCO, NOT FOUND, CPR EFERV 1 G x 10 (/10), E3S

59483, EMSCORT , EMSCORT, NOT FOUND, CREME 30 G x 1, E3S

30904, EUCIL , EUCIL, NOT FOUND, GOTAS 10 ML x 1 (INF), FAS

27746, EUCIL , EUCIL, NOT FOUND, SUP INF 5 MG x 5, FAS

45800, ELUM , ELUM, NOT FOUND, CPR 2 MG x 20, FAS

3890, ENZICOBA , ENZICOBA, NOT FOUND, MICROCOMPRID 1 MG x 40, FAS

4149, EUCIL , EUCIL, NOT FOUND, XAR. 5 MG 120 ML x 1 (/5ML), FAS

4145, EUCIL , EUCIL, NOT FOUND, AMP. 10 MG 2 ML x 100, FAS

3891, ENZICOBA , ENZICOBA, NOT FOUND, CPR 5 MG x 20, FAS

4148, EUCIL , EUCIL, NOT FOUND, GOTAS 10 MG 10 ML x 1 (/ML), FAS

49228, ELEPRIL , ELEPRIL, NOT FOUND, CPR 5 MG x 20, FAS

29016, EUCIL , EUCIL, NOT FOUND, CPR 10 MG x 20, FAS

27745, EUCIL , EUCIL, NOT FOUND, SUP AD 10 MG x 5, FAS

4143, EUCIL , EUCIL, NOT FOUND, AMP. 10 MG 2 ML x 3, FAS

48280, EUFOR 20 , EUFOR 20, NOT FOUND, CPR 20 MG x 28, FAS

42779, EXIT , EXIT, NOT FOUND, CPR x 20, FAS

3889, ENZICOBA , ENZICOBA, NOT FOUND, MICROCOMPRID 1 MG x 12, FAS

45799, ELUM , ELUM, NOT FOUND, CPR 1 MG x 20, FAS

44510, EXIT , EXIT, NOT FOUND, GOTAS 30 ML x 1, FAS

4075, ESSEN , ESSEN, NOT FOUND, CAPS x 16, FAS

69025, ESPIRONOLACTONA MG , ESPIRONOLACTONA, ESPIRONOLACTONA, CPR 100 MG x 16, GM2

69324, ESPIRONOLACTONA MG , ESPIRONOLACTONA, ESPIRONOLACTONA, CPR 100 MG x 30, GM2

66724, ESPIRONOLACTONA MG , ESPIRONOLACTONA, ESPIRONOLACTONA, CPR 25 MG x 30, GM2

102496, ESOMEPRAZOL MAG MG , ESOMEPRAZOL MAG, ESOMEPRAZOL MAGNESICO, CPR REVEST 20 MG x 28, GM2

66725, ESPIRONOLACTONA MG , ESPIRONOLACTONA, ESPIRONOLACTONA, CPR 100 MG x 15, GM2

102497, ESOMEPRAZOL MAG MG , ESOMEPRAZOL MAG, ESOMEPRAZOL MAGNESICO, CPR REVEST 20 MG x 14, GM2

102998, ESOMEPRAZOL MAG MG , ESOMEPRAZOL MAG, ESOMEPRAZOL MAGNESICO, CPR REVEST 40 MG x 14, GM2

105406, ESTAVIT C20 , ESTAVIT C20, NOT FOUND, CREME 30 ML x 1, GM2

105404, ESTAVIT C10 , ESTAVIT C10, NOT FOUND, CREME 30 ML x 1, GM2

66723, ESPIRONOLACTONA MG , ESPIRONOLACTONA, ESPIRONOLACTONA, CPR 50 MG x 30, GM2

102999, ESOMEPRAZOL MAG MG , ESOMEPRAZOL MAG, ESOMEPRAZOL MAGNESICO, CPR REVEST 40 MG x 28, GM2

62640, EXPECTAMIN F , EXPECTAMIN F, NOT FOUND, CPR 6 MG x 12, LG6

77819, EXPECTAMIN , EXPECTAMIN, NOT FOUND, SOLN ORAL 120 ML x 1, LG6

57992, ESSEDIN , ESSEDIN, NOT FOUND, CAPS x 20, LG6

102181, ESOMEPRAZOL MAG MG , ESOMEPRAZOL MAG, ESOMEPRAZOL MAGNESICO, CPR REVEST 20 MG x 28, LG6

102180, ESOMEPRAZOL MAG MG , ESOMEPRAZOL MAG, ESOMEPRAZOL MAGNESICO, CPR REVEST 20 MG x 14, LG6

102183, ESOMEPRAZOL MAG MG , ESOMEPRAZOL MAG, ESOMEPRAZOL MAGNESICO, CPR REVEST 40 MG x 28, LG6

98544, ESTALOX , ESTALOX, NOT FOUND, CPR REVEST 20 MG x 30, LG6

47907, EXPEC , EXPEC, NOT FOUND, XAR. 120 ML x 1, LG6

102182, ESOMEPRAZOL MAG MG , ESOMEPRAZOL MAG, ESOMEPRAZOL MAGNESICO, CPR REVEST 40 MG x 14, LG6

48186, EXPECTAMIN , EXPECTAMIN, NOT FOUND, SUSP 100 ML x 1, LG6

97412, ESTALOX , ESTALOX, NOT FOUND, CPR REVEST 10 MG x 30, LG6

62639, ESPASMO FLATOL , ESPASMO FLATOL, NOT FOUND, GOTAS 20 ML x 1, LG6

73004, EQUILIBRIUM , EQUILIBRIUM, NOT FOUND, CPR 300 MG x 20, LR3

44920, ESBELTRAT , ESBELTRAT, NOT FOUND, CPR x 48, LR3

93695, ESOMEPRAZOL MAG MG , ESOMEPRAZOL MAG, ESOMEPRAZOL MAGNESICO, CPR REV L R 20 MG x 28, MD7

93696, ESOMEPRAZOL MAG MG , ESOMEPRAZOL MAG, ESOMEPRAZOL MAGNESICO, CPR REV L R 40 MG x 14, MD7

82365, ESCITAN , ESCITAN, NOT FOUND, CPR REVEST 50 MG x 8, MD7

82362, ESCITAN , ESCITAN, NOT FOUND, CPR REVEST 50 MG x 1, MD7

93697, ESOMEPRAZOL MAG MG , ESOMEPRAZOL MAG, ESOMEPRAZOL MAGNESICO, CPR REV L R 40 MG x 28, MD7

82366, ESCITAN , ESCITAN, NOT FOUND, CPR REVEST 100 MG x 2, MD7

82364, ESCITAN , ESCITAN, NOT FOUND, CPR REVEST 50 MG x 4, MD7

82363, ESCITAN , ESCITAN, NOT FOUND, CPR REVEST 50 MG x 2, MD7

82361, ESCITAN , ESCITAN, NOT FOUND, CPR REVEST 25 MG x 2, MD7

93694, ESOMEPRAZOL MAG MG , ESOMEPRAZOL MAG, ESOMEPRAZOL MAGNESICO, CPR REV L R 20 MG x 14, MD7

71692, EPIDRAT ROSTO , EPIDRAT ROSTO, NOT FOUND, LOC.S/F FP15 60 G x 1, MQF

57261, EPISOL , EPISOL, NOT FOUND, LOC FREE F30 120 ML x 1, MQF

68488, EPIDRAT LABIOS , EPIDRAT LABIOS, NOT FOUND, STICK. 5.50 G x 1, MQF

78729, EPISOL , EPISOL, NOT FOUND, GEL WT.FPS45 60 G x 1, MQF

72514, EPIDRAT CORPO , EPIDRAT CORPO, NOT FOUND, LO S/F FPS15 120 ML x 1, MQF

77272, EPISOL , EPISOL, NOT FOUND, LOC SEC F30 100 G x 1, MQF

72256, EPIDAC SR , EPIDAC SR, NOT FOUND, GEL. 30 G x 1, MQF

164993, EPISOL , EPISOL, NOT FOUND, K FLF30 2U+D 120 G x 1, MQF

53999, EPISOL , EPISOL, NOT FOUND, GEL FPS30 118 ML x 1, MQF

85520, EPIDRAT CORPO , EPIDRAT CORPO, NOT FOUND, K L C/F+N+LU 120 G x 1, MQF

117530, EPISOL , EPISOL, NOT FOUND, LOC SEC F60 100 G x 1, MQF

72941, EPIDRAT CORPO , EPIDRAT CORPO, NOT FOUND, LOC. C/F 120 ML x 1, MQF

100156, EPISOL , EPISOL, NOT FOUND, LO MIT FPS50 60 G x 1, MQF

155781, EPISOL , EPISOL, NOT FOUND, L C P CL F70 40 G x 1, MQF

163605, EPISOL , EPISOL, NOT FOUND, K L S F30+BP x 1, MQF

155780, EPISOL , EPISOL, NOT FOUND, LOC SEC F100 60 G x 1, MQF

80701, EPISOL , EPISOL, NOT FOUND, L C P MO F30 40 G x 1, MQF

104572, EPISOL , EPISOL, NOT FOUND, FLU FPS30 60 G x 1, MQF

58718, EPISOL , EPISOL, NOT FOUND, LOC.UVA FP15 120 ML x 1, MQF

72556, EPIDRAT OLHOS , EPIDRAT OLHOS, NOT FOUND, GEL. 15 G x 1, MQF

74095, EPIDRAT ROSTO , EPIDRAT ROSTO, NOT FOUND, LOC S/F FP30 60 G x 1, MQF

68489, EPIDRAT SENSI , EPIDRAT SENSI, NOT FOUND, SHAMPOO 120 ML x 1, MQF

77273, EPISOL , EPISOL, NOT FOUND, LOC SEC F45 100 G x 1, MQF

72257, EPISOL , EPISOL, NOT FOUND, LOC.ULT FP50 100 ML x 1, MQF

159772, EPISOL , EPISOL, NOT FOUND, PO CO F30 PC 10 G x 1, MQF

155782, EPISOL , EPISOL, NOT FOUND, L C P MO F70 40 G x 1, MQF

61864, EPIDRAT ROSTO , EPIDRAT ROSTO, NOT FOUND, LOCION FPS15 60 G x 1, MQF

72555, EPIDRAT LIFT , EPIDRAT LIFT, NOT FOUND, GEL. 45 G x 1, MQF

78321, EPIDRAT ULTRA , EPIDRAT ULTRA, NOT FOUND, LOC.O FREE 200 G x 1, MQF

71691, EPIDRAT CORPO , EPIDRAT CORPO, NOT FOUND, LOC. S/F 120 ML x 1, MQF

71671, EPISOL , EPISOL, NOT FOUND, GEL WT.FPS30 60 G x 1, MQF

85517, EPIDRAT CORPO , EPIDRAT CORPO, NOT FOUND, K L S/F+N+LU 120 G x 1, MQF

55443, EPISOL , EPISOL, NOT FOUND, LOCION FPS30 120 ML x 1 (INF), MQF

68487, EPIDAC , EPIDAC, NOT FOUND, GEL ESFOLIAN 30 G x 1, MQF

80702, EPISOL , EPISOL, NOT FOUND, L C P CL F30 40 G x 1, MQF

55444, EPISOL , EPISOL, NOT FOUND, LOC FREE F15 120 ML x 1, MQF

68485, EPIDAC , EPIDAC, NOT FOUND, SABAO 90 G x 1, MQF

49103, EPISOL , EPISOL, NOT FOUND, LOCION FPS45 120 ML x 1, MQF

57262, EPISOL , EPISOL, NOT FOUND, LOC FREE 45 120 ML x 1, MQF

60620, EPIDRAT CORPO , EPIDRAT CORPO, NOT FOUND, LOC. 120 ML x 1, MQF

72220, EPIDRAT ULTRA , EPIDRAT ULTRA, NOT FOUND, LOC. 120 ML x 1, MQF

163606, EPISOL , EPISOL, NOT FOUND, K L S F60+BP x 1, MQF

71886, EPIDRAT CORPO , EPIDRAT CORPO, NOT FOUND, LOC. 200 G x 1, MQF

68486, EPIDAC , EPIDAC, NOT FOUND, SABAO LIQD 60 G x 1, MQF

49151, EPISOL , EPISOL, NOT FOUND, LOCION FPS45 60 ML x 1, MQF

69413, EPIDRAT MAOS , EPIDRAT MAOS, NOT FOUND, CREME FPS15 60 G x 1, MQF

58549, EPISOL , EPISOL, NOT FOUND, SPRAY UVA 30 120 ML x 1, MQF

117528, EPISOL , EPISOL, NOT FOUND, L C M MA F30 40 G x 1, MQF

100155, EPISOL , EPISOL, NOT FOUND, LO MIT FPS30 60 G x 1, MQF

50049, EPISOL , EPISOL, NOT FOUND, LOCION FPS15 120 ML x 1, MQF

68490, EPIDRAT SENSI , EPIDRAT SENSI, NOT FOUND, SAB LIQ 60 G x 1, MQF

57260, EPISOL , EPISOL, NOT FOUND, LOC.UVA FP30 120 ML x 1, MQF

71887, EPISOL , EPISOL, NOT FOUND, LO.INF.FPS50 120 ML x 1, MQF

62858, ESTRIOPAX , ESTRIOPAX, NOT FOUND, CR.VAG.C/APL 1 MG 50 G x 1 (/G), N_Q

76703, ESTRIOL MG , ESTRIOL, ESTRIOL, CR.VAG.C/APL 1 MG 50 G x 1 (/G), N_Q

55656, EPICITRIN , EPICITRIN, NOT FOUND, POM. 10 G x 1, N_Q

51286, ETILDOPANAN , ETILDOPANAN, NOT FOUND, CPR REVEST 500 MG x 20, N_Q

53483, ETILDOPANAN , ETILDOPANAN, NOT FOUND, CPR REVEST 250 MG x 30, N_Q

28558, EQUILID , EQUILID, NOT FOUND, CPR 200 MG x 20, S_A

54846, ELOXATIN , ELOXATIN, NOT FOUND, F.AMP LIOF 50 MG x 1, S_A

33465, ESPERSON , ESPERSON, NOT FOUND, POM. 2.50 MG 20 G x 1 (/G), S_A

85486, EXPOLID , EXPOLID, NOT FOUND, CPR REVEST 5 MG x 30, S_A

76404, ELOXATIN , ELOXATIN, NOT FOUND, F.AMP IV 100 MG 20 ML x 1, S_A

3940, EQUILID , EQUILID, NOT FOUND, CAPS 50 MG x 20, S_A

98153, ENTEROGERMINA , ENTEROGERMINA, NOT FOUND, FLACONETES 5 ML x 10, S_A

85488, EXPOLID , EXPOLID, NOT FOUND, CPR REVEST 2.50 MG x 30, S_A

30651, ESPERSON N , ESPERSON N, NOT FOUND, POM. 20 G x 1, S_A

75614, ELOXATIN , ELOXATIN, NOT FOUND, F.AMP IV 50 MG 10 ML x 1, S_A

85489, EXPOLID , EXPOLID, NOT FOUND, CPR REVEST 10 MG x 30, S_A

