73503; NEUTROGENA D CLEAN ; NEUTROGENA D CLEAN; NOT FOUND; LOC.DEMAQ 200 ML x 1; J_J

158190; NEUTROGENA SUN FR ; NEUTROGENA SUN FR; NOT FOUND; LOCAO FPS50 200 ML x 1; J_J

74740; NEUTROGENA U LIGHT ; NEUTROGENA U LIGHT; NOT FOUND; CR P MIS/OLE 55 G x 1; J_J

79290; NEUTROGENA U LIGHT ; NEUTROGENA U LIGHT; NOT FOUND; CREME NOITE 50 G x 1; J_J

73512; NEUTROGENA BALANCE ; NEUTROGENA BALANCE; NOT FOUND; CREME HI/NU 200 ML x 1; J_J

63788; NEUTROGENA O F A W ; NEUTROGENA O F A W; NOT FOUND; S.L 2 % 200 ML x 1; J_J

77024; NEUTROGENA R CLEAR ; NEUTROGENA R CLEAR; NOT FOUND; GEL SECATIVO 15 G x 1; J_J

72725; NEUTROGENA F COOLI ; NEUTROGENA F COOLI; NOT FOUND; AERO FPS 45 141 G x 1; J_J

80748; NEUTROGENA BO CARE ; NEUTROGENA BO CARE; NOT FOUND; K INTE+NATU 400 ML x 1; J_J

96879; NEUTROGENA SUN FR ; NEUTROGENA SUN FR; NOT FOUND; LOCAO FPS60 120 ML x 1; J_J

53523; NEUTROGENA ; NEUTROGENA; NOT FOUND; SAB.LIMP POR 200 ML x 1; J_J

73504; NEUTROGENA D CLEAN ; NEUTROGENA D CLEAN; NOT FOUND; ESPU ENER ES 100 G x 1; J_J

78059; NEUTROGENA B C NAT ; NEUTROGENA B C NAT; NOT FOUND; LOC P/S EX/S 200 ML x 1; J_J

74748; NEUTROGENA U LIGHT ; NEUTROGENA U LIGHT; NOT FOUND; CR CONT OLHO 15 G x 1; J_J

69490; NEUTROGENA F FOAMI ; NEUTROGENA F FOAMI; NOT FOUND; ESP. 150 ML x 1; J_J

51653; NEUTROGENA NWG ; NEUTROGENA NWG; NOT FOUND; CR.HANDCREAM 56 G x 1; J_J

75047; NEUTROGENA D CLEAN ; NEUTROGENA D CLEAN; NOT FOUND; TON ENERG2X1 200 ML x 1; J_J

137518; NEUTROGENA D CLEAN ; NEUTROGENA D CLEAN; NOT FOUND; LENC LIM FAC x 25; J_J

72496; NEUTROGENA T-G FO ; NEUTROGENA T G FO; NOT FOUND; SHAMP A / C 125 ML x 1; J_J

77408; NEUTROGENA ULT.SHE ; NEUTROGENA ULT SHE; NOT FOUND; LOC FAC F70 50 ML x 1; J_J

51660; NEUTROGENA ; NEUTROGENA; NOT FOUND; LOC.S/COL 15 118 ML x 1; J_J

88146; NEUTROGENA ULT.SHE ; NEUTROGENA ULT SHE; NOT FOUND; LO TO SE F55 120 G x 1; J_J

73501; NEUTROGENA D CLEAN ; NEUTROGENA D CLEAN; NOT FOUND; BISNAGA 2X1 100 G x 1; J_J

96874; NEUTROGENA SUN FR ; NEUTROGENA SUN FR; NOT FOUND; SPRAY FPS50 180 ML x 1; J_J

145076; NEUTROGENA D CL NF ; NEUTROGENA D CL NF; NOT FOUND; LOC. DEMAQ 200 ML x 1; J_J

75797; NICORETTE ; NICORETTE; NOT FOUND; GOMA F FRUIT 4 MG x 30; J_J

77025; NEUTROGENA R CLEAR ; NEUTROGENA R CLEAR; NOT FOUND; GEL LIMPEZA 100 G x 1; J_J

80829; NEUTROGENA ULT.SHE ; NEUTROGENA ULT SHE; NOT FOUND; K FAC70+BC I 250 ML x 1; J_J

73507; NEUTROGENA D CLEAN ; NEUTROGENA D CLEAN; NOT FOUND; SAB FACIAL 80 G x 1; J_J

53525; NEUTROGENA HEAL SK ; NEUTROGENA HEAL SK; NOT FOUND; CR.CONT.OLHO 15 G x 1; J_J

78082; NEUTROGENA D CLEAN ; NEUTROGENA D CLEAN; NOT FOUND; SAB FAC ENER 80 G x 1; J_J

74735; NEUTROGENA HIDRATA ; NEUTROGENA HIDRATA; NOT FOUND; GC OF P M/OL 50 ML x 1; J_J

73506; NEUTROGENA D CLEAN ; NEUTROGENA D CLEAN; NOT FOUND; GEL LIMPEZA 150 G x 1; J_J

74963; NICORETTE ; NICORETTE; NOT FOUND; GOMA F FRUIT 2 MG x 30; J_J

78491; NICORETTE ; NICORETTE; NOT FOUND; GOMA MINT 4 MG x 210; J_J

72948; NEUTROGENA ULT.SHE ; NEUTROGENA ULT SHE; NOT FOUND; LOCION FPS30 88 ML x 1; J_J

73514; NEUTROGENA UNIFORM ; NEUTROGENA UNIFORM; NOT FOUND; CREME P/M/V 200 ML x 1; J_J

72949; NEUTROGENA ULT.SHE ; NEUTROGENA ULT SHE; NOT FOUND; LOCION FPS55 88 ML x 1; J_J

102528; NEUTROGENA SUN FR ; NEUTROGENA SUN FR; NOT FOUND; KSFF30+CBC I 400 ML x 1; J_J

85426; NEUTROGENA D CLEAN ; NEUTROGENA D CLEAN; NOT FOUND; S L F GFRUIT 150 G x 1; J_J

81210; NICORETTE ; NICORETTE; NOT FOUND; GOMA MINT 4 MG x 15; J_J

158188; NEUTROGENA SUN FR ; NEUTROGENA SUN FR; NOT FOUND; LOCAO FPS70 200 ML x 1; J_J

73509; NEUTROGENA R CLEAR ; NEUTROGENA R CLEAR; NOT FOUND; GEL AN/CRAVO 50 G x 1; J_J

74737; NEUTROGENA NWG ; NEUTROGENA NWG; NOT FOUND; CR CORPORAL 200 ML x 1; J_J

137521; NEUTROGENA D CLEAN ; NEUTROGENA D CLEAN; NOT FOUND; LENC LIM FAC x 7; J_J

84482; NEUTROGENA NWG ; NEUTROGENA NWG; NOT FOUND; CR CORP FRAG 200 ML x 1; J_J

85183; NICORETTE ; NICORETTE; NOT FOUND; GOMA ICEMINT 4 MG x 30; J_J

73505; NEUTROGENA D CLEAN ; NEUTROGENA D CLEAN; NOT FOUND; BISNAG ESF 70 ML x 1; J_J

102529; NEUTROGENA SUN FR ; NEUTROGENA SUN FR; NOT FOUND; KSFF60+USF70 250 ML x 1; J_J

60719; NICORETTE ; NICORETTE; NOT FOUND; GOMA MINT 2 MG x 30; J_J

74370; NICORETTE ; NICORETTE; NOT FOUND; ADES TRANSD 24.9 MG x 7 (/15); J_J

73499; NEUTROGENA ; NEUTROGENA; NOT FOUND; TONICO S/AL 200 ML x 1; J_J

74369; NICORETTE ; NICORETTE; NOT FOUND; ADES TRANSD 16.6 MG x 7 (/10); J_J

53266; NEUTROGENA S ACNE ; NEUTROGENA S ACNE; NOT FOUND; SAB.FACIAL 100 G x 1; J_J

61208; NEPODEX ; NEPODEX; NOT FOUND; SOLN OFTAL 5 ML x 1; L3F

61209; NOSTIL ; NOSTIL; NOT FOUND; SOLN OFTAL 0.30 % 5 ML x 1; L3F

61207; NEPODEX ; NEPODEX; NOT FOUND; POM. OFTAL 3.50 G x 1; L3F

68293; NITRA.MICONAZOL MG ; NITRA MICONAZOL; NITRATO MICONAZOL; PO 20 MG 30 G x 1 (/G); LG6

54034; NATUS GERIN ; NATUS GERIN; NOT FOUND; CAPS x 30; LG6

102517; NEXPRAZIN ; NEXPRAZIN; NOT FOUND; CPR REVEST 40 MG x 28; LG6

68296; NITRAZEPAM MG ; NITRAZEPAM; NITRAZEPAM; CPR 5 MG x 20; LG6

71242; NIMODIPINO MG ; NIMODIPINO; NIMODIPINO; CPR REVEST 30 MG x 30; LG6

68291; NITRA.MICON.LOC MG ; NITRA MICON LOC; NOT FOUND; LOC. 20 MG 30 G x 1 (/G); LG6

68275; NIST+OXID.ZINCO MG ; NIST OXID ZINCO; NOT FOUND; POM.DERMAT 60 G x 1; LG6

74921; NIMESULIDA MG ; NIMESULIDA; NIMESULIDA; CPR 100 MG x 12; LG6

68299; NORFLOXACINO MG ; NORFLOXACINO; NORFLOXACINO; CPR REVEST 400 MG x 14; LG6

71828; NITRA.MICONA.CR.MG ; NITRA MICONA CR; NOT FOUND; CREME DERMAT 20 MG 28 G x 1 (/G; LG6

108297; NARISORO ; NARISORO; NOT FOUND; SOL FC 0.90 % 50 ML x 1; LG6

58844; NOFEBRIN ; NOFEBRIN; NOT FOUND; GOTAS 500 MG 20 ML x 1 (/ML); LG6

48638; NATUS GERIN ; NATUS GERIN; NOT FOUND; CAPS x 50; LG6

32874; NEOTRICIN ; NEOTRICIN; NOT FOUND; POM. 15 G x 1; LG6

83416; NARANETY ; NARANETY; NOT FOUND; CPR REVEST 2.50 MG x 12; LG6

98187; NEOTRICIN ; NEOTRICIN; NOT FOUND; POM. 50 G x 1; LG6

68289; NITRA.MICONAZOL MG ; NITRA MICONAZOL; NITRATO MICONAZOL; CR.VAG.14APL 20 MG 80 G x 1 (/G; LG6

102516; NEXPRAZIN ; NEXPRAZIN; NOT FOUND; CPR REVEST 20 MG x 28; LG6

48049; NOFEBRIN ; NOFEBRIN; NOT FOUND; CPR 500 MG x 120; LG6

83415; NARANETY ; NARANETY; NOT FOUND; CPR REVEST 2.50 MG x 4; LG6

70316; NITR.ISOCONAZOL MG ; NITR ISOCONAZOL; NITRATO ISOCONAZOL; CREME DERMAT 10 MG 20 G x 1 (/G; LG6

68582; NISTATINA MG ; NISTATINA; NISTATINA; SUSP ORAL 100 K 50 ML x 1 (/ML); LG6

48213; NEOCORTIN ; NEOCORTIN; NOT FOUND; COLIRIO 5 ML x 1; LG6

47897; NOFEBRIN ; NOFEBRIN; NOT FOUND; GOTAS 500 MG 10 ML x 1 (/ML); LG6

64106; NAPRIX A ; NAPRIX A; NOT FOUND; CAPS 10 MG x 30 (/5MG); LIB

58291; NAPRIX D ; NAPRIX D; NOT FOUND; CPR 12.5 MG x 30 (/5); LIB

61829; NATIFA PRO ; NATIFA PRO; NOT FOUND; CPR x 28; LIB

58292; NAPRIX D ; NAPRIX D; NOT FOUND; CPR 25 MG x 30 (/5); LIB

57366; NAPRIX ; NAPRIX; NOT FOUND; CPR 5 MG x 30; LIB

77278; NAPRIX A ; NAPRIX A; NOT FOUND; CAPS 10 MG x 30 (/10); LIB

61828; NATIFA ; NATIFA; NOT FOUND; CPR 1 MG x 28; LIB

103023; NACTALI ; NACTALI; NOT FOUND; CPR REVEST 75 Y x 28; LIB

57141; NAPRIX ; NAPRIX; NOT FOUND; CPR 2.50 MG x 20; LIB

57142; NAPRIX ; NAPRIX; NOT FOUND; CPR 5 MG x 20; LIB

62032; NAPRIX A ; NAPRIX A; NOT FOUND; CAPS 5 MG x 30 (/5MG); LIB

103022; NACTALI ; NACTALI; NOT FOUND; CPR REVEST 75 Y x 84; LIB

57365; NAPRIX ; NAPRIX; NOT FOUND; CPR 2.50 MG x 30; LIB

7433; NITRILENO ; NITRILENO; NOT FOUND; GOTAS 15 ML x 1 (ADLT); LIB

58290; NAPRIX ; NAPRIX; NOT FOUND; CPR 10 MG x 30; LIB

62031; NAPRIX A ; NAPRIX A; NOT FOUND; CAPS 2.50 MG x 30 (/5MG); LIB

85568; NISTATINA MG ; NISTATINA; NISTATINA; CR VAG APL 25 K 60 G x 1 (/G); LR3

52910; NISTAX ; NISTAX; NOT FOUND; CREME VAG. 25 K 60 G x 1 (/G); LR3

55768; NOVOXIL ; NOVOXIL; NOT FOUND; CAPS 500 MG x 21; LR3

29228; NAZOBIO ; NAZOBIO; NOT FOUND; GOTAS 15 ML x 1; LR3

52142; NOVOXIL ; NOVOXIL; NOT FOUND; PO P/SUSP 250 MG 150 ML x 1 (/5ML); LR3

52912; NISTAX ; NISTAX; NOT FOUND; SUSP 100 K 50 ML x 1 (/ML); LR3

64107; NASOMIL ; NASOMIL; NOT FOUND; SPRAY NASAL 20 ML x 1; MB9

76156; NIZUIL ; NIZUIL; NOT FOUND; GEL. 20 MG 40 G x 1 (/G); MB9

75133; NORFLOXACINO MG ; NORFLOXACINO; NORFLOXACINO; CPR 400 MG x 14; MB9

66322; NEBACIDERME ; NEBACIDERME; NOT FOUND; POM. 10 G x 1; MB9

162943; NEBACIDERME ; NEBACIDERME; NOT FOUND; POM DERM 10 G x 50; MB9

137600; NUTRINFAN ; NUTRINFAN; NOT FOUND; GOTAS FR SPE 20 ML x 1; MBR

76730; NUTRINFAN ; NUTRINFAN; NOT FOUND; SOL ORAL F/E 120 ML x 1; MBR

71785; NITRA.MICONA.CR.MG ; NITRA MICONA CR; NOT FOUND; CREME DERMAT 20 MG 28 G x 1 (/G; MD7

63902; NORFLOXACINO MG ; NORFLOXACINO; NORFLOXACINO; CPR REVEST 400 MG x 14; MD7

66272; NITR.ISOCONAZOL MG ; NITR ISOCONAZOL; NITRATO ISOCONAZOL; CREME DERMAT 10 MG 20 G x 1 (/G; MD7

66273; NITR.ISOCONAZOL MG ; NITR ISOCONAZOL; NITRATO ISOCONAZOL; CR.VAG.7 APL 10 MG 40 G x 1 (/G; MD7

57372; NISTATINA MG ; NISTATINA; NISTATINA; CR.VAG.C/APL 25 K 60 G x 1 (/G); MD7

59911; NITRA.MICONAZOL MG ; NITRA MICONAZOL; NITRATO MICONAZOL; CR.VAG.14APL 2 % 80 G x 1; MD7

62470; NIST+OXID.ZINCO MG ; NIST OXID ZINCO; NOT FOUND; POM. 60 G x 1; MD7

58302; NIMESULIDA MG ; NIMESULIDA; NIMESULIDA; CPR 100 MG x 12; MD7

63901; NORFLOXACINO MG ; NORFLOXACINO; NORFLOXACINO; CPR REVEST 400 MG x 6; MD7

61540; NITRA.MICON.LOC MG ; NITRA MICON LOC; NOT FOUND; LOC. 20 MG 30 G x 1 (/G); MD7

57646; NIMESULIDA MG ; NIMESULIDA; NIMESULIDA; GOTAS 50 MG 15 ML x 1 (/ML); MD7

109692; NEUTRACIDO ; NEUTRACIDO; NOT FOUND; CPR MAST TAN x 120; MDQ

72595; NASALFREE ; NASALFREE; NOT FOUND; GOTAS NASAL 30 ML x 1; MDQ

87812; NITROFIGAN ; NITROFIGAN; NOT FOUND; FLAC ABACAXI 10 ML x 60; MDQ

76362; NOVRALFLEX ; NOVRALFLEX; NOT FOUND; CPR x 30; MDQ

61605; NITROFIGAN ; NITROFIGAN; NOT FOUND; FLAC. 10 ML x 50; MDQ

53809; NITROFIGAN ; NITROFIGAN; NOT FOUND; FLAC ABACAXI 10 ML x 12; MDQ

62986; NIFEDIPRESS ; NIFEDIPRESS; NOT FOUND; CPR AP. 20 MG x 30; MDQ

62985; NIFEDIPRESS ; NIFEDIPRESS; NOT FOUND; CPR AP. 10 MG x 30; MDQ

80110; NALDEFLEX DIA ; NALDEFLEX DIA; NOT FOUND; CPR REVEST x 24; MDQ

80111; NALDEFLEX DIA ; NALDEFLEX DIA; NOT FOUND; CPR REVEST x 100; MDQ

75041; NASALFREE ; NASALFREE; NOT FOUND; SPRAY NASAL 50 ML x 1; MDQ

76361; NOVRALFLEX ; NOVRALFLEX; NOT FOUND; CPR x 200; MDQ

77708; NASALFLUX ; NASALFLUX; NOT FOUND; SOL NASAL AD 0.50 MG 30 ML x 1 (/ML); MDQ

78685; NIFEDIPRESS ; NIFEDIPRESS; NOT FOUND; CPR AP. 20 MG x 500; MDQ

109690; NEUTRACIDO ; NEUTRACIDO; NOT FOUND; CPR MAST MEN x 120; MDQ

134317; NORMATEN FIT ; NORMATEN FIT; NOT FOUND; SACHE 10 G x 10; MJA

75305; NASALEZE ; NASALEZE; NOT FOUND; SPR NAS 200D 500 MG x 1; MQF

53273; NOSKOTE ; NOSKOTE; NOT FOUND; CREME FPS15 12.4 G x 1; MQF

63189; NORFLOXACINO MG ; NORFLOXACINO; NORFLOXACINO; CPR REVEST 400 MG x 14; M_S

63188; NORFLOXACINO MG ; NORFLOXACINO; NORFLOXACINO; CPR REVEST 400 MG x 6; M_S

76511; NASOJET ; NASOJET; NOT FOUND; SPRAY NASAL 50 ML x 1; NAU

160494; NASOJET MARIS ; NASOJET MARIS; NOT FOUND; SPRAY 0.90 % 100 ML x 1; NAU

77403; NASOJET ; NASOJET; NOT FOUND; SPRAY H. 30 MG 50 ML x 1 (/ML); NAU

78432; NATULAXE ; NATULAXE; NOT FOUND; CAPS 34 MG x 20; NAU

75048; NISTAMAX ; NISTAMAX; NOT FOUND; SUSP 50 ML x 1; NAU

78239; NATULAXE ; NATULAXE; NOT FOUND; CAPS 34 MG x 120; NAU

66067; NEPRAZOL ; NEPRAZOL; NOT FOUND; CAPS 40 MG x 7; NCK

154114; NEPRAZOL ; NEPRAZOL; NOT FOUND; CAPS 20 MG x 56; NCK

159941; NEPRAZOL ; NEPRAZOL; NOT FOUND; CAPS 20 MG x 28; NCK

68669; NEMOXIL ; NEMOXIL; NOT FOUND; CAPS 500 MG x 21; NCK

69336; NEMOXIL ; NEMOXIL; NOT FOUND; SUSP ORAL 250 MG 150 ML x 1 (/5ML); NCK

66068; NEPRAZOL ; NEPRAZOL; NOT FOUND; CAPS 20 MG x 14; NCK

63187; NECK-FER ; NECK FER; NOT FOUND; SOLN ORAL 125 MG 100 ML x 1 (/5ML); NCK

66399; NALLE ; NALLE; NOT FOUND; CAPS GELATIN 40 MG x 30; NKO

136002; NEULOX ; NEULOX; NOT FOUND; CAPS GEL L.R 60 MG x 30; NQA

75865; NIMESULIDA MG ; NIMESULIDA; NIMESULIDA; CPR 100 MG x 12; NQA

62530; NORFLOXACINO MG ; NORFLOXACINO; NORFLOXACINO; CPR REVEST 400 MG x 14; NQA

145107; NEUROPRAM ; NEUROPRAM; NOT FOUND; CPR REV 15 MG x 30; NQA

89032; NORADOP ; NORADOP; NOT FOUND; CPR A.P 150 MG x 30; NQA

103401; NEUROPRAM ; NEUROPRAM; NOT FOUND; CPR REV 10 MG x 60; NQA

161620; NARATANO ; NARATANO; NOT FOUND; CPR REV 2.50 MG x 10; NQA

69961; NISTATINA MG ; NISTATINA; NISTATINA; SUSP 100 K 50 ML x 1 (/ML); NQA

89034; NORADOP ; NORADOP; NOT FOUND; CPR A.P 150 MG x 60; NQA

104578; NEUROPRAM ; NEUROPRAM; NOT FOUND; CPR REV 20 MG x 30; NQA

104575; NEUROPRAM ; NEUROPRAM; NOT FOUND; CPR REV 10 MG x 30; NQA

69960; NIST+OXID.ZINCO MG ; NIST OXID ZINCO; NOT FOUND; POM. 60 G x 1; NQA

136000; NEULOX ; NEULOX; NOT FOUND; CAPS GEL L.R 30 MG x 15; NQA

76153; NEONAZOL AD ; NEONAZOL AD; NOT FOUND; SOLN NASAL 30 ML x 1; NV7

77766; NATIGLOS ; NATIGLOS; NOT FOUND; POM. 45 G x 1; NV7

159375; NAT SEPT 70 ; NAT SEPT 70; NOT FOUND; SOL 50 ML x 1; NV7

73845; NOREPINEFRINA MG ; NOREPINEFRINA; NOREPINEFRINA; AMP.INFUSION 2 MG 4 ML x 50 (/ML); NVA

73899; NAUMETRON ; NAUMETRON; NOT FOUND; AMP. 5 MG 2 ML x 50 (/ML); NVA

67982; NOVAMICIN ; NOVAMICIN; NOT FOUND; F.AMP 500 MG x 20; NVA

76259; NOVAMICIN ; NOVAMICIN; NOT FOUND; F.AMP 500 MG 10 ML x 50; NVA

76560; NOVAMICIN ; NOVAMICIN; NOT FOUND; F.AMP 1 G x 1; NVA

47038; NITRODERM TTS ; NITRODERM TTS; NOT FOUND; DISCOS 10 MG x 10; NVR

47037; NITRODERM TTS ; NITRODERM TTS; NOT FOUND; DISCOS 5 MG x 10; NVR

57145; NYOLOL ; NYOLOL; NOT FOUND; SOLN OFTAL 5 ML x 1; NVR

91089; NOVORAPID ; NOVORAPID; NOT FOUND; CAN SING PAC 100 IU 3 ML x 1 (/ML); N_N

59513; NOVORAPID ; NOVORAPID; NOT FOUND; CARTUCHO 100 IU 3 ML x 5 (/ML); N_N

49206; NOVOLIN N HM ; NOVOLIN N HM; NOT FOUND; F.AMP S.C 100 IU 10 ML x 1 (/ML); N_N

66324; NOVORAPID ; NOVORAPID; NOT FOUND; F.AMP 100 IU 10 ML x 1 (/ML); N_N

53815; NOVOLIN N HM ; NOVOLIN N HM; NOT FOUND; REFILL 100 IU 3 ML x 5 (/ML); N_N

49203; NOVOLIN 70/30 HM ; NOVOLIN 70 30 HM; NOT FOUND; F.AMP S.C 100 IU 10 ML x 1 (/ML); N_N

62575; NOVOMIX 30 ; NOVOMIX 30; NOT FOUND; CANETAS FLEX 100 IU 3 ML x 5 (/ML); N_N

76481; NORDITROPIN ; NORDITROPIN; NOT FOUND; CAN NORDIFLE 15 MG 1.50 ML x 1; N_N

53812; NOVOLIN 70/30 HM ; NOVOLIN 70 30 HM; NOT FOUND; REFILL 100 IU 3 ML x 5 (/ML); N_N

62576; NOVOMIX 30 ; NOVOMIX 30; NOT FOUND; CARTUCHO PEN 100 IU 3 ML x 5 (/ML); N_N

50547; NOVOLIN R HM ; NOVOLIN R HM; NOT FOUND; F.AMP S.C 100 IU 10 ML x 1 (/ML); N_N

56488; NOVONORM ; NOVONORM; NOT FOUND; CPR 1 MG x 30; N_N

49027; NEOSULIN R ; NEOSULIN R; NOT FOUND; F.AMP S.C 100 IU 10 ML x 1 (/ML); N_N

59095; NORDITROP.SIMPLEXX ; NORDITROP SIMPLEXX; NOT FOUND; CARTUCHO 10 MG 1.50 ML x 1; N_N

53816; NOVOLIN R HM ; NOVOLIN R HM; NOT FOUND; REFILL 100 IU 3 ML x 5 (/ML); N_N

59096; NORDITROP.SIMPLEXX ; NORDITROP SIMPLEXX; NOT FOUND; CARTUCHO 15 MG 1.50 ML x 1; N_N

49205; NOVOLIN L HM ; NOVOLIN L HM; NOT FOUND; F.AMP S.C 100 IU 10 ML x 1 (/ML); N_N

49025; NEOSULIN N ; NEOSULIN N; NOT FOUND; F.AMP S.C 100 IU 10 ML x 1 (/ML); N_N

56489; NOVONORM ; NOVONORM; NOT FOUND; CPR 2 MG x 30; N_N

51503; NORDITROPIN ; NORDITROPIN; NOT FOUND; F.AMP LIOF 12 IU 3 ML x 1; N_N

64519; NOVORAPID ; NOVORAPID; NOT FOUND; CANETAS FLEX 100 IU 3 ML x 5 (/ML); N_N

59094; NORDITROP.SIMPLEXX ; NORDITROP SIMPLEXX; NOT FOUND; CARTUCHO 5 MG 1.50 ML x 1; N_N

76480; NORDITROPIN ; NORDITROPIN; NOT FOUND; CAN NORDIFLE 10 MG 1.50 ML x 1; N_N

76479; NORDITROPIN ; NORDITROPIN; NOT FOUND; CAN NORDIFLE 5 MG 1.50 ML x 1; N_N

56487; NOVONORM ; NOVONORM; NOT FOUND; CPR 0.50 MG x 30; N_N

50737; NEOCEFLEX ; NEOCEFLEX; NOT FOUND; SUSP 125 MG 60 ML x 1 (/5ML); N_Q

61991; NASOFELIN ; NASOFELIN; NOT FOUND; SOL NASAL AD 1 MG 10 ML x 1 (/ML); N_Q

67981; NAPROXENO SOD MG ; NAPROXENO SOD; NAPROXENO SODICO; CPR REVEST 550 MG x 20; N_Q

55259; NEOTOSS ; NEOTOSS; NOT FOUND; XAR. AD 15 MG 100 ML x 1 (/5ML); N_Q

69411; NEOLEFRIN ; NEOLEFRIN; NOT FOUND; XAROPE 60 ML x 1; N_Q

50193; NEOCOPAN ; NEOCOPAN; NOT FOUND; CPR x 20; N_Q

66922; NEOZOLAM ; NEOZOLAM; NOT FOUND; CPR 0.50 MG x 20; N_Q

55551; NEOPRAZOL ; NEOPRAZOL; NOT FOUND; CAPS GASTROR 10 MG x 14; N_Q

57772; NEO ISOCADEN ; NEO ISOCADEN; NOT FOUND; CR.VAG.C/APL 10 MG 40 G x 1 (/G); N_Q

65383; NEO MOXILIN ; NEO MOXILIN; NOT FOUND; CAPS 500 MG x 21; N_Q

50971; NEOTAREN ; NEOTAREN; NOT FOUND; CPR 50 MG x 20; N_Q

58757; NEODAZOL ; NEODAZOL; NOT FOUND; PO P/SUSP 450 MG 15 ML x 1; N_Q

59262; NEO METRODAZOL ; NEO METRODAZOL; NOT FOUND; CREME VAG. 40 G x 1; N_Q

65309; NITRA.MICONAZOL MG ; NITRA MICONAZOL; NITRATO MICONAZOL; LOC. 20 MG 30 ML x 1 (/ML); N_Q

57770; NEODAZOL ; NEODAZOL; NOT FOUND; CPR 500 MG x 4; N_Q

57287; NEOLON D ; NEOLON D; NOT FOUND; CREME 30 G x 1; N_Q

60185; NEOFLOXIN ; NEOFLOXIN; NOT FOUND; CPR 400 MG x 14; N_Q

48593; NEO BENDAZOL ; NEO BENDAZOL; NOT FOUND; CPR 200 MG x 2; N_Q

75465; NIMESULIDA GEL MG ; NIMESULIDA GEL; NOT FOUND; GEL. 20 MG 40 G x 1 (/G); N_Q

76234; NEOCULAR ; NEOCULAR; NOT FOUND; SOLN OFTAL 5 MG 5 ML x 1 (/ML); N_Q

50998; NEOVERMIN ; NEOVERMIN; NOT FOUND; CPR 100 MG x 6; N_Q

78966; NEOSORO ; NEOSORO; NOT FOUND; SOL NEBUL 45 ML x 1; N_Q

63184; NAVOTRAX ; NAVOTRAX; NOT FOUND; CPR 0.50 MG x 20; N_Q

47466; NEO METRODAZOL ; NEO METRODAZOL; NOT FOUND; CPR 250 MG x 20; N_Q

47393; NEO FENICOL ; NEO FENICOL; NOT FOUND; COLIRIO 0.50 % 8 ML x 1; N_Q

69410; NEOLEFRIN ; NEOLEFRIN; NOT FOUND; CPR x 200; N_Q

53310; NEO BENDAZOL ; NEO BENDAZOL; NOT FOUND; CPR MASC 400 MG x 1; N_Q

54895; NEO FEDIPINA ; NEO FEDIPINA; NOT FOUND; CPR 10 MG x 30; N_Q

155769; NEOCOFLAN ; NEOCOFLAN; NOT FOUND; AERO 11.6 MG 85 ML x 1; N_Q

63624; NAVOTRAX ; NAVOTRAX; NOT FOUND; CPR 2 MG x 20; N_Q

61504; NEO MOXILIN ; NEO MOXILIN; NOT FOUND; SUSP 250 MG 60 ML x 1 (/5ML); N_Q

67486; NEOZOLAM ; NEOZOLAM; NOT FOUND; CPR 1 MG x 20; N_Q

56827; NEO DIMETICON ; NEO DIMETICON; NOT FOUND; GOTAS 75 MG 10 ML x 1 (/ML); N_Q

59611; NEOCOPAN ; NEOCOPAN; NOT FOUND; GOTAS 20 ML x 1; N_Q

58756; NEODAZOL ; NEODAZOL; NOT FOUND; CPR 1000 MG x 2; N_Q

47465; NEO LINCO ; NEO LINCO; NOT FOUND; AMP. 600 MG 2 ML x 1; N_Q

53317; NEO AMPICILIN ; NEO AMPICILIN; NOT FOUND; CAPS 500 MG x 10; N_Q

56866; NEOPIRIDIN ; NEOPIRIDIN; NOT FOUND; PASTILHAS x 12; N_Q

70777; NEOPRAZOL ; NEOPRAZOL; NOT FOUND; CAPS GASTROR 20 MG x 28; N_Q

56800; NEO MOXILIN ; NEO MOXILIN; NOT FOUND; CAPS 500 MG x 12; N_Q

47991; NEODEX C/NEO ; NEODEX C NEO; NOT FOUND; CREME. 0.10 % 15 G x 1; N_Q

53522; NEOVERMIN ; NEOVERMIN; NOT FOUND; CPR 100 MG x 12; N_Q

78593; NEO LORATADIN ; NEO LORATADIN; NOT FOUND; XAR. 1 MG 100 ML x 1 (/ML); N_Q

50955; NEOCEFLEX ; NEOCEFLEX; NOT FOUND; SUSP 250 MG 60 ML x 1 (/5ML); N_Q

73713; NIST+OXID.ZINCO MG ; NIST OXID ZINCO; NOT FOUND; POM. 60 G x 1; N_Q

74787; NEOCOFLAN ; NEOCOFLAN; NOT FOUND; GEL. 10 MG 30 G x 1 (/G); N_Q

53337; NEO FENICOL ; NEO FENICOL; NOT FOUND; CPR 500 MG x 20; N_Q

54548; NEOSAC ; NEOSAC; NOT FOUND; CPR 150 MG x 20; N_Q

54549; NEOSAC ; NEOSAC; NOT FOUND; CPR 300 MG x 20; N_Q

61450; NEOZOL ; NEOZOL; NOT FOUND; CAPS GELATIN 30 MG x 14; N_Q

73304; NIMESULIDA MG ; NIMESULIDA; NIMESULIDA; GOTAS 50 MG 15 ML x 1 (/ML); N_Q

93361; NEO HIDROCLOR ; NEO HIDROCLOR; NOT FOUND; CPR 25 MG x 30; N_Q

58305; NISTATINA MG ; NISTATINA; NISTATINA; SUSP 100 K 50 ML x 1 (/ML); N_Q

58760; NEOLIDONA ; NEOLIDONA; NOT FOUND; CPR 50 MG x 28; N_Q

72225; NEODRIN ; NEODRIN; NOT FOUND; CPR 100 MG x 100; N_Q

53528; NEOPRAZOL ; NEOPRAZOL; NOT FOUND; CAPS GASTROR 20 MG x 14; N_Q

46219; NEOTRIN ; NEOTRIN; NOT FOUND; CPR 400 MG x 20 (/80); N_Q

57267; NEOSEMID ; NEOSEMID; NOT FOUND; AMP. 10 MG 2 ML x 50 (/ML); N_Q

66921; NEOZOLAM ; NEOZOLAM; NOT FOUND; CPR 0.25 MG x 20; N_Q

57771; NEODAZOL ; NEODAZOL; NOT FOUND; CPR 500 MG x 8; N_Q

57288; NEOLON D ; NEOLON D; NOT FOUND; POM. 30 G x 1; N_Q

55257; NEOSSOLVAN ; NEOSSOLVAN; NOT FOUND; XAR. INF 15 MG 120 ML x 1 (/5ML); N_Q

57773; NEO TIONAZOL ; NEO TIONAZOL; NOT FOUND; CREME 10 MG 30 G x 1 (/G); N_Q

56854; NEO ITRAX ; NEO ITRAX; NOT FOUND; CAPS GELATIN 100 MG x 4; N_Q

73376; NEOSORO H ; NEOSORO H; NOT FOUND; SOLN NASAL 30 MG 60 ML x 1 (/ML); N_Q

47410; NEO MEBEND ; NEO MEBEND; NOT FOUND; CPR 100 MG x 6; N_Q

61992; NASOFELIN ; NASOFELIN; NOT FOUND; SOL NAS. INF 0.50 MG 10 ML x 1 (/ML); N_Q

54512; NEOTAFLAN ; NEOTAFLAN; NOT FOUND; GOTAS 15 MG 20 ML x 1 (/ML); N_Q

69412; NEOLEFRIN BABY ; NEOLEFRIN BABY; NOT FOUND; GOTAS 15 ML x 1; N_Q

78435; NEO MOXILIN ; NEO MOXILIN; NOT FOUND; CAPS 500 MG x 500; N_Q

52864; NEO CLOTRIMAZYL ; NEO CLOTRIMAZYL; NOT FOUND; CREME 10 MG 50 G x 1 (/G); N_Q

53352; NEO DOXICILIN ; NEO DOXICILIN; NOT FOUND; DRAG 100 MG x 15; N_Q

56826; NEO DIMETICON ; NEO DIMETICON; NOT FOUND; CPR 40 MG x 20; N_Q

52670; NEO METFORMIN ; NEO METFORMIN; NOT FOUND; CPR 850 MG x 30; N_Q

58762; NEOSORO AD ; NEOSORO AD; NOT FOUND; SOLN NASAL 30 ML x 1; N_Q

145096; NEOSARTAN ; NEOSARTAN; NOT FOUND; CPR REVEST 160 MG x 30; N_Q

56862; NEO LORATADIN ; NEO LORATADIN; NOT FOUND; CPR 10 MG x 12; N_Q

55760; NEO FEDIPINA ; NEO FEDIPINA; NOT FOUND; CPR 20 MG x 30; N_Q

99512; NEOPRAZOL ; NEOPRAZOL; NOT FOUND; CAPS GASTROR 40 MG x 28; N_Q

54511; NEOTAFLAN ; NEOTAFLAN; NOT FOUND; DRAG 50 MG x 20; N_Q

48676; NEODEX ; NEODEX; NOT FOUND; CPR 0.50 MG x 10; N_Q

55258; NEOSULIDA ; NEOSULIDA; NOT FOUND; CPR 100 MG x 12; N_Q

56855; NEO ITRAX ; NEO ITRAX; NOT FOUND; CAPS GELATIN 100 MG x 15; N_Q

69754; NITROFURAL MG ; NITROFURAL; NITROFURAL; POM. 2 MG 30 G x 1 (/G); N_Q

57240; NEO FLUOXETIN ; NEO FLUOXETIN; NOT FOUND; CAPS GELATIN 20 MG x 28; N_Q

48659; NEO BENDAZOL ; NEO BENDAZOL; NOT FOUND; SUSP 4 % 10 ML x 1; N_Q

73155; NEOSORO ; NEOSORO; NOT FOUND; SOL NAS. INF 30 ML x 1; N_Q

72438; NAPROXENO SOD MG ; NAPROXENO SOD; NAPROXENO SODICO; CPR REVEST 550 MG x 10; N_Q

55546; NEOSULIDA ; NEOSULIDA; NOT FOUND; GOTAS 50 MG 15 ML x 1 (/ML); N_Q

55260; NEOTOSS ; NEOTOSS; NOT FOUND; XAR. INF 7.50 MG 60 ML x 1 (/5ML); N_Q

47467; NEO METRODAZOL ; NEO METRODAZOL; NOT FOUND; SUSP 200 MG 80 ML x 1 (/5ML); N_Q

58759; NEOLIDONA ; NEOLIDONA; NOT FOUND; CPR 25 MG x 42; N_Q

50759; NEO HIDROCLOR ; NEO HIDROCLOR; NOT FOUND; CPR 50 MG x 20; N_Q

84473; NEOPANTOL ; NEOPANTOL; NOT FOUND; POM DERM 50 MG 30 G x 1 (/G); N_Q

51310; NEOLASIL ; NEOLASIL; NOT FOUND; AMP. 10 MG 2 ML x 100; N_Q

57289; NEOPIRIDIN ; NEOPIRIDIN; NOT FOUND; SPRAY 50 ML x 1; N_Q

56823; NEOTAFLAN ; NEOTAFLAN; NOT FOUND; AMP. 75 MG 3 ML x 3; N_Q

47973; NEO AMPICILIN ; NEO AMPICILIN; NOT FOUND; SUSP 250 MG 60 ML x 1 (/5ML); N_Q

50999; NEOVERMIN ; NEOVERMIN; NOT FOUND; SUSP 100 MG 30 ML x 1 (/5ML); N_Q

57232; NEO CEFADRIL ; NEO CEFADRIL; NOT FOUND; PO P/SUSP 250 MG 100 ML x 1 (/5ML); N_Q

55550; NEOPRAZOL ; NEOPRAZOL; NOT FOUND; CAPS GASTROR 20 MG x 7; N_Q

145093; NEOSARTAN ; NEOSARTAN; NOT FOUND; CPR REVEST 80 MG x 30; N_Q

84475; NEODIA ; NEODIA; NOT FOUND; CPR 1.50 MG x 1; N_Q

50736; NEOCEFLEX ; NEOCEFLEX; NOT FOUND; CAPS 500 MG x 8; N_Q

51018; NEO VERPAMIL ; NEO VERPAMIL; NOT FOUND; CPR 80 MG x 20; N_Q

46220; NEOTRIN ; NEOTRIN; NOT FOUND; SUSP 48 MG 60 ML x 1 (/5ML); N_Q

55702; NEO MOXILIN ; NEO MOXILIN; NOT FOUND; SUSP 250 MG 150 ML x 1 (/5ML); N_Q

57216; NEO FOLICO ; NEO FOLICO; NOT FOUND; CPR 5 MG x 20; N_Q

145097; NEOSARTAN ; NEOSARTAN; NOT FOUND; CPR REVEST 320 MG x 30; N_Q

50980; NEO GENTAMICIN ; NEO GENTAMICIN; NOT FOUND; F.AMP 80 MG 2 ML x 1; N_Q

65174; NITR.ISOCONAZOL MG ; NITR ISOCONAZOL; NITRATO ISOCONAZOL; CR.VAG.7 APL 10 MG 40 G x 1 (/G; N_Q

58758; NEODAZOL ; NEODAZOL; NOT FOUND; PO P/SUSP 900 MG 30 ML x 1; N_Q

61220; NAPRONAX ; NAPRONAX; NOT FOUND; CPR 550 MG x 10; N_Q

50970; NEOTAREN ; NEOTAREN; NOT FOUND; AMP. 75 MG 3 ML x 5; N_Q

53370; NEOSEMID ; NEOSEMID; NOT FOUND; CPR 40 MG x 20; N_Q

75756; NORFLOXACINO MG ; NORFLOXACINO; NORFLOXACINO; CPR REVEST 400 MG x 6; N_Q

47620; NEO LINCO ; NEO LINCO; NOT FOUND; AMP. 300 MG 1 ML x 1; N_Q

76088; NEO FENICOL ; NEO FENICOL; NOT FOUND; COLIRIO 4 MG 10 ML x 1 (/ML); N_Q

50981; NEO GENTAMICIN ; NEO GENTAMICIN; NOT FOUND; F.AMP 280 MG 2 ML x 1; N_Q

61449; NEOZOL ; NEOZOL; NOT FOUND; CAPS GELATIN 30 MG x 7; N_Q

67252; NEOBUTAMINA ; NEOBUTAMINA; NOT FOUND; F.AMP 250 MG 20 ML x 10; N_Q

57247; NEOCOFLAN ; NEOCOFLAN; NOT FOUND; GEL. 1 % 60 G x 1; N_Q

48903; NEO MISTATIN ; NEO MISTATIN; NOT FOUND; CREME VAG. 25 K 60 G x 1 (/G); N_Q

53339; NEO DIGOXIN ; NEO DIGOXIN; NOT FOUND; CPR 0.25 MG x 24; N_Q

65382; NEO MOXILIN ; NEO MOXILIN; NOT FOUND; CAPS 500 MG x 15; N_Q

55816; NEO AMITRIPTILIN ; NEO AMITRIPTILIN; NOT FOUND; CPR 25 MG x 20; N_Q

62861; NISTATINA CRE.MG ; NISTATINA CRE; NOT FOUND; CR.VAG.C/APL 25 K 60 G x 1 (/G); N_Q

57231; NEO CEFADRIL ; NEO CEFADRIL; NOT FOUND; CAPS 500 MG x 8; N_Q

55256; NEOSSOLVAN ; NEOSSOLVAN; NOT FOUND; XAR. AD 30 MG 120 ML x 1 (/5ML); N_Q

75187; NITRA.MICONAZOL MG ; NITRA MICONAZOL; NITRATO MICONAZOL; CREME DERMAT 20 MG 28 G x 1 (/G; N_Q

69187; NIMESULIDA MG ; NIMESULIDA; NIMESULIDA; CPR 100 MG x 12; N_Q

50966; NEODEX ; NEODEX; NOT FOUND; ELIXIR 0.50 MG 120 ML x 1 (/5ML); N_Q

60188; NEOPRESS H ; NEOPRESS H; NOT FOUND; CPR 12.5 MG x 30 (/50); N_Q

75757; NORFLOXACINO MG ; NORFLOXACINO; NORFLOXACINO; CPR REVEST 400 MG x 14; N_Q

47411; NEO MEBEND ; NEO MEBEND; NOT FOUND; SUSP 100 MG 30 ML x 1 (/5ML); N_Q

47280; NEO MISTATIN ; NEO MISTATIN; NOT FOUND; SUSP 100 K 50 ML x 1 (/ML); N_Q

62700; NEBACTRINA ; NEBACTRINA; NOT FOUND; POM. 10 G x 1; P7B

76958; NISTATINA MG ; NISTATINA; NISTATINA; CR.VAG.14APL 25 K 60 G x 1 (/G); P7B

76512; NITRA.MICONAZOL MG ; NITRA MICONAZOL; NITRATO MICONAZOL; CR.VAG.14APL 20 MG 80 G x 1 (/G; P7B

84463; NIST+OXID.ZINCO MG ; NIST OXID ZINCO; NOT FOUND; POM DERM 60 G x 1; P7B

62724; NEURONTIN ; NEURONTIN; NOT FOUND; CAPS 300 MG x 10; PFZ

49245; NORVASC ; NORVASC; NOT FOUND; CPR 5 MG x 20; PFZ

49032; NURSOY ; NURSOY; NOT FOUND; PO 400 G x 1; PFZ

53798; NEURONTIN ; NEURONTIN; NOT FOUND; CAPS 300 MG x 30; PFZ

77412; NORVASC ; NORVASC; NOT FOUND; CPR 5 MG x 10; PFZ

69894; NORDETTE ; NORDETTE; NOT FOUND; DRAG x 21; PFZ

60517; NEURONTIN ; NEURONTIN; NOT FOUND; CPR 600 MG x 27; PFZ

53799; NEURONTIN ; NEURONTIN; NOT FOUND; CAPS 400 MG x 30; PFZ

31768; NAXOGIN COMPOSTO ; NAXOGIN COMPOSTO; NOT FOUND; CPR VAG. x 10; PFZ

