117180; NOTUSS TSS ; NOTUSS TSS; NOT FOUND; XAR PED 1.50 MG 120 ML x 1 (/ML); A4H

75870; NOVOFER NF ; NOVOFER NF; NOT FOUND; SUSP PED 52 MG 120 ML x 1 (/ML); A4H

33363; NOVOFER ; NOVOFER; NOT FOUND; LIQD 120 ML x 1; A4H

45688; NOVACORT ; NOVACORT; NOT FOUND; POM. 30 G x 1; A4H

48409; NISULID ; NISULID; NOT FOUND; SUP AD 100 MG x 12; A4H

51203; NOTUSS ; NOTUSS; NOT FOUND; XAR. AD 120 ML x 1; A4H

52540; NISULID ; NISULID; NOT FOUND; CPR DISPER. 100 MG x 12; A4H

159347; NOTUSS TSS ; NOTUSS TSS; NOT FOUND; XAR. AD 3 MG 60 ML x 1 (/ML); A4H

56329; NOTUSS ; NOTUSS; NOT FOUND; PAST MENTA x 12; A4H

79251; NUTREL ; NUTREL; NOT FOUND; CREME SUAVE 60 G x 1; A4H

47282; NITRENCORD ; NITRENCORD; NOT FOUND; CPR 10 MG x 30; A4H

28946; NECAMIN ; NECAMIN; NOT FOUND; SUSP 100 MG 30 ML x 1 (/5ML); A4H

49495; NISULID ; NISULID; NOT FOUND; GOTAS 50 MG 15 ML x 1 (/ML); A4H

56747; NOVOCILIN ; NOVOCILIN; NOT FOUND; SUSP 400 MG 100 ML x 1 (/5ML); A4H

65123; NAPROXENO MG ; NAPROXENO; NAPROXENO; CPR 500 MG x 20; A4H

47686; NISULID ; NISULID; NOT FOUND; SUSP 1 % 60 ML x 1; A4H

51204; NOTUSS ; NOTUSS; NOT FOUND; XAR. PED. 120 ML x 1; A4H

30095; NOOTRON ; NOOTRON; NOT FOUND; CPR 400 MG x 60; A4H

55037; NOVAMOX ; NOVAMOX; NOT FOUND; CPR REVEST 875 MG x 14 (/125); A4H

56749; NOVOCILIN ; NOVOCILIN; NOT FOUND; CPR BLISTER 875 MG x 20; A4H

117179; NOTUSS TSS ; NOTUSS TSS; NOT FOUND; XAR. AD 3 MG 120 ML x 1 (/ML); A4H

49654; NOVOCILIN ; NOVOCILIN; NOT FOUND; CAPS 500 MG x 21; A4H

63553; NITRENDIPINO MG ; NITRENDIPINO; NITRENDIPINO; CPR REVEST 10 MG x 30; A4H

59271; NORFLOXACINO MG ; NORFLOXACINO; NORFLOXACINO; CPR REVEST 400 MG x 7; A4H

55038; NOVAMOX ; NOVAMOX; NOT FOUND; CPR REVEST 875 MG x 20 (/125); A4H

47471; NOVOCILIN ; NOVOCILIN; NOT FOUND; CAPS 500 MG x 15; A4H

45686; NOVACORT ; NOVACORT; NOT FOUND; CREME 30 G x 1; A4H

75868; NOVOFER NF ; NOVOFER NF; NOT FOUND; CPR REVEST 126 MG x 45; A4H

72569; NEO-DECAPEPTYL ; NEO DECAPEPTYL; NOT FOUND; F.AMP LP+DIL 11.2 MG 2 ML x 1; A4H

73302; NIMESULIDA MG ; NIMESULIDA; NIMESULIDA; GOTAS 50 MG 15 ML x 1 (/ML); A4H

55266; NOVOFER ; NOVOFER; NOT FOUND; DRAG x 45; A4H

159348; NOTUSS TSS ; NOTUSS TSS; NOT FOUND; XAR. PED 1.50 MG 60 ML x 1 (/ML); A4H

33361; NOVOFER ; NOVOFER; NOT FOUND; GOTAS 30 ML x 1; A4H

28945; NECAMIN ; NECAMIN; NOT FOUND; CPR 100 MG x 6; A4H

112558; NUTREL ; NUTREL; NOT FOUND; GEL LIMPEZA 100 ML x 1; A4H

59272; NORFLOXACINO MG ; NORFLOXACINO; NORFLOXACINO; CPR REVEST 400 MG x 14; A4H

46358; NEO-DECAPEPTYL ; NEO DECAPEPTYL; NOT FOUND; F AMP+DIL 3.75 MG 2 ML x 1; A4H

55767; NOVAMOX ; NOVAMOX; NOT FOUND; SUSP ORAL 457 MG 100 ML x 1 (/5ML); A4H

50807; NOVOCILIN ; NOVOCILIN; NOT FOUND; SUSP 250 MG 150 ML x 1 (/5ML); A4H

47808; NISULID ; NISULID; NOT FOUND; GRAN ENVELO. 100 MG 2 G x 12; A4H

75869; NOVOFER NF ; NOVOFER NF; NOT FOUND; GOTAS PED 263 MG 30 ML x 1 (/ML); A4H

73303; NIMESULIDA MG ; NIMESULIDA; NIMESULIDA; CPR 100 MG x 12; A4H

55036; NOVAMOX ; NOVAMOX; NOT FOUND; SUSP ORAL 457 MG 70 ML x 1 (/5ML); A4H

55476; NISULID GEL ; NISULID GEL; NOT FOUND; GEL. 2 % 40 G x 1; A4H

47036; NITRENCORD ; NITRENCORD; NOT FOUND; CPR 20 MG x 30; A4H

56748; NOVOCILIN ; NOVOCILIN; NOT FOUND; CPR BLISTER 875 MG x 14; A4H

63554; NITRENDIPINO MG ; NITRENDIPINO; NITRENDIPINO; CPR REVEST 20 MG x 30; A4H

47281; NISULID ; NISULID; NOT FOUND; CPR 100 MG x 12; A4H

51202; NIFELAT ; NIFELAT; NOT FOUND; CAPS RETARD 10 MG x 28 (/25); A4H

45685; NOVACORT ; NOVACORT; NOT FOUND; CREME 10 G x 1; A4H

65122; NAPROXENO MG ; NAPROXENO; NAPROXENO; CPR 250 MG x 15; A4H

50120; NIFELAT ; NIFELAT; NOT FOUND; CAPS RETARD 20 MG x 28 (/50); A4H

28896; NOOTRON ; NOOTRON; NOT FOUND; LIQD INF 60 MG 110 ML x 1 (/ML); A4H

55470; NEURIUM ; NEURIUM; NOT FOUND; CPR 100 MG x 30; ABT

49556; NIAR ; NIAR; NOT FOUND; CPR 5 MG x 60; ABT

32525; NOCTAL ; NOCTAL; NOT FOUND; CPR 2 MG x 20; ABT

49123; NIAR ; NIAR; NOT FOUND; CPR 5 MG x 30; ABT

159346; NEO FREESTYLE OPTI ; NEO FREESTYLE OPTI; NOT FOUND; TIRAS TESTE x 100; ABT

159343; NEO FREESTYLE OPTI ; NEO FREESTYLE OPTI; NOT FOUND; TIRAS TESTE x 10; ABT

159345; NEO FREESTYLE OPTI ; NEO FREESTYLE OPTI; NOT FOUND; TIRAS TESTE x 50; ABT

53388; NEPRO HP ; NEPRO HP; NOT FOUND; LIQD BAUNIL. 237 ML x 1; ABT

159344; NEO FREESTYLE OPTI ; NEO FREESTYLE OPTI; NOT FOUND; TIRAS TESTE x 25; ABT

61732; NAROPIN ; NAROPIN; NOT FOUND; POLYAMP SP 10 MG 10 ML x 5 (/ML); AZN

52673; NAROPIN ; NAROPIN; NOT FOUND; POLYAMP SP 7.50 MG 20 ML x 5 (/ML); AZN

52674; NAROPIN ; NAROPIN; NOT FOUND; POLYAMP SP 10 MG 20 ML x 5 (/ML); AZN

58134; NEXIUM ; NEXIUM; NOT FOUND; CPR REVEST 20 MG x 7; AZN

58137; NEXIUM ; NEXIUM; NOT FOUND; CPR REVEST 40 MG x 14; AZN

52672; NAROPIN ; NAROPIN; NOT FOUND; POLYAMP SP 2 MG 20 ML x 5 (/ML); AZN

72005; NEXIUM ; NEXIUM; NOT FOUND; CPR REVEST 40 MG x 28; AZN

58135; NEXIUM ; NEXIUM; NOT FOUND; CPR REVEST 20 MG x 14; AZN

58136; NEXIUM ; NEXIUM; NOT FOUND; CPR REVEST 40 MG x 7; AZN

67487; NEXIUM ; NEXIUM; NOT FOUND; F.AMP 40 MG 5 ML x 10; AZN

46632; NOLVADEX-D ; NOLVADEX D; NOT FOUND; CPR 20 MG x 30; AZN

30022; NOLVADEX ; NOLVADEX; NOT FOUND; CPR 10 MG x 30; AZN

72004; NEXIUM ; NEXIUM; NOT FOUND; CPR REVEST 20 MG x 28; AZN

64664; NIMOBAL ; NIMOBAL; NOT FOUND; CPR REVEST 30 MG x 30; BAL

64236; NIMESUBAL ; NIMESUBAL; NOT FOUND; CPR BLISTER 100 MG x 12; BAL

63616; NORFLOXACINO MG ; NORFLOXACINO; NORFLOXACINO; CPR REVEST 400 MG x 14; BF8

63615; NORFLOXACINO MG ; NORFLOXACINO; NORFLOXACINO; CPR REVEST 400 MG x 6; BF8

71279; NIMESULIDA MG ; NIMESULIDA; NIMESULIDA; GOTAS 50 MG 15 ML x 1 (/ML); BF8

64059; NIMEDALIN ; NIMEDALIN; NOT FOUND; GOTAS 50 MG 15 ML x 1 (/ML); BFR

58755; NASOFAR ; NASOFAR; NOT FOUND; SOLN NASAL 30 ML x 1; BLF

42676; NEUTOSS ; NEUTOSS; NOT FOUND; XAROPE 2 MG 100 ML x 1 (/5ML); BLF

80922; NASOFAR ; NASOFAR; NOT FOUND; SOLN NASAL H 3 % 60 ML x 1; BLF

64327; NILCLAMIDA ; NILCLAMIDA; NOT FOUND; CPR 5 MG x 30; BLF

85204; NITRA.MICONAZOL MG ; NITRA MICONAZOL; NITRATO MICONAZOL; CREME DERMAT 20 MG 28 G x 1 (/G; BLF

28478; NOVAMIN ; NOVAMIN; NOT FOUND; AMP. 250 MG 2 ML x 1; BMS

51366; NATALINS C/FLUOR ; NATALINS C FLUOR; NOT FOUND; CPR REVEST x 30; BMS

51367; NATALINS FOLICO ; NATALINS FOLICO; NOT FOUND; CPR REVEST x 30; BMS

28480; NOVAMIN ; NOVAMIN; NOT FOUND; AMP. 100 MG 2 ML x 1; BMS

28479; NOVAMIN ; NOVAMIN; NOT FOUND; AMP. 500 MG 2 ML x 1; BMS

95263; NOVANLO ; NOVANLO; NOT FOUND; CPR 2.50 MG x 30; BS2

55766; NORESTIN ; NORESTIN; NOT FOUND; CPR 0.35 MG x 35; BS2

147824; NEBILET ; NEBILET; NOT FOUND; CPR 5 MG x 56; BS2

95264; NOVANLO ; NOVANLO; NOT FOUND; CPR 5 MG x 30; BS2

75828; NEBILET ; NEBILET; NOT FOUND; CPR 5 MG x 28; BS2

30568; NIPRIDE ; NIPRIDE; NOT FOUND; AMP. LIOF 50 MG 2 ML x 5; BS2

69700; NITRA.MICONAZOL MG ; NITRA MICONAZOL; NITRATO MICONAZOL; CR.VAG.14APL 20 MG 80 G x 1 (/G; BU_

7284; NEOVLAR ; NEOVLAR; NOT FOUND; DRAG x 21; BYP

93698; NATELE ; NATELE; NOT FOUND; CAPS GEL x 14; BYP

65124; NATELE ; NATELE; NOT FOUND; CAPS GEL x 28; BYP

69407; NEBIDO ; NEBIDO; NOT FOUND; AMP. 250 MG 4 ML x 1 (/ML); BYP

71087; NEXAVAR ; NEXAVAR; NOT FOUND; CPR 200 MG x 60; BYP

47746; NIMOTOP ; NIMOTOP; NOT FOUND; CPR 30 MG x 30; BYP

61311; NEURIVIT ; NEURIVIT; NOT FOUND; CPR REVEST 100 MG x 20; CAZ

31453; NASOGRIP ; NASOGRIP; NOT FOUND; CAPS x 12; CAZ

55963; NORMAPRIL ; NORMAPRIL; NOT FOUND; CPR 25 MG x 28; CAZ

61491; NEURI-B6 ; NEURI B6; NOT FOUND; CPR REVEST 40 MG x 20; CAZ

64798; NALURIL ; NALURIL; NOT FOUND; CPR 500 MG x 56; CAZ

61312; NISUFLEX ; NISUFLEX; NOT FOUND; CPR 100 MG x 12; CAZ

61515; NIMOPAX ; NIMOPAX; NOT FOUND; CPR REVEST 30 MG x 30; CF2

58297; NEOMICON ; NEOMICON; NOT FOUND; POM. 10 G x 1; CF2

65687; NARIFLUX ; NARIFLUX; NOT FOUND; SOL NAS.12H 30 ML x 1; CF2

59084; NAUSILON B6 ; NAUSILON B6; NOT FOUND; CPR x 20; CF2

65688; NARIFLUX ; NARIFLUX; NOT FOUND; SOL NASAL AD 15 ML x 1; CF2

58298; NERALGYN ; NERALGYN; NOT FOUND; DRAG x 20; CF2

58877; NERALGYN ; NERALGYN; NOT FOUND; DRAG x 200; CF2

75755; NISTATINA MG ; NISTATINA; NISTATINA; CR.VAG.C/APL 25 K 60 G x 1 (/G); CF2

65689; NARIFLUX ; NARIFLUX; NOT FOUND; SOL NAS. INF 15 ML x 1; CF2

104597; NASOFLUID ; NASOFLUID; NOT FOUND; GOTAS NASAL 0.50 MG 30 ML x 1 (/ML); CF2

58878; NERALGYN ; NERALGYN; NOT FOUND; GOTAS 15 ML x 1; CF2

64181; NISTOMIC ; NISTOMIC; NOT FOUND; CR.VAG.C/APL 25 K 60 G x 1 (/G); CF2

60593; NAUSILON B6 ; NAUSILON B6; NOT FOUND; GOTAS 20 ML x 1; CF2

70553; NOREGYNA ; NOREGYNA; NOT FOUND; A.IM RETARD 1 ML x 1; CF2

73021; NEVRALGEX ; NEVRALGEX; NOT FOUND; CPR x 30; CM5

55657; NEVRALGEX ; NEVRALGEX; NOT FOUND; CPR x 120; CM5

146831; NATUMED VITAMINA E ; NATUMED VITAMINA E; NOT FOUND; CAPS 10 MG x 60; CM5

50809; NEOMED ; NEOMED; NOT FOUND; POM. 3.50 MG 10 G x 1 (/G); CM5

135743; NATUMED OLEO COCO ; NATUMED OLEO COCO; NOT FOUND; CAPS 1000 MG x 60; CM5

146821; NATUMED OLEO CHIA ; NATUMED OLEO CHIA; NOT FOUND; CAPS 500 MG x 60; CM5

145601; NATUMED OLEO LINHA ; NATUMED OLEO LINHA; NOT FOUND; CAPS 1000 MG x 45; CM5

69046; NEVRALGEX ; NEVRALGEX; NOT FOUND; CPR x 100; CM5

145939; NEUROTON ; NEUROTON; NOT FOUND; SOL ORAL MAR 120 ML x 1; CM5

77540; NIMESULIDA MG ; NIMESULIDA; NIMESULIDA; GEL. 20 MG 30 G x 1 (/G); CM5

64663; NEBACIMED ; NEBACIMED; NOT FOUND; POM. 15 G x 1; CM5

75537; NARIX ; NARIX; NOT FOUND; GTS NAS AD 0.05 % 30 ML x 1; CM5

70616; NITRA.MICONAZOL MG ; NITRA MICONAZOL; NITRATO MICONAZOL; LOC. 20 MG 30 ML x 1 (/G); CM5

48833; NARIX ; NARIX; NOT FOUND; GTS NAS AD 0.05 % 15 ML x 1; CM5

48834; NARIX ; NARIX; NOT FOUND; GTS NAS INF 0.01 % 15 ML x 1; CM5

61401; NORFLOXMED ; NORFLOXMED; NOT FOUND; CPR 400 MG x 7; CM5

78514; NIMESULIDA GOTA MG ; NIMESULIDA GOTA; NOT FOUND; GOTAS 50 MG 15 ML x 1 (/ML); CM5

73022; NITRA.MICONAZOL MG ; NITRA MICONAZOL; NITRATO MICONAZOL; CREME DERMAT 20 MG 28 G x 1 (/G; CM5

146825; NATUMED VITAMINA D ; NATUMED VITAMINA D; NOT FOUND; CAPS 200 IU x 60; CM5

141324; NATUMED OMEGA 3 ; NATUMED OMEGA 3; NOT FOUND; CAPS 1000 MG x 30; CM5

61400; NORFLOXMED ; NORFLOXMED; NOT FOUND; CPR 400 MG x 14; CM5

53785; NEOCAINA ; NEOCAINA; NOT FOUND; F.A.C/V-O.F. 0.25 % 20 ML x 10; CT6

45607; NARCAN ; NARCAN; NOT FOUND; AMP. 0.40 MG 1 ML x 10; CT6

58612; NOVABUPI ; NOVABUPI; NOT FOUND; F.AMP C/VAS 0.50 % 20 ML x 10; CT6

58611; NOVABUPI ; NOVABUPI; NOT FOUND; AMP.ISOBARIC 0.50 % 4 ML x 30; CT6

53788; NEOCAINA ; NEOCAINA; NOT FOUND; F.A.C/V-O.F. 0.75 % 20 ML x 10; CT6

58303; NISTATINA MG ; NISTATINA; NISTATINA; CREME VAG. 25 K 60 G x 1 (/G); CT6

76728; NADERM ; NADERM; NOT FOUND; CREME 15 G x 1; CT6

53796; NEUROLITHIUM ; NEUROLITHIUM; NOT FOUND; CPR 300 MG x 50; CT6

58613; NOVABUPI ; NOVABUPI; NOT FOUND; F.AMP S/VAS 0.50 % 20 ML x 10; CT6

53791; NEOCAINA ; NEOCAINA; NOT FOUND; F.AMP C/VAS 0.50 % 20 ML x 6; CT6

64923; NADERM ; NADERM; NOT FOUND; CREME 30 G x 1; CT6

53790; NEOCAINA ; NEOCAINA; NOT FOUND; F.AMP S/VAS 0.50 % 20 ML x 6; CT6

61550; NEURAL ; NEURAL; NOT FOUND; CPR 50 MG x 30; CT6

53783; NEOCAINA ; NEOCAINA; NOT FOUND; F.A.S/V-S.P. 0.50 % 20 ML x 10; CT6

69696; NEOCAINA ; NEOCAINA; NOT FOUND; F.AMP ISOBA. 50 % 4 ML x 40; CT6

64924; NADERM ; NADERM; NOT FOUND; POM. 30 G x 1; CT6

51840; NAUSEDRON ; NAUSEDRON; NOT FOUND; CAPS 8 MG x 10; CT6

53784; NEOCAINA ; NEOCAINA; NOT FOUND; F.A.S/V-S.P. 0.75 % 20 ML x 10; CT6

73613; NEURAL ; NEURAL; NOT FOUND; CPR 100 MG x 200; CT6

59977; NITROPRUS ; NITROPRUS; NOT FOUND; F.AMP KIT 50 MG 2 ML x 5; CT6

64517; NOVABUPI ; NOVABUPI; NOT FOUND; F.AMP C/VAS 0.25 % 20 ML x 10; CT6

62141; NOVABUPI ; NOVABUPI; NOT FOUND; F.AMP C/VAS 0.75 % 20 ML x 10; CT6

62142; NOVABUPI ; NOVABUPI; NOT FOUND; F.AMP S/VAS 0.75 % 20 ML x 10; CT6

53777; NAUSEDRON ; NAUSEDRON; NOT FOUND; AMP. 4 MG 2 ML x 50 (/ML); CT6

48212; NEOCAINA ; NEOCAINA; NOT FOUND; AMP.PESADA 0.50 % 4 ML x 20; CT6

61549; NEURAL ; NEURAL; NOT FOUND; CPR 25 MG x 30; CT6

53800; NILPERIDOL ; NILPERIDOL; NOT FOUND; AMP. 2 ML x 50; CT6

61551; NEURAL ; NEURAL; NOT FOUND; CPR 100 MG x 30; CT6

59779; NITRA.MICONAZOL MG ; NITRA MICONAZOL; NITRATO MICONAZOL; LOC. 20 MG 30 ML x 1 (/G); CT6

47770; NUBAIN ; NUBAIN; NOT FOUND; AMP. 10 MG 1 ML x 10 (/ML); CT6

53786; NEOCAINA ; NEOCAINA; NOT FOUND; F.A.C/V-O.F. 0.50 % 20 ML x 10; CT6

53782; NEOCAINA ; NEOCAINA; NOT FOUND; F.A.S/V-S.P. 0.25 % 20 ML x 10; CT6

51839; NAUSEDRON ; NAUSEDRON; NOT FOUND; AMP. 8 MG 4 ML x 1; CT6

58304; NISTATINA MG ; NISTATINA; NISTATINA; SUSP ORAL 100 K 50 ML x 1 (/ML); CT6

51838; NAUSEDRON ; NAUSEDRON; NOT FOUND; AMP. 4 MG 2 ML x 1; CT6

53778; NAUSEDRON ; NAUSEDRON; NOT FOUND; AMP. 8 MG 4 ML x 50 (/ML); CT6

53781; NEOCAINA ; NEOCAINA; NOT FOUND; AMP.PESADA 0.50 % 4 ML x 40; CT6

53795; NEPRESOL ; NEPRESOL; NOT FOUND; AMP. 20 MG 1 ML x 50; CT6

76729; NADERM ; NADERM; NOT FOUND; POM. 15 G x 1; CT6

86664; NEMODINE ; NEMODINE; NOT FOUND; CPR 10 MG x 30; DFP

85537; NEMODINE ; NEMODINE; NOT FOUND; CPR 5 MG x 30; DFP

67831; NOVIDAT ; NOVIDAT; NOT FOUND; CAPS 150 MG x 14; DFP

59086; NEMODINE ; NEMODINE; NOT FOUND; CPR 10 MG x 20; DFP

59085; NEMODINE ; NEMODINE; NOT FOUND; CPR 5 MG x 20; DFP

57425; NIMOVAS ; NIMOVAS; NOT FOUND; CPR REVEST 30 MG x 30; DFP

67830; NOVIDAT ; NOVIDAT; NOT FOUND; CAPS 75 MG x 14; DFP

43815; NEOMICIN ; NEOMICIN; NOT FOUND; POM. 20 G x 1; DLT

60187; NORMOPRES ; NORMOPRES; NOT FOUND; CPR 20 MG x 30; DLT

49202; NEOSTATIN ; NEOSTATIN; NOT FOUND; SUSP 100 K 50 ML x 1 (/ML); DLT

69783; NENE PREVENT ; NENE PREVENT; NOT FOUND; CREME 45 G x 1; DLT

60186; NEOSTATIN ; NEOSTATIN; NOT FOUND; CR.VAG.7 APL 25 K 40 G x 1 (/G); DLT

75951; NENE PREVENT ; NENE PREVENT; NOT FOUND; SAB LIQ INF 250 ML x 1; DLT

78009; NENE PREVENT ; NENE PREVENT; NOT FOUND; SABAO 80 G x 1; DLT

79788; NISUFAR ; NISUFAR; NOT FOUND; GEL. 20 MG 40 G x 1 (/G); ELO

94498; NISUFAR CPR ; NISUFAR CPR; NOT FOUND; CPR 100 MG x 12; ELO

55264; NORELBIN ; NORELBIN; NOT FOUND; F.AMP INFUS 50 MG 5 ML x 1; EUF

66288; NOEX ; NOEX; NOT FOUND; SPRAY NASAL 50 Y x 200 (/DOS); EUF

165374; NOVAFIBRA ; NOVAFIBRA; NOT FOUND; PO 225 G x 1; EUF

156835; NOURKRIN ; NOURKRIN; NOT FOUND; CPR x 60; EUF

55263; NORELBIN ; NORELBIN; NOT FOUND; F.AMP INFUS 10 MG 1 ML x 1; EUF

165375; NOVAFIBRA ; NOVAFIBRA; NOT FOUND; SACHE 5 G x 10; EUF

73476; NOEX ; NOEX; NOT FOUND; SPRAY NASAL 100 Y x 100 (/DOS); EUF

59418; NITR.ISOCONAZOL MG ; NITR ISOCONAZOL; NITRATO ISOCONAZOL; CREME 10 MG 20 G x 1 (/G); EUF

56328; NATECAL ; NATECAL; NOT FOUND; CPR D MASC x 60; EUF

66287; NOEX ; NOEX; NOT FOUND; SPRAY NASAL 32 Y x 120 (/DOS); EUF

65501; NIMESULIDA MG ; NIMESULIDA; NIMESULIDA; CPR 100 MG x 12; EUF

60297; NIMESULIDA MG ; NIMESULIDA; NIMESULIDA; GOTAS 50 MG 15 ML x 1 (/ML); EUF

75507; NODE DS+ ; NODE DS; NOT FOUND; SHAMP A/CASP 125 ML x 1; EUF

59419; NITR.ISOCONAZOL MG ; NITR ISOCONAZOL; NITRATO ISOCONAZOL; CR.VAG.7 APL 10 MG 40 G x 1 (/G; EUF

49659; NAOX ; NAOX; NOT FOUND; AMP. 5 IU 1 ML x 50; EUF

108181; NIT FENTICONA MG ; NIT FENTICONA; NITRATO FENTICONAZOL; CR.VAG.7 APL 20 MG 40 G x 1 (/G); EUF

66289; NOEX ; NOEX; NOT FOUND; SPRAY NASAL 64 Y x 120 (/DOS); EUF

70010; NUTRADERM NF ; NUTRADERM NF; NOT FOUND; CREME 60 G x 1; GLD

112603; NUTRAPLUS ; NUTRAPLUS; NOT FOUND; K 8% 300+120 420 ML x 1; GLD

75134; NUTRADERM ; NUTRADERM; NOT FOUND; LOC 30 PUMP 300 ML x 1; GLD

142090; NUTRAPLUS ; NUTRAPLUS; NOT FOUND; LOC. 3 % 150 ML x 1; GLD

105741; NUTRAPLUS ; NUTRAPLUS; NOT FOUND; LOC. 10 % 300 ML x 1; GLD

33364; NUTRADERM ; NUTRADERM; NOT FOUND; CREME 60 G x 1; GLD

83375; NUTRAPLUS ; NUTRAPLUS; NOT FOUND; CREME. 20 % 60 G x 1; GLD

77028; NUTRAPLUS ; NUTRAPLUS; NOT FOUND; KIT DUO 8 % 120 ML x 1; GLD

34039; NUTRAPLUS ; NUTRAPLUS; NOT FOUND; LIQD 10 % 120 ML x 1; GLD

75136; NUTRAPLUS ; NUTRAPLUS; NOT FOUND; LOC PUMP 8 % 300 ML x 1; GLD

48076; NUTRADERM ; NUTRADERM; NOT FOUND; LOC. 30 120 ML x 1; GLD

33795; NUTRAPLUS ; NUTRAPLUS; NOT FOUND; CREME 10 % 60 G x 1; GLD

70009; NUTRADERM NF ; NUTRADERM NF; NOT FOUND; LOC. 120 ML x 1; GLD

75135; NUTRADERM NF ; NUTRADERM NF; NOT FOUND; LOCAO PUMP 300 ML x 1; GLD

73158; NUTRAPLUS ; NUTRAPLUS; NOT FOUND; LOC. 8 % 120 ML x 1; GLD

47810; NUTRACORT ; NUTRACORT; NOT FOUND; CREME 1 % 15 G x 1; GLD

31868; NUTRADERM ; NUTRADERM; NOT FOUND; LOC. 120 ML x 1; GLD

65126; NORXACIN ; NORXACIN; NOT FOUND; CPR REVEST 400 MG x 14; GLO

76336; NITR.ISOCONAZOL MG ; NITR ISOCONAZOL; NITRATO ISOCONAZOL; CR.VAG.7 APL 10 MG 40 G x 1 (/G; GLO

95289; NIOLIX ; NIOLIX; NOT FOUND; CAPS 1000 MG x 15; GLO

69755; NOVOPRAZOL ; NOVOPRAZOL; NOT FOUND; CAPS 20 MG x 56; GLO

60260; NOVACIMET ; NOVACIMET; NOT FOUND; CPR 200 MG x 40; GLO

60261; NOVOPRAZOL ; NOVOPRAZOL; NOT FOUND; CAPS 10 MG x 14; GLO

71802; NEOTIFEN ; NEOTIFEN; NOT FOUND; XAROPE 120 ML x 1; GLO

77247; NORFLOXACINO MG ; NORFLOXACINO; NORFLOXACINO; CPR REVEST 400 MG x 14; GLO

77410; NIST+OXID.ZINCO MG ; NIST OXID ZINCO; NOT FOUND; POM.DERMAT 60 G x 1; GLO

67580; NOVOPRAZOL ; NOVOPRAZOL; NOT FOUND; CAPS 20 MG x 28; GLO

60246; NECRORGAN ; NECRORGAN; NOT FOUND; FLACONETES 10 ML x 60; GLO

60245; NECRORGAN ; NECRORGAN; NOT FOUND; FLACONETES 10 ML x 10; GLO

60263; NOVOPRAZOL ; NOVOPRAZOL; NOT FOUND; CAPS 20 MG x 14; GLO

75871; NOVOSORO H ; NOVOSORO H; NOT FOUND; SPRAY NASAL 30 MG 60 ML x 1 (/ML); GLO

77177; NEONID ; NEONID; NOT FOUND; CREME 0.50 MG 30 G x 1 (/G); GLO

76359; NOVOSORO NF ; NOVOSORO NF; NOT FOUND; SOL NASAL AD 0.50 MG 30 ML x 1 (/ML); GLO

60262; NOVOPRAZOL ; NOVOPRAZOL; NOT FOUND; CAPS 20 MG x 7; GLO

95295; NIOLIX ; NIOLIX; NOT FOUND; CAPS 1000 MG x 30; GLO

65125; NEOM ; NEOM; NOT FOUND; POM.DERMAT 15 G x 1; GLO

69337; NISTATINA MG ; NISTATINA; NISTATINA; SUSP 100 K 50 ML x 1 (/ML); GM2

72297; NIMESULIDA MG ; NIMESULIDA; NIMESULIDA; GEL DERMAT. 20 MG 30 G x 1 (/G); GM2

75658; NEUTROCAL D ; NEUTROCAL D; NOT FOUND; CPR REVEST x 60; GM2

100332; NUTRIGER BETAMELAN ; NUTRIGER BETAMELAN; NOT FOUND; CAPS GEL x 30; GM2

131463; NUTRIGAMY MULT ; NUTRIGAMY MULT; NOT FOUND; GOMAS x 30; GM2

69865; NISTATINA MG ; NISTATINA; NISTATINA; CR.VAG.14APL 25 K 60 G x 1 (/G); GM2

66755; NIST+OXID.ZINCO MG ; NIST OXID ZINCO; NOT FOUND; POM.DERMAT 60 G x 1; GM2

71383; NITR.ISOCONAZOL MG ; NITR ISOCONAZOL; NITRATO ISOCONAZOL; CREME DERMAT 10 MG 20 G x 1 (/G; GM2

100331; NUTRIGER ANTI-OX ; NUTRIGER ANTI OX; NOT FOUND; CAPS GEL 80 MG x 60; GM2

66758; NITRA.MICONAZOL MG ; NITRA MICONAZOL; NITRATO MICONAZOL; LOC. 20 MG 30 G x 1 (/G); GM2

66757; NITRA.MICONA.CR.MG ; NITRA MICONA CR; NOT FOUND; CR.VAG.14APL 20 MG 80 G x 1 (/G; GM2

66761; NORFLOXACINO MG ; NORFLOXACINO; NORFLOXACINO; CPR 400 MG x 14; GM2

67679; NITR.ISOCONAZOL MG ; NITR ISOCONAZOL; NITRATO ISOCONAZOL; CR.VAG.7 APL 40 G x 1; GM2

100333; NUTRIGER FISSITA ; NUTRIGER FISSITA; NOT FOUND; CAPS GEL x 30; GM2

100334; NUTRIGER LICOGOLD ; NUTRIGER LICOGOLD; NOT FOUND; CPR REV . x 30; GM2

66760; NITRAZEPAM MG ; NITRAZEPAM; NITRAZEPAM; CPR 5 MG x 20; GM2

131468; NUTRIGAMY VITAC ; NUTRIGAMY VITAC; NOT FOUND; GOMAS x 30; GM2

71721; NITRA.MICONAZOL MG ; NITRA MICONAZOL; NITRATO MICONAZOL; CREME DERMAT 20 MG 28 G x 1 (/G; GM2

80409; NITRATO FENTICO MG ; NITRATO FENTICO; NITRATO FENTICONAZOL; CR.VAG.7 APL 40 G x 1; GM2

70614; NIMODIPINO MG ; NIMODIPINO; NIMODIPINO; CPR REVEST 30 MG x 30; GM2

65683; NISOFLAN ; NISOFLAN; NOT FOUND; CPR 100 MG x 480; GOB

71353; NITRA.MICONA.CR.MG ; NITRA MICONA CR; NOT FOUND; CREME DERMAT 20 MG 28 G x 1 (/G; GOB

63229; NIOXIL ; NIOXIL; NOT FOUND; CPR 10 MG x 30; GOB

70615; NITRA.MICONAZOL MG ; NITRA MICONAZOL; NITRATO MICONAZOL; CR.VAG.14APL 20 MG 80 G x 1 (/G; GOB

94294; NISOFLAN ; NISOFLAN; NOT FOUND; GOTAS 50 MG 15 ML x 1 (/ML); GOB

63748; NISOFLAN ; NISOFLAN; NOT FOUND; CPR 100 MG x 12; GOB

67106; NIOXIL ; NIOXIL; NOT FOUND; CPR 20 MG x 450; GOB

71941; NIOXIL ; NIOXIL; NOT FOUND; CPR 10 MG x 450; GOB

63230; NIOXIL ; NIOXIL; NOT FOUND; CPR 20 MG x 20; GOB

75866; NISTRAZIN ; NISTRAZIN; NOT FOUND; CR.VAG.14APL 25 IU 60 G x 1 (/G); GOB

73156; NITR.ISOCONAZOL MG ; NITR ISOCONAZOL; NITRATO ISOCONAZOL; CREME DERMAT 10 MG 20 G x 1 (/G; GOB

71695; NISTATINA MG ; NISTATINA; NISTATINA; CR.VAG.14APL 25 K 60 G x 1 (/G); GOB

69047; NIOXIL ; NIOXIL; NOT FOUND; CPR 20 MG x 30; GOB

55764; NICOSTAT ; NICOSTAT; NOT FOUND; CREME VAG. 25 K 60 G x 1 (/G); GP8

55765; NICOSTAT ; NICOSTAT; NOT FOUND; SUSP 100 K 50 ML x 1 (/ML); GP8

61051; NISTATINA MG ; NISTATINA; NISTATINA; CR.VAG.C/APL 25 K 60 G x 1 (/G); GP8

55374; NOVAGREEN ; NOVAGREEN; NOT FOUND; CPR 500 MG x 100; GP8

55375; NOVAGREEN ; NOVAGREEN; NOT FOUND; GOTAS 10 ML x 1; GP8

55757; NEODERMICINA ; NEODERMICINA; NOT FOUND; POM. 5 MG 10 G x 1 (/G); GP8

59781; NORFLOXIL ; NORFLOXIL; NOT FOUND; CPR 400 MG x 14; GP8

28038; NUCLEO CMP ; NUCLEO CMP; NOT FOUND; CAPS x 20; GRO

28037; NUCLEO CMP ; NUCLEO CMP; NOT FOUND; AMP. LIOF x 3; GRO

62562; NOVOSIL ; NOVOSIL; NOT FOUND; GOTAS 4 MG 10 ML x 200 (/ML); HPO

62560; NOVOSIL ; NOVOSIL; NOT FOUND; AMP. 10 MG 2 ML x 100; HPO

73025; NOREPINEFRINA MG ; NOREPINEFRINA; NOREPINEFRINA; AMP.INFUSION 8 MG 4 ML x 50; HPO

65171; NACLOFAN ; NACLOFAN; NOT FOUND; GOTAS 15 MG 10 ML x 200 (/ML); HPO

62464; NACLOFEN ; NACLOFEN; NOT FOUND; DRAG 50 MG x 20; HPO

86858; NITRA.MICONA.CR MG ; NITRA MICONA CR; NOT FOUND; CR VAG 50APL 20 MG 80 G x 50 (/; HPO

65172; NEODERM ; NEODERM; NOT FOUND; POM. 10 G x 100; HPO

67405; NEORINO ; NEORINO; NOT FOUND; SOLN NASAL 30 ML x 1; HPO

65167; NACLOFAN ; NACLOFAN; NOT FOUND; DRAG 50 MG x 20; HPO

87535; NITRA.MICONAZOL MG ; NITRA MICONAZOL; NITRATO MICONAZOL; CREME. 20 MG 28 G x 50 (/G); HPO

70778; NOREPINEFRINA MG ; NOREPINEFRINA; NOREPINEFRINA; AMP.INFUSION 8 MG 4 ML x 10; HPO

74183; NITR.ISOCONAZOL MG ; NITR ISOCONAZOL; NITRATO ISOCONAZOL; CR.VAG.7 APL 10 MG 40 G x 1 (/G; HPO

65173; NEODERM ; NEODERM; NOT FOUND; POM. 10 G x 1; HPO

65170; NACLOFAN ; NACLOFAN; NOT FOUND; GOTAS 15 MG 20 ML x 1 (/ML); HPO

62463; NACLOFEN ; NACLOFEN; NOT FOUND; AMP. 75 MG 3 ML x 100; HPO

62561; NOVOSIL ; NOVOSIL; NOT FOUND; CPR 10 MG x 500; HPO

75990; NOVOSIL ; NOVOSIL; NOT FOUND; CPR 10 MG x 20; HPO

47283; NIZORAL SHAMPOO ; NIZORAL SHAMPOO; NOT FOUND; XAMP 2 % 100 ML x 1; J_C

89126; NARICLEAR ; NARICLEAR; NOT FOUND; SOLN NASAL 100 ML x 1; J_C

89123; NARICLEAR ; NARICLEAR; NOT FOUND; SOL NAS.KIDS 100 ML x 1; J_C

32377; NIZORAL ; NIZORAL; NOT FOUND; CPR 200 MG x 30; J_C

32376; NIZORAL ; NIZORAL; NOT FOUND; CPR 200 MG x 10; J_C

47192; NIZORAL CR. ; NIZORAL CR; NOT FOUND; CREME 20 MG 30 G x 1 (/G); J_C

74736; NEUTROGENA HIDRATA ; NEUTROGENA HIDRATA; NOT FOUND; CR O F FPS15 50 ML x 1; J_J

100591; NEUTROGENA ULT.SHE ; NEUTROGENA ULT SHE; NOT FOUND; K LLF55+NWGC 245 ML x 1; J_J

51659; NEUTROGENA ; NEUTROGENA; NOT FOUND; LOC.HIDRATA. 118 ML x 1; J_J

60880; NEUTROGENA HEAL SK ; NEUTROGENA HEAL SK; NOT FOUND; CR.ANT.RU.15 40 G x 1; J_J

80699; NEUTROGENA ULT.SHE ; NEUTROGENA ULT SHE; NOT FOUND; LIQ LOT FP55 45 ML x 1; J_J

96876; NEUTROGENA SUN FR ; NEUTROGENA SUN FR; NOT FOUND; LOCAO FPS15 120 ML x 1; J_J

78452; NEUTROGENA BO CARE ; NEUTROGENA BO CARE; NOT FOUND; CR INT EX/SE 400 ML x 1; J_J

75046; NEUTROGENA D CLEAN ; NEUTROGENA D CLEAN; NOT FOUND; ESP ENER LIM 177 ML x 1; J_J

163163; NEUTROGENA D CLEAN ; NEUTROGENA D CLEAN; NOT FOUND; KE100G+TO+NE 200 ML x 1; J_J

96881; NEUTROGENA SUN FR ; NEUTROGENA SUN FR; NOT FOUND; LOCAO FPS60 200 ML x 1; J_J

52907; NEUTROGENA ; NEUTROGENA; NOT FOUND; LOC.FA.FPS15 73 ML x 1; J_J

73508; NEUTROGENA R CLEAR ; NEUTROGENA R CLEAR; NOT FOUND; ESF AN/CRAVO 100 G x 1; J_J

77866; NEUTROGENA D CLEAN ; NEUTROGENA D CLEAN; NOT FOUND; CREME ESFOLI 100 ML x 1; J_J

96871; NEUTROGENA SUN FR ; NEUTROGENA SUN FR; NOT FOUND; SPRAY FPS30 180 ML x 1; J_J

74368; NICORETTE ; NICORETTE; NOT FOUND; ADES TRANSD 8.30 MG x 7 (/5); J_J

158189; NEUTROGENA SUN FR ; NEUTROGENA SUN FR; NOT FOUND; K F30+DP LD7 120 ML x 1; J_J

73502; NEUTROGENA D CLEAN ; NEUTROGENA D CLEAN; NOT FOUND; ADSTR 200 ML x 1; J_J

74739; NEUTROGENA U LIGHT ; NEUTROGENA U LIGHT; NOT FOUND; CR P NOR/SEC 55 G x 1; J_J

96877; NEUTROGENA SUN FR ; NEUTROGENA SUN FR; NOT FOUND; LOCAO FPS30 120 ML x 1; J_J

78451; NEUTROGENA BO CARE ; NEUTROGENA BO CARE; NOT FOUND; CREME FPS15 200 ML x 1; J_J

81212; NICORETTE ; NICORETTE; NOT FOUND; GOMA MINT 4 MG x 60; J_J

60718; NICORETTE ; NICORETTE; NOT FOUND; GOMA CLASSIC 2 MG x 30; J_J

77027; NEUTROGENA R CLEAR ; NEUTROGENA R CLEAR; NOT FOUND; SAB FAC ESFO 80 G x 1; J_J

85182; NICORETTE ; NICORETTE; NOT FOUND; GOMA ICEMINT 2 MG x 30; J_J

85425; NEUTROGENA D CLEAN ; NEUTROGENA D CLEAN; NOT FOUND; S L F GFRUIT 80 G x 1; J_J

72205; NICORETTE ; NICORETTE; NOT FOUND; GOMA F MINT 2 MG x 30; J_J

51657; NEUTROGENA ; NEUTROGENA; NOT FOUND; LOC.C/LEVE15 118 ML x 1; J_J

51664; NEUTROGENA S ORIG ; NEUTROGENA S ORIG; NOT FOUND; SAB.FACIAL 100 G x 1; J_J

72724; NEUTROGENA F COOLI ; NEUTROGENA F COOLI; NOT FOUND; AERO FPS 30 141 G x 1; J_J

73513; NEUTROGENA INTENSI ; NEUTROGENA INTENSI; NOT FOUND; CREME HI/IN 200 ML x 1; J_J

69458; NICORETTE ; NICORETTE; NOT FOUND; GOMA MINT 4 MG x 30; J_J

73500; NEUTROGENA B OIL ; NEUTROGENA B OIL; NOT FOUND; OLEO 250 ML x 1; J_J

80698; NEUTROGENA ULT.SHE ; NEUTROGENA ULT SHE; NOT FOUND; LIQ LOT FP35 45 ML x 1; J_J

75989; NEUTROGENA NWG ; NEUTROGENA NWG; NOT FOUND; CR MAOS F15 56 G x 1; J_J

77026; NEUTROGENA R CLEAR ; NEUTROGENA R CLEAR; NOT FOUND; LOC.HIDRATA. 50 ML x 1; J_J

74733; NEUTROGENA HIDRATA ; NEUTROGENA HIDRATA; NOT FOUND; CR O F P SEN 50 ML x 1; J_J

53524; NEUTROGENA HEAL SK ; NEUTROGENA HEAL SK; NOT FOUND; CR.ANTI-RUGA 40 G x 1; J_J

51666; NEUTROGENA ; NEUTROGENA; NOT FOUND; S.OIL F/WASH 177 ML x 1; J_J

72950; NEUTROGENA ULT.SHE ; NEUTROGENA ULT SHE; NOT FOUND; LOCION FPS70 88 ML x 1; J_J

96880; NEUTROGENA SUN FR ; NEUTROGENA SUN FR; NOT FOUND; LOCAO FPS30 200 ML x 1; J_J

74734; NEUTROGENA NWG ; NEUTROGENA NWG; NOT FOUND; CR PES RESS 56 G x 1; J_J

96875; NEUTROGENA SUN FR ; NEUTROGENA SUN FR; NOT FOUND; SPRAY FPS15 180 ML x 1; J_J

96878; NEUTROGENA SUN FR ; NEUTROGENA SUN FR; NOT FOUND; LOCAO FPS50 120 ML x 1; J_J

