77491; PEDIASURE ; PEDIASURE; NOT FOUND; PO COMP CHOC 900 G x 1; ABT

67315; PROSURE ; PROSURE; NOT FOUND; TETRA P BAU 240 ML x 1; ABT

51856; POLIGINAX ; POLIGINAX; NOT FOUND; CR.VAG.12APL 60 G x 1; ABT

51509; PEDIASURE ; PEDIASURE; NOT FOUND; LIQ COMP BAU 237 ML x 1; ABT

51320; PEDIALYTE 45 ; PEDIALYTE 45; NOT FOUND; SOLN MACA 500 ML x 1; ABT

99983; PEDIALYTE ZINCO 60 ; PEDIALYTE ZINCO 60; NOT FOUND; SOL UVA 500 ML x 1; ABT

57904; PIASCLEDINE ; PIASCLEDINE; NOT FOUND; CAPS 300 MG x 15; ABT

92419; PEDIASURE ; PEDIASURE; NOT FOUND; PO COMP MORA 400 G x 1; ABT

76363; PIASCLEDINE ; PIASCLEDINE; NOT FOUND; CAPS 300 MG x 30; ABT

53407; PULMOCARE ; PULMOCARE; NOT FOUND; LIQD BAUNIL. 1000 ML x 1; ABT

99982; PEDIALYTE ZINCO 60 ; PEDIALYTE ZINCO 60; NOT FOUND; SOL MACA 500 ML x 1; ABT

54489; PEDIALYTE 45 ; PEDIALYTE 45; NOT FOUND; SOLN PESSEGO 500 ML x 1; ABT

51317; PEDIALYTE 45 ; PEDIALYTE 45; NOT FOUND; SOLN CEREJA 500 ML x 1; ABT

52929; PEDIASURE ; PEDIASURE; NOT FOUND; PO COMP CHOC 400 G x 1; ABT

59294; PRECISION PLUS ; PRECISION PLUS; NOT FOUND; TIRAS TESTE x 100; ABT

77490; PEDIASURE ; PEDIASURE; NOT FOUND; PO COMP BAUN 900 G x 1; ABT

53397; PERATIVE ; PERATIVE; NOT FOUND; LIQD 237 ML x 1; ABT

99980; PEDIALYTE ZINCO 45 ; PEDIALYTE ZINCO 45; NOT FOUND; SOL MACA 500 ML x 1; ABT

67316; PROSURE ; PROSURE; NOT FOUND; TETRA P LAR 240 ML x 1; ABT

50906; PANZYTRAT ; PANZYTRAT; NOT FOUND; CAPS GASTROR x 12; ABT

54297; PROFORT ; PROFORT; NOT FOUND; LIQD BAUNIL. 1000 ML x 1; ABT

51511; PEDIASURE ; PEDIASURE; NOT FOUND; LIQ COMP MOR 237 ML x 1; ABT

51852; PEDIALYTE 45 ; PEDIALYTE 45; NOT FOUND; SOLN GUARANA 500 ML x 1; ABT

51318; PEDIALYTE 45 ; PEDIALYTE 45; NOT FOUND; SOLN COCO 500 ML x 1; ABT

99981; PEDIALYTE ZINCO 45 ; PEDIALYTE ZINCO 45; NOT FOUND; SOL MORANGO 500 ML x 1; ABT

32529; POLIGINAX ; POLIGINAX; NOT FOUND; CAPS VAGI x 12; ABT

67314; PROSURE ; PROSURE; NOT FOUND; TETRA P BAN 240 ML x 1; ABT

51316; PEDIALYTE 90 ; PEDIALYTE 90; NOT FOUND; SOLN ORAL 500 ML x 1; ABT

51512; PEDIASURE ; PEDIASURE; NOT FOUND; PO COMP BAUN 400 G x 1; ABT

142034; PROSURE ; PROSURE; NOT FOUND; LIQ RPB BAN 220 ML x 1; ABT

72820; PROSURE ; PROSURE; NOT FOUND; PO BAUNILHA 380 G x 1; ABT

99979; PEDIALYTE ZINCO 45 ; PEDIALYTE ZINCO 45; NOT FOUND; SOL GUARANA 500 ML x 1; ABT

54490; PEDIALYTE 45 ; PEDIALYTE 45; NOT FOUND; SOLN.T.FRUTI 500 ML x 1; ABT

53398; PERATIVE ; PERATIVE; NOT FOUND; LIQD 1000 ML x 1; ABT

51315; PEDIALYTE ; PEDIALYTE; NOT FOUND; SOLN ORAL 500 ML x 1; ABT

49357; PICRATO BUTESIN ; PICRATO BUTESIN; NOT FOUND; POM. 1 % 15 G x 1; ABT

150768; PROSURE ; PROSURE; NOT FOUND; LIQ RPB BAUN 220 ML x 1; ABT

51670; PREDNISONA ; PREDNISONA; PREDNISONA; CPR 5 MG x 20; ABT

142035; PROSURE ; PROSURE; NOT FOUND; LIQ RPB LAR 220 ML x 1; ABT

75489; PROGRAF XL ; PROGRAF XL; NOT FOUND; CAPS L.P. 5 MG x 50; AES

54786; PROGRAF ; PROGRAF; NOT FOUND; CAPS 1 MG x 100; AES

75488; PROGRAF XL ; PROGRAF XL; NOT FOUND; CAPS L.P. 1 MG x 50; AES

54787; PROGRAF ; PROGRAF; NOT FOUND; CAPS 5 MG x 50; AES

53395; PATANOL ; PATANOL; NOT FOUND; SOLN OFTAL 0.10 % 5 ML x 1; ALC

72226; PATANOL S ; PATANOL S; NOT FOUND; SOLN OFTAL 0.20 % 2.50 ML x 1; ALC

54294; PRED MILD ; PRED MILD; NOT FOUND; SUSP OFTAL 0.12 % 10 ML x 1; ALL

50257; POLIPRED ; POLIPRED; NOT FOUND; SUSP OFTAL 5 ML x 1; ALL

54293; PRED MILD ; PRED MILD; NOT FOUND; SUSP OFTAL 0.12 % 5 ML x 1; ALL

33119; PROPINE ; PROPINE; NOT FOUND; COLIRIO 0.10 % 10 ML x 1; ALL

46825; PILOCARPINA ; PILOCARPINA; PILOCARPINA; COLIRIO 4 % 10 ML x 1; ALL

46877; PILOCARPINA ; PILOCARPINA; PILOCARPINA; COLIRIO 1 % 10 ML x 1; ALL

46824; PILOCARPINA ; PILOCARPINA; PILOCARPINA; COLIRIO 2 % 10 ML x 1; ALL

49664; PRED FORT ; PRED FORT; NOT FOUND; SUSP OFTAL 1 % 5 ML x 1; ALL

74448; PANKREOFLAT ; PANKREOFLAT; NOT FOUND; DRAG x 30; APS

54448; PRIMID ; PRIMID; NOT FOUND; CPR 100 MG x 100; APS

7974; PANKREOFLAT ; PANKREOFLAT; NOT FOUND; DRAG x 20; APS

74966; POSTEC ; POSTEC; NOT FOUND; POM. 20 G x 1; APS

63835; PRIMID ; PRIMID; NOT FOUND; CPR 250 MG x 20; APS

62092; POSTEC ; POSTEC; NOT FOUND; POM. 10 G x 1; APS

56856; PHARMATON KIDDI ; PHARMATON KIDDI; NOT FOUND; XPE C/DOSIFI 120 ML x 1; B_I

44000; PERLUTAN ; PERLUTAN; NOT FOUND; AMP. 1 ML x 1; B_I

77677; PHARMATON KIDDI ; PHARMATON KIDDI; NOT FOUND; XAROPE 200 ML x 1; B_I

83482; PRADAXA ; PRADAXA; NOT FOUND; CAPS 150 MG x 60; B_I

75422; PRADAXA ; PRADAXA; NOT FOUND; CAPS 110 MG x 10; B_I

51854; PHARMATON ; PHARMATON; NOT FOUND; CAPS x 30; B_I

31245; PERSANTIN 75 ; PERSANTIN 75; NOT FOUND; DRAG 75 MG x 40; B_I

75420; PRADAXA ; PRADAXA; NOT FOUND; CAPS 75 MG x 10; B_I

83487; PRADAXA ; PRADAXA; NOT FOUND; CAPS 150 MG x 30; B_I

46450; PERSANTIN 100 ; PERSANTIN 100; NOT FOUND; DRAG 100 MG x 50; B_I

75421; PRADAXA ; PRADAXA; NOT FOUND; CAPS 75 MG x 30; B_I

51855; PHARMATON ; PHARMATON; NOT FOUND; CAPS x 100; B_I

75423; PRADAXA ; PRADAXA; NOT FOUND; CAPS 110 MG x 30; B_I

83483; PRADAXA ; PRADAXA; NOT FOUND; CAPS 150 MG x 10; B_I

83480; PRADAXA ; PRADAXA; NOT FOUND; CAPS 110 MG x 60; B_I

8279; PERSANTIN 75 ; PERSANTIN 75; NOT FOUND; DRAG 75 MG x 200; B_I

8274; PERSANTIN ; PERSANTIN; NOT FOUND; AMP. 10 MG 2 ML x 5; B_I

75663; PHARMATON ; PHARMATON; NOT FOUND; CAPS x 60; B_I

139543; PARADOR DUOCF ; PARADOR DUOCF; NOT FOUND; CPR x 20; B_I

64022; PROSTEM ; PROSTEM; NOT FOUND; CAPS 50 MG x 30; BAL

64237; PROSTEM ; PROSTEM; NOT FOUND; CAPS 100 MG x 30; BAL

49621; PROSTEM PLUS ; PROSTEM PLUS; NOT FOUND; CAPS x 12; BAL

72653; PROTHROMPLEX-T ; PROTHROMPLEX T; NOT FOUND; F.AMP 600 IU 20 ML x 1; BAX

8087; PARTOGAMA ; PARTOGAMA; NOT FOUND; F.AMP 0.25 MG 2 ML x 1; BAX

45292; PARTOGAMA ; PARTOGAMA; NOT FOUND; F.AMP 0.30 MG 2 ML x 1; BAX

62750; PREDNISONA MG ; PREDNISONA; PREDNISONA; CPR 5 MG x 20; BF8

66855; PARACETAMOL MG ; PARACETAMOL; PARACETAMOL; CPR 750 MG x 200; BF8

66279; PARACETAMOL MG ; PARACETAMOL; PARACETAMOL; CPR 750 MG x 20; BF8

62752; PREDNISONA MG ; PREDNISONA; PREDNISONA; CPR 20 MG x 10; BF8

58037; PARAMOL ; PARAMOL; NOT FOUND; CPR 750 MG x 200; BLF

47277; PLABEL ; PLABEL; NOT FOUND; GOTAS 1 MG 10 ML x 1 (/ML); BLF

64334; PIOSAN ; PIOSAN; NOT FOUND; LIQD 1 % 60 ML x 1; BLF

56044; PARAMOL ; PARAMOL; NOT FOUND; GOTAS 200 MG 15 ML x 1 (/ML); BLF

90882; PASTA AGUA ; PASTA AGUA; NOT FOUND; POM MENTOLAD 80 G x 1; BLF

44349; POMICINA ; POMICINA; NOT FOUND; POM. 20 G x 1; BLF

56740; PLABEL ; PLABEL; NOT FOUND; CPR 10 MG x 20; BLF

64335; PIROFLAM ; PIROFLAM; NOT FOUND; CAPS 20 MG x 10; BLF

64336; PROMERGAN ; PROMERGAN; NOT FOUND; CREME 20 MG 30 G x 1 (/G); BLF

58038; PARAMOL ; PARAMOL; NOT FOUND; CPR 750 MG x 12; BLF

8486; POLIPLEX ; POLIPLEX; NOT FOUND; LIQD 200 ML x 1; BMS

47198; PARAPLATIN ; PARAPLATIN; NOT FOUND; F.IV LIOF 150 MG x 1; BMS

47199; PARAPLATIN ; PARAPLATIN; NOT FOUND; F.IV LIOF 450 MG x 1; BMS

98534; PHITOSS ; PHITOSS; NOT FOUND; XAR FRAMB 7 MG 240 ML x 1 (/ML); BRT

76197; PHITOSS ; PHITOSS; NOT FOUND; XPE 35 MG 100 ML x 1 (/5ML); BRT

58629; PROPANOLON ; PROPANOLON; NOT FOUND; CPR 40 MG x 40; BRT

73851; PLURIMEC ; PLURIMEC; NOT FOUND; CPR 6 MG x 2; BS2

70505; PRESS PLUS ; PRESS PLUS; NOT FOUND; CAPS 20 MG x 30 (/5); BS2

76803; PRESSAT ; PRESSAT; NOT FOUND; CPR 10 MG x 60; BS2

164079; PRESS PLUS ; PRESS PLUS; NOT FOUND; CAPS 10 MG x 60 (/5); BS2

73852; PLURIMEC ; PLURIMEC; NOT FOUND; CPR 6 MG x 4; BS2

75599; PLURIMEC ; PLURIMEC; NOT FOUND; CPR 6 MG x 8; BS2

62308; PLAKETAR ; PLAKETAR; NOT FOUND; CPR REVEST 250 MG x 30; BS2

70504; PRESS PLUS ; PRESS PLUS; NOT FOUND; CAPS 10 MG x 30 (/5); BS2

53157; PRESSAT ; PRESSAT; NOT FOUND; CPR 10 MG x 20; BS2

71636; PRESSAT ; PRESSAT; NOT FOUND; CPR 2.50 MG x 30; BS2

76992; PANTOHAIR ; PANTOHAIR; NOT FOUND; XAMP A/Q. 200 ML x 1; BS2

159918; PRESSAT ; PRESSAT; NOT FOUND; CPR 2.50 MG x 60; BS2

73705; PRESS PLUS ; PRESS PLUS; NOT FOUND; CAPS 2.50 MG x 30 (/10); BS2

95433; PHOTOPROT ; PHOTOPROT; NOT FOUND; GEL CR FPS45 120 ML x 1; BS2

95432; PHOTOPROT ; PHOTOPROT; NOT FOUND; LOC FLU F45 150 ML x 1; BS2

75595; PANTOHAIR ; PANTOHAIR; NOT FOUND; LOC.CAPILAR 95 ML x 1; BS2

85496; PHOTOPROT ; PHOTOPROT; NOT FOUND; L C ESC F100 40 ML x 1; BS2

57905; PLAKETAR ; PLAKETAR; NOT FOUND; CPR REVEST 250 MG x 20; BS2

58442; PRESSAT ; PRESSAT; NOT FOUND; CPR 10 MG x 30; BS2

71281; PANTOGAR ; PANTOGAR; NOT FOUND; CAPS x 90; BS2

58441; PRESSAT ; PRESSAT; NOT FOUND; CPR 5 MG x 30; BS2

54788; PROPILRACIL ; PROPILRACIL; NOT FOUND; CPR 100 MG x 30; BS2

85498; PHOTOPROT ; PHOTOPROT; NOT FOUND; L C CLA F100 40 ML x 1; BS2

53156; PRESSAT ; PRESSAT; NOT FOUND; CPR 5 MG x 20; BS2

78833; PREVELIP ; PREVELIP; NOT FOUND; CAPS x 60; BS2

76618; PHOTOPROT ; PHOTOPROT; NOT FOUND; LOC FL FP100 40 ML x 1; BS2

71280; PANTOGAR ; PANTOGAR; NOT FOUND; CAPS x 30; BS2

76802; PRESSAT ; PRESSAT; NOT FOUND; CPR 5 MG x 60; BS2

66859; PRESERV ; PRESERV; NOT FOUND; GEL LUBRIC. 5 G x 5; BU_

51971; PENKARON ; PENKARON; NOT FOUND; F.AMP LIOF 400 K 2 ML x 50; BU_

72335; PRESERV ; PRESERV; NOT FOUND; GEL NONOX 40 G x 1; BU_

155027; PACLITAXEL MG ; PACLITAXEL; PACLITAXEL; F.AMP 6 MG 16.7 ML x 1 (/ML); BU_

141997; PANTOPRAP.SO SE MG ; PANTOPRAP SO SE; NOT FOUND; F.A IV C/DIL 40 MG 10 ML x 20; BU_

66858; PRESERV ; PRESERV; NOT FOUND; GEL LUBRIC. 40 G x 1; BU_

72726; PENKARON ; PENKARON; NOT FOUND; F.AMP S/DILU 400 K x 100; BU_

77855; PRESERV ; PRESERV; NOT FOUND; GEL NONOX 2 % 5 G x 5; BU_

51972; PENKARON ; PENKARON; NOT FOUND; F.AMP LIOF 400 K 2 ML x 100; BU_

81161; PROMIRA ; PROMIRA; NOT FOUND; CPR 400 MG x 5; BYP

81159; PROMIRA ; PROMIRA; NOT FOUND; CPR 400 MG x 7; BYP

8771; PROVIRON ; PROVIRON; NOT FOUND; CPR 25 MG x 20; BYP

86884; PRIMOGYNA ; PRIMOGYNA; NOT FOUND; DRAG 2 MG x 28; BYP

58777; PRIMOGYNA ; PRIMOGYNA; NOT FOUND; DRAG 1 MG x 28; BYP

8635; PRIMOSISTON ; PRIMOSISTON; NOT FOUND; CPR x 30; BYP

8629; PRIMOLUT NOR ; PRIMOLUT NOR; NOT FOUND; CPR 10 MG x 30; BYP

54299; PYRIMEL ; PYRIMEL; NOT FOUND; PO ENV.ME/LI 5 G x 50; C_S

82108; PHYTOVEIN ; PHYTOVEIN; NOT FOUND; CREME 110 G x 1; C_S

59668; PHYTOCALM ; PHYTOCALM; NOT FOUND; LIQD 150 ML x 1; C_S

52146; POSDRINK ; POSDRINK; NOT FOUND; CPR DISPLAY x 100; C_S

55902; PYRIMEL ; PYRIMEL; NOT FOUND; PO ENV.MA/CA 5 G x 50; C_S

62813; PHYTOVEIN ; PHYTOVEIN; NOT FOUND; CAPS 300 MG x 45; C_S

60193; PRANOLAL ; PRANOLAL; NOT FOUND; CPR 40 MG x 50; CAZ

55102; PARAZOL ; PARAZOL; NOT FOUND; SUSP 40 MG 10 ML x 1 (/ML); CAZ

61316; PRECORTIL ; PRECORTIL; NOT FOUND; CPR 5 MG x 20; CAZ

60192; PRANOLAL ; PRANOLAL; NOT FOUND; CPR 10 MG x 50; CAZ

61313; PRAMINAN ; PRAMINAN; NOT FOUND; CPR REVEST 25 MG x 20; CAZ

55101; PARAZOL ; PARAZOL; NOT FOUND; CPR 200 MG x 2; CAZ

48414; PARARTRIN ; PARARTRIN; NOT FOUND; CPR REVEST 300 MG x 30; CAZ

61315; PRECORTIL ; PRECORTIL; NOT FOUND; CPR 20 MG x 20; CAZ

49037; PARARTRIN ; PARARTRIN; NOT FOUND; CPR REVEST 600 MG x 30; CAZ

60197; PRURIDOL ; PRURIDOL; NOT FOUND; SOLN TOP. 25 % 100 ML x 1; CAZ

61314; PRANOLAL ; PRANOLAL; NOT FOUND; CPR 80 MG x 20; CAZ

66631; PRONENEN ; PRONENEN; NOT FOUND; POM. 45 G x 1; CF2

58321; PYVERM ; PYVERM; NOT FOUND; SUSP ORAL 40 ML x 1; CF2

61584; POSLOV ; POSLOV; NOT FOUND; CPR 0.75 MG x 2; CF2

73526; POLARATUSS ; POLARATUSS; NOT FOUND; LIQD EXPT 120 ML x 1; CF2

58320; PYVERM ; PYVERM; NOT FOUND; CPR 100 MG x 6; CF2

58308; PANTEC ; PANTEC; NOT FOUND; CAPS 150 MG x 1; CF2

59517; POLAREN ; POLAREN; NOT FOUND; CPR 2 MG x 20; CF2

154079; PROBENTOL BABY ; PROBENTOL BABY; NOT FOUND; CREME 30 G x 1; CF2

59515; PANTRAT ; PANTRAT; NOT FOUND; CPR GASTROR 40 MG x 14; CF2

58881; PEN-V-CILIN ; PEN V CILIN; NOT FOUND; CPR 500 K x 12; CF2

112494; PROMAN ; PROMAN; NOT FOUND; SA LIQ I MAS 150 ML x 1; CF2

74922; PANTEC ; PANTEC; NOT FOUND; CAPS 150 MG x 2; CF2

142649; PROBENTOL DERMA ; PROBENTOL DERMA; NOT FOUND; SPRAY HAIR 50 ML x 1; CF2

59518; POLAREN ; POLAREN; NOT FOUND; XPE TUT/FRUT 2 MG 100 ML x 1 (/5ML); CF2

58299; PREXSULID ; PREXSULID; NOT FOUND; CPR 100 MG x 12; CF2

59516; PEN-V-CILIN ; PEN V CILIN; NOT FOUND; PO P/SUSP 400 K 60 ML x 1 (/5ML); CF2

58312; PIROXIN ; PIROXIN; NOT FOUND; CAPS 20 MG x 15; CF2

100194; PARACETAMOL MG ; PARACETAMOL; PARACETAMOL; CPR 750 MG x 20; CF2

58300; PREXSULID ; PREXSULID; NOT FOUND; GOTAS 50 MG 15 ML x 1 (/ML); CF2

77179; PREGNOLAN ; PREGNOLAN; NOT FOUND; A.IM 150 MG 1 ML x 1; CF2

113628; PROBENTOL DERMA ; PROBENTOL DERMA; NOT FOUND; LOCAO TOP 50 ML x 1; CF2

46711; PEDIDERM LOC ; PEDIDERM LOC; NOT FOUND; LOC. 0.02 % 100 ML x 1; CF2

111951; PROBENTOL DERMA ; PROBENTOL DERMA; NOT FOUND; CREME 20 G x 1; CF2

46712; PEDIDERM ; PEDIDERM; NOT FOUND; XAMP 0.02 % 100 ML x 1; CF2

112493; PROMAN ; PROMAN; NOT FOUND; FL F15 R L 60 G x 1; CF2

59514; PANTRAT ; PANTRAT; NOT FOUND; CPR GASTROR 40 MG x 7; CF2

67256; PROVIVE ; PROVIVE; NOT FOUND; F.AMP 1 % 20 ML x 1; CL9

111586; POWER VITA ; POWER VITA; NOT FOUND; CPR NUT CAPI x 30; CM5

74189; PROBENXIL ; PROBENXIL; NOT FOUND; DRAG 50 MG x 1000; CM5

52848; PARASIMED ; PARASIMED; NOT FOUND; EMULS 25 % 60 ML x 1; CM5

87502; POWER VITA ; POWER VITA; NOT FOUND; DRAG KIDS x 60; CM5

97432; PROBENXIL ; PROBENXIL; NOT FOUND; DRAG 50 MG x 500; CM5

78570; PIROXICAM MG ; PIROXICAM; PIROXICAM; CAPS 20 MG x 15; CM5

59766; PROBENXIL ; PROBENXIL; NOT FOUND; GOTAS 20 ML x 1; CM5

87501; POWER VITA ; POWER VITA; NOT FOUND; DRAG MULHER x 60; CM5

154326; POWER VITA ; POWER VITA; NOT FOUND; DRAG SPORT x 60; CM5

144369; POWER VITA ; POWER VITA; NOT FOUND; DRAG ESP COP x 70; CM5

128844; POWER VITA ; POWER VITA; NOT FOUND; GOTAS 10 ML x 1; CM5

75759; PARACETAMOL MG ; PARACETAMOL; PARACETAMOL; CPR 750 MG x 20; CM5

71787; PARACETAMOL MG ; PARACETAMOL; PARACETAMOL; GOTAS 200 MG 15 ML x 1 (/ML); CM5

78217; PARACETAMOL MG ; PARACETAMOL; PARACETAMOL; GOTAS 100 MG 15 ML x 1 (/ML); CM5

52849; PARASIMED ; PARASIMED; NOT FOUND; SABAO 10 % 60 G x 1; CM5

111582; POWER VITA ; POWER VITA; NOT FOUND; CPR SENIOR x 60; CM5

55520; PROBENXIL ; PROBENXIL; NOT FOUND; CPR 50 MG x 20; CM5

75760; PARACETAMOL MG ; PARACETAMOL; PARACETAMOL; CPR 750 MG x 200; CM5

87500; POWER VITA ; POWER VITA; NOT FOUND; DRAG x 60; CM5

103506; POWER VITA ; POWER VITA; NOT FOUND; DRAG x 70; CM5

61407; PROPRAMED ; PROPRAMED; NOT FOUND; CPR 40 MG x 40; CM5

82085; PLAVOM ; PLAVOM; NOT FOUND; GOTAS 4 MG 10 ML x 1 (/ML); CM5

59765; PROBENXIL GEL ; PROBENXIL GEL; NOT FOUND; EMULGEL 60 G x 1; CM5

55289; PEDILETAN ; PEDILETAN; NOT FOUND; SUSP.PERMETR 1 % 60 ML x 1; CM5

87498; POWER CALCIO ; POWER CALCIO; NOT FOUND; CAPS D 500 MG x 60; CM5

103507; POWER VITA ; POWER VITA; NOT FOUND; DRAG MULHER x 70; CM5

50505; PROBENXIL ; PROBENXIL; NOT FOUND; DRAG 50 MG x 10; CM5

66142; PAMIDRON ; PAMIDRON; NOT FOUND; F.AMP C/DILU 90 MG 10 ML x 5; CT6

49660; PANCURON ; PANCURON; NOT FOUND; AMP. 4 MG 2 ML x 50; CT6

66182; PAMIDRON ; PAMIDRON; NOT FOUND; F.AMP C/DILU 60 MG 10 ML x 5; CT6

99730; PINAZAN ; PINAZAN; NOT FOUND; CPR 25 MG x 30; CT6

66280; PLASBUMIN ; PLASBUMIN; NOT FOUND; SOLN INJ. 20 % 50 ML x 1; CT6

78962; PARKIDOPA ; PARKIDOPA; NOT FOUND; CPR 250 MG x 200 (/25); CT6

84960; PEPTILYS ; PEPTILYS; NOT FOUND; CREME VISAGE 40 ML x 1; CT6

53843; PROPOVAN ; PROPOVAN; NOT FOUND; A.IV 10 MG 20 ML x 5 (/ML); CT6

63885; PASIC ; PASIC; NOT FOUND; SOLN ORAL 250 MG 100 ML x 1 (/5ML); CT6

84959; PEPTILYS ; PEPTILYS; NOT FOUND; CREME EYE 15 ML x 1; CT6

99729; PINAZAN ; PINAZAN; NOT FOUND; CPR 100 MG x 30; CT6

95514; PINAZAN ; PINAZAN; NOT FOUND; CPR 100 MG x 450; CT6

53824; PAMERGAN ; PAMERGAN; NOT FOUND; AMP. 25 MG 2 ML x 50 (/ML); CT6

53828; PARKIDOPA ; PARKIDOPA; NOT FOUND; CPR 250 MG x 30 (/25); CT6

63884; PASIC ; PASIC; NOT FOUND; CPR REVEST 100 MG x 20; CT6

53822; PAMERGAN ; PAMERGAN; NOT FOUND; CPR 25 MG x 200; CT6

59522; PROPOVAN ; PROPOVAN; NOT FOUND; A.IV 10 MG 10 ML x 5; CT6

60189; PLAMIDASIL ; PLAMIDASIL; NOT FOUND; CPR 10 MG x 20; DLT

33248; PIOLETAL ; PIOLETAL; NOT FOUND; SABAO LIQD 1 % 60 ML x 1; DLT

65572; PIOLETAL PLUS ; PIOLETAL PLUS; NOT FOUND; LOC. 5 % 60 ML x 1; DLT

60190; PLAMIDASIL ; PLAMIDASIL; NOT FOUND; GOTAS 4 MG 10 ML x 1 (/ML); DLT

60113; PENTALOX ; PENTALOX; NOT FOUND; CPR REVEST 400 MG x 20; DLT

66037; PIOLETAL ; PIOLETAL; NOT FOUND; SABAO 100 G x 1; DLT

49783; PLEX B ; PLEX B; NOT FOUND; DRAG x 50; DLT

64682; PONTREX ; PONTREX; NOT FOUND; CPR 500 MG x 24; DLT

32258; PIOLETAL ; PIOLETAL; NOT FOUND; LOC. 1 % 60 ML x 1; DLT

60194; PRAZEN ; PRAZEN; NOT FOUND; CPR REVEST 300 MG x 20; DLT

76198; PRE-FOLIC ; PRE FOLIC; NOT FOUND; CPR 5 MG x 30; ELO

64681; PRE-FOLIC ; PRE FOLIC; NOT FOUND; CPR 5 MG x 20; ELO

146555; PIRAMIN ; PIRAMIN; NOT FOUND; GOTAS 15 ML x 1; ELO

130371; PELLETRAT ; PELLETRAT; NOT FOUND; POMADA 50 MG 30 G x 1; ELO

74763; PHOTODERM BIOP ; PHOTODERM BIOP; NOT FOUND; CR T L FP100 40 ML x 1; EUF

106690; PIEMONTE ; PIEMONTE; NOT FOUND; CPR MAST 4 MG x 30; EUF

57384; PREDMETIL ; PREDMETIL; NOT FOUND; F.AMP LIOF 500 MG 8 ML x 1; EUF

53057; PRIMERA ; PRIMERA; NOT FOUND; CPR 20 Y x 21; EUF

85211; PROSSO ; PROSSO; NOT FOUND; CPR x 30; EUF

87191; PURADEX ; PURADEX; NOT FOUND; LOCAO AGE 100 ML x 1; EUF

78067; PONDERA ; PONDERA; NOT FOUND; CPR REVEST 30 MG x 10; EUF

75574; PRIMERA ; PRIMERA; NOT FOUND; CPR 20 Y x 63; EUF

55485; PRIMERA ; PRIMERA; NOT FOUND; CPR 30 Y x 21; EUF

64436; PHOTODERM BIOP ; PHOTODERM BIOP; NOT FOUND; FLUID FPS100 40 ML x 1; EUF

59299; PROP.CLOBETASOL MG ; PROP CLOBETASOL; NOT FOUND; SOLN TOP. 0.50 MG 50 G x 1 (/G; EUF

106694; PIEMONTE ; PIEMONTE; NOT FOUND; CPR MAST 5 MG x 30; EUF

66145; PANTOPRAZOL MG ; PANTOPRAZOL; PANTOPRAZOL; CPR REVEST 40 MG x 28; EUF

76994; POVATA ; POVATA; NOT FOUND; GRAN ENVELO. 3.50 G x 10; EUF

106691; PIEMONTE ; PIEMONTE; NOT FOUND; CPR MAST 5 MG x 10; EUF

64357; PARACETAMOL MG ; PARACETAMOL; PARACETAMOL; CPR 750 MG x 20; EUF

53144; PANTOCAL ; PANTOCAL; NOT FOUND; CPR REVEST 40 MG x 7; EUF

78068; PROFLAM ; PROFLAM; NOT FOUND; CPR 100 MG x 6; EUF

59019; PROP.CLOBETASOL MG ; PROP CLOBETASOL; NOT FOUND; CREME 0.50 MG 30 G x 1 (/G); EUF

79959; PHOTODERM BIOP ; PHOTODERM BIOP; NOT FOUND; LOC.KIDS F50 100 ML x 1; EUF

70188; PONDERA ; PONDERA; NOT FOUND; CPR REVEST 15 MG x 20; EUF

66144; PANTOPRAZOL MG ; PANTOPRAZOL; PANTOPRAZOL; CPR REVEST 40 MG x 14; EUF

57381; PANTOCAL ; PANTOCAL; NOT FOUND; CPR REVEST 40 MG x 28; EUF

64356; PARACETAMOL MG ; PARACETAMOL; PARACETAMOL; CPR 750 MG x 200; EUF

78065; PONDERA ; PONDERA; NOT FOUND; CPR REVEST 20 MG x 10; EUF

63909; PONDERA ; PONDERA; NOT FOUND; CPR REVEST 10 MG x 20; EUF

53154; PONDERA ; PONDERA; NOT FOUND; CPR REVEST 20 MG x 20; EUF

63910; PONDERA ; PONDERA; NOT FOUND; CPR REVEST 40 MG x 20; EUF

57382; PONDERA ; PONDERA; NOT FOUND; CPR REVEST 30 MG x 30; EUF

51259; PROFLAM ; PROFLAM; NOT FOUND; CPR 100 MG x 12; EUF

59020; PROP.CLOBETASOL MG ; PROP CLOBETASOL; NOT FOUND; POM. 0.50 MG 30 G x 1 (/G); EUF

62879; PREDNISONA MG ; PREDNISONA; PREDNISONA; CPR 5 MG x 20; EUF

64437; PHOTODERM BIOP ; PHOTODERM BIOP; NOT FOUND; CR.T FPS 100 40 ML x 1; EUF

63798; PANTOPRAZOL MG ; PANTOPRAZOL; PANTOPRAZOL; F.AMP C/DILU 40 MG 10 ML x 50; EUF

75660; PACLITAXEL MG ; PACLITAXEL; PACLITAXEL; F.AMP 6 MG 16.7 ML x 10 (/ML); EUF

156836; PERIVASC ; PERIVASC; NOT FOUND; CPR x 60; EUF

64435; PHOTODERM BIOP ; PHOTODERM BIOP; NOT FOUND; CREME FPS100 40 ML x 1; EUF

61862; PIPERACI+TAZOBA.MG ; PIPERACI TAZOBA; NOT FOUND; F.AMP LIOF 2.25 G x 10; EUF

70189; PONDERA ; PONDERA; NOT FOUND; CPR REVEST 25 MG x 20; EUF

57378; PANTOCAL ; PANTOCAL; NOT FOUND; CPR REVEST 20 MG x 7; EUF

64434; PHOTODERM BIOP ; PHOTODERM BIOP; NOT FOUND; LOC.FPS 100 100 ML x 1; EUF

76995; POVATA ; POVATA; NOT FOUND; GRAN ENVELO. 3.50 G x 30; EUF

164451; PROMESTRIENO MG ; PROMESTRIENO; PROMESTRIENO; CR VAG 20APL 10 MG 30 G x 1 (/G); EUF

78203; PARACETA+CODE MG ; PARACETA CODE; NOT FOUND; CPR 500 MG x 12 (/30); EUF

106688; PIEMONTE ; PIEMONTE; NOT FOUND; CPR MAST 4 MG x 10; EUF

52233; PROFLAM CREME ; PROFLAM CREME; NOT FOUND; CREME 15 MG 30 G x 1 (/G); EUF

65663; PACLITAXEL MG ; PACLITAXEL; PACLITAXEL; F.AMP 30 MG 5 ML x 1; EUF

76297; PACO ; PACO; NOT FOUND; CPR x 12; EUF

57379; PANTOCAL ; PANTOCAL; NOT FOUND; CPR REVEST 20 MG x 14; EUF

68344; PROPOFOL MG ; PROPOFOL; PROPOFOL; AMP. 1 % 20 ML x 10; EUF

65662; PACLITAXEL MG ; PACLITAXEL; PACLITAXEL; F.AMP 100 MG 16.7 ML x 1; EUF

66143; PANTOPRAZOL MG ; PANTOPRAZOL; PANTOPRAZOL; CPR REVEST 40 MG x 7; EUF

53155; PONDERA ; PONDERA; NOT FOUND; CPR REVEST 20 MG x 30; EUF

51712; PROFLAM ; PROFLAM; NOT FOUND; CPR 100 MG x 24; EUF

65665; PAMIDRONATO DIS.MG ; PAMIDRONATO DIS; PAMIDRONATO DISSODICO; F.AMP INFUS 90 MG x 1; EUF

78064; PONDERA ; PONDERA; NOT FOUND; CPR REVEST 15 MG x 10; EUF

57377; PANTOCAL ; PANTOCAL; NOT FOUND; F.AMP LIOF 40 MG 10 ML x 1; EUF

62880; PREDNISONA MG ; PREDNISONA; PREDNISONA; CPR 20 MG x 10; EUF

75661; PACLITAXEL MG ; PACLITAXEL; PACLITAXEL; F.AMP 6 MG 5 ML x 10 (/ML); EUF

80227; PACLITAXEL MG ; PACLITAXEL; PACLITAXEL; F.AMP 6 MG 5 ML x 20 (/ML); EUF

76993; PHOTODERM BIOP ; PHOTODERM BIOP; NOT FOUND; CR SPOT F50 30 ML x 1; EUF

53145; PANTOCAL ; PANTOCAL; NOT FOUND; CPR REVEST 40 MG x 14; EUF

154092; PERIVASC ; PERIVASC; NOT FOUND; CPR x 30; EUF

61863; PIPERACI+TAZOBA.MG ; PIPERACI TAZOBA; NOT FOUND; F.AMP LIOF 4.50 G x 10; EUF

78066; PONDERA ; PONDERA; NOT FOUND; CPR REVEST 25 MG x 10; EUF

75575; PRIMERA ; PRIMERA; NOT FOUND; CPR 30 Y x 63; EUF

65680; PAMIDRONATO DIS.MG ; PAMIDRONATO DIS; PAMIDRONATO DISSODICO; F.AMP INFUS 30 MG x 2; EUF

85606; PLAQ ; PLAQ; NOT FOUND; CPR REVEST 75 MG x 30; EUF

80228; PACLITAXEL MG ; PACLITAXEL; PACLITAXEL; F.AMP 6 MG 16.7 ML x 20 (/ML); EUF

57380; PANTOCAL ; PANTOCAL; NOT FOUND; CPR REVEST 20 MG x 28; EUF

64358; PARACETAMOL MG ; PARACETAMOL; PARACETAMOL; GOTAS 200 MG 15 ML x 1 (/ML); EUF

78063; PONDERA ; PONDERA; NOT FOUND; CPR REVEST 10 MG x 10; EUF

52228; PENTASA ; PENTASA; NOT FOUND; CPR 500 MG x 50; FER

107716; PENTASA ; PENTASA; NOT FOUND; SAC GRAN L/P 2 G x 15; FER

52229; PENTASA ; PENTASA; NOT FOUND; SUP. 1 G x 15; FER

77742; PENTASA ; PENTASA; NOT FOUND; SAC GRAN L/P 2 G x 60; FER

77741; PENTASA ; PENTASA; NOT FOUND; SAC GRAN L/P 1 G x 50; FER

90252; PENTASA ; PENTASA; NOT FOUND; SAC GRAN L/P 2 G x 30; FER

131051; PICOPREP ; PICOPREP; NOT FOUND; SACHE 15.5 G x 2; FER

71497; PROPESS ; PROPESS; NOT FOUND; PESSARIO 10 MG x 1; FER

61596; PENTASA ; PENTASA; NOT FOUND; ENEMA 1000 MG 100 ML x 7; FER

80230; PENTASA ; PENTASA; NOT FOUND; SUP. 1 G x 28; FER

74415; PURISOLE ; PURISOLE; NOT FOUND; SOLN INJ. 1000 ML x 1; FRS

60706; PRODERM NF ; PRODERM NF; NOT FOUND; SABAO LIQD 150 ML x 1; GLD

77492; PRODERM NF ; PRODERM NF; NOT FOUND; EMULS 120 ML x 1; GLD

60785; PRODERM NF ; PRODERM NF; NOT FOUND; EMULS 150 ML x 1; GLD

51243; PRODERM ; PRODERM; NOT FOUND; CREM.BISNAGA 60 G x 1; GLD

76738; PRODERM NF ; PRODERM NF; NOT FOUND; SABAO LIQD 120 ML x 1; GLD

60300; PRODERM NF ; PRODERM NF; NOT FOUND; SABAO 80 G x 1; GLD

65134; PRESSOCORD ; PRESSOCORD; NOT FOUND; CPR 5 MG x 30; GLO

65132; PRESSOCORD ; PRESSOCORD; NOT FOUND; CPR 10 MG x 30; GLO

48886; PIROFEBRAN ; PIROFEBRAN; NOT FOUND; GOTAS 500 MG 10 ML x 1 (/ML); GLO

78448; PROP.CLOBETASOL MG ; PROP CLOBETASOL; NOT FOUND; CREME 30 G x 1; GLO

65133; PRESSOCORD ; PRESSOCORD; NOT FOUND; CPR 20 MG x 30; GLO

48885; PIROFEBRAN ; PIROFEBRAN; NOT FOUND; CPR 500 MG x 200; GLO

67183; POLARATIN ; POLARATIN; NOT FOUND; XAROPE 2 MG 100 ML x 1 (/5ML); GLO

69547; POLARATIN ; POLARATIN; NOT FOUND; CPR 2 MG x 20; GLO

65624; PROPALOL ; PROPALOL; NOT FOUND; CPR 40 MG x 40; GLO

65625; PROPALOL ; PROPALOL; NOT FOUND; CPR 80 MG x 20; GLO

60464; PIROXAN ; PIROXAN; NOT FOUND; CAPS 10 MG x 15; GLO

60465; PIROXAN ; PIROXAN; NOT FOUND; CAPS 20 MG x 15; GLO

73425; PARACETA+PSEUDO MG ; PARACETA PSEUDO; NOT FOUND; CPR REVEST 500 MG x 24 (/30); GM2

66778; PANTOPRAZOL MG ; PANTOPRAZOL; PANTOPRAZOL; CPR REVEST 20 MG x 28; GM2

70194; PARACETAMOL MG ; PARACETAMOL; PARACETAMOL; CPR REVEST 750 MG x 20; GM2

68940; PIROXICAM GEL MG ; PIROXICAM GEL; NOT FOUND; GEL. 0.50 % 30 G x 1; GM2

64010; PREDNISONA MG ; PREDNISONA; PREDNISONA; CPR 20 MG x 10; GM2

66784; PIROXICAM MG ; PIROXICAM; PIROXICAM; CAPS 20 MG x 15; GM2

69756; PARACETAMOL MG ; PARACETAMOL; PARACETAMOL; CPR REVEST 500 MG x 100; GM2

76671; PIROXICAM MG ; PIROXICAM; PIROXICAM; CPR SOLUVEL 20 MG x 10; GM2

72570; PARACETAMOL MG ; PARACETAMOL; PARACETAMOL; SACH.MEL/LIM 500 MG 5 G x 25; GM2

71282; PARACETAMOL MG ; PARACETAMOL; PARACETAMOL; SUSP ORAL 32 MG 60 ML x 1 (/ML); GM2

66801; PIROXICAM MG ; PIROXICAM; PIROXICAM; CAPS 20 MG x 10; GM2

64009; PREDNISONA MG ; PREDNISONA; PREDNISONA; CPR 5 MG x 20; GM2

66775; PANTOPRAZOL MG ; PANTOPRAZOL; PANTOPRAZOL; CPR REVEST 40 MG x 28; GM2

71283; PARACETAMOL MG ; PARACETAMOL; PARACETAMOL; GOTAS 100 MG 15 ML x 1 (/ML); GM2

66786; PROP.CLOBETASOL MG ; PROP CLOBETASOL; NOT FOUND; POM. 0.50 MG 30 G x 1 (/G); GM2

160482; PRENISOL ; PRENISOL; NOT FOUND; SOL ORAL 3 MG 60 ML x 1 (/ML); GM2

66776; PANTOPRAZOL MG ; PANTOPRAZOL; PANTOPRAZOL; CPR REVEST 20 MG x 14; GM2

91052; PREDNISOLONA MG ; PREDNISOLONA; PREDNISOLONA; CPR 20 MG x 10; GM2

66777; PANTOPRAZOL MG ; PANTOPRAZOL; PANTOPRAZOL; CPR REVEST 40 MG x 14; GM2

68671; PARACETAMOL MG ; PARACETAMOL; PARACETAMOL; SACH.MEL/LIM 500 MG 5 G x 50; GM2

140522; PANTOPRAZOL MG ; PANTOPRAZOL; PANTOPRAZOL; CPR REVEST 20 MG x 42; GM2

74238; PARACET+CAFEINA MG ; PARACET CAFEINA; NOT FOUND; CPR REVEST 500 MG x 20 (/65); GM2

69758; PARACETAMOL MG ; PARACETAMOL; PARACETAMOL; CPR REVEST 750 MG x 200; GM2

66779; PENTOXIFILINA MG ; PENTOXIFILINA; PENTOXIFILINA; CPR REVEST 400 MG x 20; GM2

80660; PIOTAZ ; PIOTAZ; NOT FOUND; CPR 30 MG x 30; GM2

80658; PIOTAZ ; PIOTAZ; NOT FOUND; CPR 15 MG x 30; GM2

80661; PIOTAZ ; PIOTAZ; NOT FOUND; CPR 45 MG x 15; GM2

80659; PIOTAZ ; PIOTAZ; NOT FOUND; CPR 30 MG x 15; GM2

69757; PARACETAMOL MG ; PARACETAMOL; PARACETAMOL; CPR REVEST 500 MG x 200; GM2

80413; PIOTAZ ; PIOTAZ; NOT FOUND; CPR 15 MG x 15; GM2

