155821, WOMAN 50 , WOMAN 50, NOT FOUND, CAPSULAS 1000 MG x 60, BUY

151381, WOMAN 30 , WOMAN 30, NOT FOUND, CAPS 500 MG x 60, BUY

58465, WINTER AP , WINTER AP, NOT FOUND, CAPS x 8, DFP

77883, WELLBUTRIN XL , WELLBUTRIN XL, NOT FOUND, CPR AP. 300 MG x 7, GSK

77882, WELLBUTRIN XL , WELLBUTRIN XL, NOT FOUND, CPR AP. 150 MG x 30, GSK

77881, WELLBUTRIN XL , WELLBUTRIN XL, NOT FOUND, CPR AP. 150 MG x 7, GSK

59035, WELLBUTRIN SR , WELLBUTRIN SR, NOT FOUND, CPR AP. 150 MG x 30, GSK

77884, WELLBUTRIN XL , WELLBUTRIN XL, NOT FOUND, CPR AP. 300 MG x 30, GSK

72153, WELLPROCT , WELLPROCT, NOT FOUND, POM. 45 G x 1, IQB

77843, WRINKLE CORREXION , WRINKLE CORREXION, NOT FOUND, CREME OLHOS 15 ML x 1, J_J

77842, WRINKLE CORREXION , WRINKLE CORREXION, NOT FOUND, CREME NOITE 40 ML x 1, J_J

77844, WRINKLE CORREXION , WRINKLE CORREXION, NOT FOUND, SERUM. 30 ML x 1, J_J

77841, WRINKLE CORREXION , WRINKLE CORREXION, NOT FOUND, CREME DIA 40 ML x 1, J_J

68353, WONILIN , WONILIN, NOT FOUND, F.AMP LIOF 400 K x 50, NVA

58089, WARTEC , WARTEC, NOT FOUND, CREME 0.15 % 5 G x 1, STF

112602, WOMENS MULTI , WOMENS MULTI, NOT FOUND, CAPS SOFTGEL x 90, SUV

11359, WINTOMYLON , WINTOMYLON, NOT FOUND, SUSP 250 MG 60 ML x 1 (/5ML), S_A

11357, WINTOMYLON , WINTOMYLON, NOT FOUND, CPR 500 MG x 56, S_A

100451, WARFARIN , WARFARIN, NOT FOUND, CPR 5 MG x 30, U_Q

62070, WARFARIN , WARFARIN, NOT FOUND, CPR 5 MG x 10, U_Q

161200, WELETUSS , WELETUSS, NOT FOUND, GOTAS 50 ML x 1, WED

161201, WELETUSS , WELETUSS, NOT FOUND, GLOBULOS 20 G x 1, WED

