502301001179310; BUDECORT AQUA; BUDECORT AQUA; NOT FOUND; 32 MCG/DOSE SUS AQUOSA NAS CT FR VD AMB NEB X 120 DOSES(SPRAY); AZN
502301002175319; BUDECORT AQUA; BUDECORT AQUA; NOT FOUND; 64 MCG/DOSE SUS AQUOSA NAS CT FR VD AMB NEB X 120 DOSES (SPRAY); AZN
502300601131310; BAMBEC; BAMBEC; NOT FOUND; 1 MG/ML SOL OR CT FR PLAST OPC X 100 ML; AZN
502300901133319; BRICANYL COMPOSTO EXPECTORANTE; BRICANYL COMPOSTO EXPECTORANTE; NOT FOUND; 0.3 MG/ML + 13.3 MG/ML XPE CX FR VD AMB X 100 ML; AZN
502300801139315; BRICANYL; BRICANYL; NOT FOUND; 0.3 MG/ML XPE CT FR VD AMB X 100 ML; AZN
502306401116211; BRILINTA; BRILINTA; NOT FOUND; 90 MG COM REV CT BL AL PLAS INC X 20; AZN
502306402112218; BRILINTA; BRILINTA; NOT FOUND; 90 MG COM REV CT BL AL PLAS INC X 30; AZN
502306403119216; BRILINTA; BRILINTA; NOT FOUND; 90 MG COM REV CT BL AL PLAS INC X 60; AZN
