51824; HALO ; HALO; NOT FOUND; AMP. 5 MG 1 ML x 50; CT6
53724; HALO ; HALO; NOT FOUND; CPR 5 MG x 200; CT6
58948; HALO ; HALO; NOT FOUND; CPR BLISTER 1 MG x 200; CT6
52510; HALO ; HALO; NOT FOUND; GOTAS 2 MG 20 ML x 1 (/ML); CT6
53728; HALO ; HALO; NOT FOUND; GOTAS 2 MG 20 ML x 10 (/ML); CT6
59362; HALO DECANOATO ; HALO DECANOATO; NOT FOUND; A.IM 50 MG 1 ML x 3 (/ML); CT6
53729; HALOTHANO ; HALOTHANO; NOT FOUND; LIQD 100 ML x 1; CT6
53730; HALOTHANO ; HALOTHANO; NOT FOUND; LIQD 250 ML x 1; CT6
78335; HEMOFOL ; HEMOFOL; NOT FOUND; F.AMP S.C 5 K 0.25 ML x 25; CT6
78336; HEMOFOL ; HEMOFOL; NOT FOUND; F.AMP S.C 5 K 5 ML x 25; CT6
51825; HEPARIN ; HEPARIN; NOT FOUND; F.AMP 5000 IU 5 ML x 25 (/ML); CT6
51826; HEPARIN ; HEPARIN; NOT FOUND; F.AMP SUCC 5000 IU 5 ML x 25 (/ML); CT6
84955; HYSEAC ; HYSEAC; NOT FOUND; CRE ACT CARE 40 ML x 1; CT6
84956; HYSEAC ; HYSEAC; NOT FOUND; EMULS 40 ML x 1; CT6
84958; HYSEAC ; HYSEAC; NOT FOUND; FLUIDO FPS30 50 ML x 1; CT6
84954; HYSEAC ; HYSEAC; NOT FOUND; FLUIDO FPS50 50 ML x 1; CT6
84957; HYSEAC ; HYSEAC; NOT FOUND; GEL LIMPEZA 150 ML x 1; CT6
