84467, AC DEXAMETASONA MG , AC DEXAMETASONA, ACETATO DEXAMETASONA, CREME DERM 1 MG 10 G x 1 (/G), SNV
47894, ALERGYO , ALERGYO, NOT FOUND, CPR 2 MG x 20, SNV
47895, ALERGYO , ALERGYO, NOT FOUND, LIQD 2 MG 100 ML x 1 (/5ML), SNV
57109, ALUDROXIL , ALUDROXIL, NOT FOUND, CPR MASC 300 MG x 24, SNV
54865, ALUDROXIL , ALUDROXIL, NOT FOUND, SUSP 100 ML x 1, SNV
49645, ALUDROXIL , ALUDROXIL, NOT FOUND, SUSP 200 ML x 1, SNV
58985, AMOXICILINA MG , AMOXICILINA, AMOXICILINA, CAPS 500 MG x 21, SNV
75069, AMOXICILINA MG , AMOXICILINA, AMOXICILINA, CPR 500 MG x 500, SNV
49012, ANGIL , ANGIL, NOT FOUND, CPR 10 MG x 20, SNV
67638, ANGIL , ANGIL, NOT FOUND, CPR 10 MG x 500, SNV
49011, ANGIL , ANGIL, NOT FOUND, CPR LING 5 MG x 20, SNV
67637, ANGIL , ANGIL, NOT FOUND, CPR LING 5 MG x 500, SNV
