60595, RANYTISAN , RANYTISAN, NOT FOUND, CPR F.C 150 MG x 20, GLO
60596, RANYTISAN , RANYTISAN, NOT FOUND, CPR F.C 300 MG x 8, GLO
43919, RARIVIT , RARIVIT, NOT FOUND, LIQD 120 ML x 1, GLO
49052, RARIVIT F , RARIVIT F, NOT FOUND, DRAG x 40, GLO
47107, RARIVIT F , RARIVIT F, NOT FOUND, SUSP 120 ML x 1, GLO
98183, REHIDRAZOL , REHIDRAZOL, NOT FOUND, PO ENV COCO 27.9 G x 50, GLO
92470, REHIDRAZOL , REHIDRAZOL, NOT FOUND, PO ENV COCO 30 G x 4, GLO
106705, REHIDRAZOL , REHIDRAZOL, NOT FOUND, PO ENV GUARA 29.6 G x 50, GLO
92472, REHIDRAZOL , REHIDRAZOL, NOT FOUND, PO ENV GUARA 30 G x 4, GLO
99018, REHIDRAZOL , REHIDRAZOL, NOT FOUND, PO ENV LIMAO 27.9 G x 50, GLO
92476, REHIDRAZOL , REHIDRAZOL, NOT FOUND, PO ENV LIMAO 30 G x 4, GLO
65135, REHIDRAZOL , REHIDRAZOL, NOT FOUND, PO ENVELOPE 27.9 G x 4, GLO
65136, REHIDRAZOL , REHIDRAZOL, NOT FOUND, PO ENVELOPE 27.9 G x 50, GLO
75955, REHIDRAZOL , REHIDRAZOL, NOT FOUND, SOL ORAL FRA 450 ML x 1, GLO
75956, REHIDRAZOL , REHIDRAZOL, NOT FOUND, SOL ORAL LAR 450 ML x 1, GLO
75957, REHIDRAZOL , REHIDRAZOL, NOT FOUND, SOL ORAL NAT 450 ML x 1, GLO
75958, REHIDRAZOL , REHIDRAZOL, NOT FOUND, SOL ORAL UVA 450 ML x 1, GLO
