75427, RAMIPRIL MG , RAMIPRIL, RAMIPRIL, CPR 2.50 MG x 30, S_A
75428, RAMIPRIL MG , RAMIPRIL, RAMIPRIL, CPR 5 MG x 30, S_A
75803, RAMIPRIL MG , RAMIPRIL, RAMIPRIL, CPR 5 MG x 60, S_A
73615, RESPIRATUS , RESPIRATUS, NOT FOUND, XAROPE 7 MG 100 ML x 1 (/ML), S_A
48653, RIFALDIN , RIFALDIN, NOT FOUND, CAPS 300 MG x 6, S_A
59421, RIFALDIN , RIFALDIN, NOT FOUND, SUSP ORAL 20 MG 100 ML x 1 (/5ML), S_A
27666, RIFOCINA , RIFOCINA, NOT FOUND, SPRAY 10 MG 20 ML x 1 (/ML), S_A
52772, RILUTEK , RILUTEK, NOT FOUND, CPR REVEST 50 MG x 56, S_A
51009, ROVAMICINA , ROVAMICINA, NOT FOUND, CPR 500 MG x 16, S_A
