1275800580028; CARENVIT; CARENVIT; NOT FOUND; 5MG + 100MG + 300MG CAP GEL MOLE EST CART TB PLAS X 30; C6R
1275800510011; CURASEPT; CURASEPT; NOT FOUND; 21 MG/ ML + 1.33 MG/ML SOL TOP CT FR VD AMB X 30 ML C/ ESP; C6R
1275800050010; CURASEPT; CURASEPT; NOT FOUND; 2.10 MG/ML + 0.133 MG/ML SOL TOP CT FR PLAS OPC SPRAY X 50 ML; C6R
1275800510021; CURASEPT; CURASEPT; NOT FOUND; 21 MG/ML + 1.33 MG/ML SOL TOP FR SPR PLAS OPC X 50 ML; C6R
1275800370015; CARESS DERME; CARESS DERME; NOT FOUND; 5000UI + 9000UI + 150MG/G POM DERM CT BG AL X 45G; C6R
1275800440013; CARECLEAN; CARECLEAN; NOT FOUND; 5 PCC GEL CT BG AL X 20 G; C6R
