126141, CENTRO ZINCO , CENTRO ZINCO, NOT FOUND, CAPSULAS x 30, B3F
147322, CENTROMIL , CENTROMIL, NOT FOUND, CAPS x 30, B3F
136442, CENTROZINCO , CENTROZINCO, NOT FOUND, CAP L100 P60 x 100, B3F
144289, CENTROZINCO , CENTROZINCO, NOT FOUND, CAPS ED LIMI x 30, B3F
146559, CENTROZINCO , CENTROZINCO, NOT FOUND, CAPS L3P2 x 90, B3F
144881, CENTROZINCO , CENTROZINCO, NOT FOUND, CAPS SPORT x 60, B3F
142368, CENTROZINCO , CENTROZINCO, NOT FOUND, LI KIDS TU F 240 ML x 1, B3F
136444, CENTROZINCO , CENTROZINCO, NOT FOUND, LIQUIDO 500 ML x 1, B3F
