51246, FARLAC , FARLAC, NOT FOUND, XAR. 667 MG 120 ML x 1 (/ML), FAS
49834, FISOHEX II , FISOHEX II, NOT FOUND, LIQD 200 ML x 1, FAS
73470, FLATEX , FLATEX, NOT FOUND, CAPS GEL 125 MG x 10, FAS
59585, FLATEX , FLATEX, NOT FOUND, CPR 150 MG x 12, FAS
59583, FLATEX , FLATEX, NOT FOUND, CPR 40 MG x 20, FAS
59587, FLATEX , FLATEX, NOT FOUND, GOTAS 150 MG 10 ML x 1 (/ML), FAS
59586, FLATEX , FLATEX, NOT FOUND, GOTAS 75 MG 15 ML x 1 (/ML), FAS
4545, FONERGIN , FONERGIN, NOT FOUND, DISCOS x 12, FAS
4546, FONERGIN , FONERGIN, NOT FOUND, SPRAY 15 ML x 1, FAS
