148769; EPYDERMY ; EPYDERMY; NOT FOUND; CR ENXOF AA 10 % 60 G x 1; LYY
138891; EPYDERMY ; EPYDERMY; NOT FOUND; GEL PER BEN 10 % 60 ML x 1; LYY
148771; EPYDERMY ; EPYDERMY; NOT FOUND; GEL PER BENZ 2.50 % 60 ML x 1; LYY
148770; EPYDERMY ; EPYDERMY; NOT FOUND; LO PER BENZ 5 % 60 ML x 1; LYY
148775; EPYDERMY ; EPYDERMY; NOT FOUND; PA OX ZI+ENX 60 G x 1; LYY
131941; EPYDERMY ; EPYDERMY; NOT FOUND; PASTA OX/CA 60 G x 1; LYY
148772; EPYDERMY ; EPYDERMY; NOT FOUND; POM AC SALIC 2 % 60 G x 1; LYY
148773; EPYDERMY ; EPYDERMY; NOT FOUND; POM AC SALIC 20 % 60 G x 1; LYY
148774; EPYDERMY ; EPYDERMY; NOT FOUND; POM OX ZINCO 10 % 60 G x 1; LYY
