77461, DICLOFENACO SOD.MG , DICLOFENACO SOD, DICLOFENACO SODICO, AMP. 25 MG 3 ML x 50 (/ML), BU_
55011, DISOTRON , DISOTRON, NOT FOUND, F.AMP 5000 IU 5 ML x 25, BU_
55435, DNAREN , DNAREN, NOT FOUND, AMP. 75 MG 3 ML x 50, BU_
57420, DOBUTARISTON , DOBUTARISTON, NOT FOUND, AMP. 250 MG 20 ML x 20 (/2ML), BU_
72707, DOCLAXIN , DOCLAXIN, NOT FOUND, F.AMP 1 G 10 ML x 10 (/200), BU_
73388, DOCLAXIN , DOCLAXIN, NOT FOUND, F.AMP 1 G 10 ML x 20 (/200), BU_
58392, DOPABANE , DOPABANE, NOT FOUND, F.AMP 50 MG 10 ML x 10, BU_
33399, DRENALIN , DRENALIN, NOT FOUND, AMP. 1 ML x 100, BU_
