155027, PACLITAXEL MG , PACLITAXEL, PACLITAXEL, F.AMP 6 MG 16.7 ML x 1 (/ML), BU_
141997, PANTOPRAP.SO SE MG , PANTOPRAP SO SE, NOT FOUND, F.A IV C/DIL 40 MG 10 ML x 20, BU_
51972, PENKARON , PENKARON, NOT FOUND, F.AMP LIOF 400 K 2 ML x 100, BU_
51971, PENKARON , PENKARON, NOT FOUND, F.AMP LIOF 400 K 2 ML x 50, BU_
72726, PENKARON , PENKARON, NOT FOUND, F.AMP S/DILU 400 K x 100, BU_
66858, PRESERV , PRESERV, NOT FOUND, GEL LUBRIC. 40 G x 1, BU_
66859, PRESERV , PRESERV, NOT FOUND, GEL LUBRIC. 5 G x 5, BU_
77855, PRESERV , PRESERV, NOT FOUND, GEL NONOX 2 % 5 G x 5, BU_
72335, PRESERV , PRESERV, NOT FOUND, GEL NONOX 40 G x 1, BU_
