45761, VERRUX , VERRUX, NOT FOUND, LIQD 10 ML x 1, TSK
52821, VISOLON , VISOLON, NOT FOUND, COLIRIO 20 ML x 1, TSK
67265, VITACID , VITACID, NOT FOUND, CREME 0.05 % 25 G x 1, TSK
77663, VITACID , VITACID, NOT FOUND, CREME XT 0.10 % 25 G x 1, TSK
67266, VITACID , VITACID, NOT FOUND, GEL. 0.025 % 25 G x 1, TSK
83466, VITACID ACNE , VITACID ACNE, NOT FOUND, GEL . 25 G x 1, TSK
69240, VITACID PLUS , VITACID PLUS, NOT FOUND, CREME 15 G x 1, TSK
150196, VITALISS , VITALISS, NOT FOUND, CAPS CLAREAD x 30, TSK
150194, VITALISS , VITALISS, NOT FOUND, CAPS FACIAL x 30, TSK
150195, VITALISS , VITALISS, NOT FOUND, CAPS OLHOS x 30, TSK
