81769; LACTULONA ; LACTULONA; NOT FOUND; SACHE AMEIXA 667 MG 15 ML x 10 (/ML); DCS
81768; LACTULONA ; LACTULONA; NOT FOUND; SACHE FRUTA 667 MG 15 ML x 10 (/ML); DCS
49014; LACTULONA ; LACTULONA; NOT FOUND; XAROPE 500 MG 120 ML x 1 (/ML); DCS
62480; LACTULONA ; LACTULONA; NOT FOUND; XAROPE AMEIX 120 ML x 1; DCS
62481; LACTULONA ; LACTULONA; NOT FOUND; XAROPE FRUTA 120 ML x 1; DCS
58746; LOXONIN ; LOXONIN; NOT FOUND; CPR 60 MG x 15; DCS
56458; LOXONIN ; LOXONIN; NOT FOUND; CPR 60 MG x 30; DCS
137016; LOXONIN ; LOXONIN; NOT FOUND; CPR 60 MG x 8; DCS
