60245; NECRORGAN ; NECRORGAN; NOT FOUND; FLACONETES 10 ML x 10; GLO
60246; NECRORGAN ; NECRORGAN; NOT FOUND; FLACONETES 10 ML x 60; GLO
65125; NEOM ; NEOM; NOT FOUND; POM.DERMAT 15 G x 1; GLO
77177; NEONID ; NEONID; NOT FOUND; CREME 0.50 MG 30 G x 1 (/G); GLO
71802; NEOTIFEN ; NEOTIFEN; NOT FOUND; XAROPE 120 ML x 1; GLO
95289; NIOLIX ; NIOLIX; NOT FOUND; CAPS 1000 MG x 15; GLO
95295; NIOLIX ; NIOLIX; NOT FOUND; CAPS 1000 MG x 30; GLO
77410; NIST+OXID.ZINCO MG ; NIST OXID ZINCO; NOT FOUND; POM.DERMAT 60 G x 1; GLO
76336; NITR.ISOCONAZOL MG ; NITR ISOCONAZOL; NITRATO ISOCONAZOL; CR.VAG.7 APL 10 MG 40 G x 1 (/G; GLO
77247; NORFLOXACINO MG ; NORFLOXACINO; NORFLOXACINO; CPR REVEST 400 MG x 14; GLO
65126; NORXACIN ; NORXACIN; NOT FOUND; CPR REVEST 400 MG x 14; GLO
60260; NOVACIMET ; NOVACIMET; NOT FOUND; CPR 200 MG x 40; GLO
60261; NOVOPRAZOL ; NOVOPRAZOL; NOT FOUND; CAPS 10 MG x 14; GLO
60263; NOVOPRAZOL ; NOVOPRAZOL; NOT FOUND; CAPS 20 MG x 14; GLO
67580; NOVOPRAZOL ; NOVOPRAZOL; NOT FOUND; CAPS 20 MG x 28; GLO
69755; NOVOPRAZOL ; NOVOPRAZOL; NOT FOUND; CAPS 20 MG x 56; GLO
60262; NOVOPRAZOL ; NOVOPRAZOL; NOT FOUND; CAPS 20 MG x 7; GLO
75871; NOVOSORO H ; NOVOSORO H; NOT FOUND; SPRAY NASAL 30 MG 60 ML x 1 (/ML); GLO
76359; NOVOSORO NF ; NOVOSORO NF; NOT FOUND; SOL NASAL AD 0.50 MG 30 ML x 1 (/ML); GLO
