1008200470178; TANDREXIN; TANDREXIN; NOT FOUND; 500 MG COMP CT 3 STR X 4; ABT
1055300990176; TUSSIFLEX-D; TUSSIFLEX D; NOT FOUND; 1.5 MG/ML XPE INF CT FR VD AMB X 120 ML; ABT
1055300990141; TUSSIFLEX-D; TUSSIFLEX D; NOT FOUND; 3.0 MG/ML XPE ADU CT FR VD AMB X 120 ML; ABT
1055300990079; TUSSIFLEX-D; TUSSIFLEX D; NOT FOUND; 30 MG/ML SOL OR CT. FR VD CGT X 10; ABT
1055303240019; TARGUS LAT; TARGUS LAT; NOT FOUND; 40 MG (0.3 MG/CM2) ADESIVO TRANSD CT 2 SACH X 5 + BANDAGEM; ABT
1055303230013; TROMBOFOB GEL; TROMBOFOB GEL; NOT FOUND; 200 UI/G GL TOP CT BG AL X 40 G  ; ABT
1055303330026; TROMBOFOB; TROMBOFOB; NOT FOUND; 50 UI/G +2.067 MG/G POM DERM CT BG AL X 40 G; ABT
1008201490073; TEVETEN; TEVETEN; NOT FOUND; 600 MG COM REV CT BL AL PLAS OPC X 14; ABT
