150781, HELIODERM SUNCARE , HELIODERM SUNCARE, NOT FOUND, CR F50 ROSTO 50 G x 1, HTZ
78236, HELIODERM SUNCARE , HELIODERM SUNCARE, NOT FOUND, GEL. 120 G x 1, HTZ
162425, HELIODERM SUNCARE , HELIODERM SUNCARE, NOT FOUND, KIT FPS30 120 G x 2, HTZ
150782, HELIODERM SUNCARE , HELIODERM SUNCARE, NOT FOUND, L KIDS C F30 120 ML x 1, HTZ
114420, HELIODERM SUNCARE , HELIODERM SUNCARE, NOT FOUND, LOC F30 200 G x 1, HTZ
78237, HELIODERM SUNCARE , HELIODERM SUNCARE, NOT FOUND, LOCION FPS15 120 G x 1, HTZ
78238, HELIODERM SUNCARE , HELIODERM SUNCARE, NOT FOUND, LOCION FPS30 120 G x 1, HTZ
80664, HEPATILON , HEPATILON, NOT FOUND, CAPS 67 MG x 120, HTZ
80663, HEPATILON , HEPATILON, NOT FOUND, CAPS 67 MG x 20, HTZ
109724, HEPATILON , HEPATILON, NOT FOUND, FLACONETES 0.10 % 10 ML x 12, HTZ
70540, HEPATILON , HEPATILON, NOT FOUND, FLACONETES 0.10 % 10 ML x 24, HTZ
70541, HEPATILON , HEPATILON, NOT FOUND, FLACONETES 0.10 % 10 ML x 60, HTZ
75825, HEPATILON , HEPATILON, NOT FOUND, GOTAS 30 ML x 1, HTZ
54009, HEPATILON , HEPATILON, NOT FOUND, LIQD 150 ML x 1, HTZ
