65689; NARIFLUX ; NARIFLUX; NOT FOUND; SOL NAS. INF 15 ML x 1; CF2
65687; NARIFLUX ; NARIFLUX; NOT FOUND; SOL NAS.12H 30 ML x 1; CF2
65688; NARIFLUX ; NARIFLUX; NOT FOUND; SOL NASAL AD 15 ML x 1; CF2
104597; NASOFLUID ; NASOFLUID; NOT FOUND; GOTAS NASAL 0.50 MG 30 ML x 1 (/ML); CF2
59084; NAUSILON B6 ; NAUSILON B6; NOT FOUND; CPR x 20; CF2
60593; NAUSILON B6 ; NAUSILON B6; NOT FOUND; GOTAS 20 ML x 1; CF2
58297; NEOMICON ; NEOMICON; NOT FOUND; POM. 10 G x 1; CF2
58298; NERALGYN ; NERALGYN; NOT FOUND; DRAG x 20; CF2
58877; NERALGYN ; NERALGYN; NOT FOUND; DRAG x 200; CF2
58878; NERALGYN ; NERALGYN; NOT FOUND; GOTAS 15 ML x 1; CF2
61515; NIMOPAX ; NIMOPAX; NOT FOUND; CPR REVEST 30 MG x 30; CF2
75755; NISTATINA MG ; NISTATINA; NISTATINA; CR.VAG.C/APL 25 K 60 G x 1 (/G); CF2
64181; NISTOMIC ; NISTOMIC; NOT FOUND; CR.VAG.C/APL 25 K 60 G x 1 (/G); CF2
70553; NOREGYNA ; NOREGYNA; NOT FOUND; A.IM RETARD 1 ML x 1; CF2
