31047; CAMBEN ; CAMBEN; NOT FOUND; CPR 180 MG x 2; UCI
31151; CAMBEN ; CAMBEN; NOT FOUND; SUSP 6 MG 20 ML x 1 (/ML); UCI
67973; CETODERM ; CETODERM; NOT FOUND; CREME 2 % 30 G x 1; UCI
74942; CIPROLIP ; CIPROLIP; NOT FOUND; CPR 100 MG x 30; UCI
67849; CLOPSINA ; CLOPSINA; NOT FOUND; CPR 100 MG x 20; UCI
67848; CLOPSINA ; CLOPSINA; NOT FOUND; CPR 25 MG x 20; UCI
67850; CLOPSINA ; CLOPSINA; NOT FOUND; GOTAS 40 MG 20 ML x 1 (/ML); UCI
66052; CLOSTEMIN ; CLOSTEMIN; NOT FOUND; CREME DERMAT 30 G x 1; UCI
66051; CLOSTEMIN ; CLOSTEMIN; NOT FOUND; CREME VAG. 40 G x 1; UCI
62896; COLCITRAT ; COLCITRAT; NOT FOUND; CPR 0.50 MG x 20; UCI
