1163701120045; LINATRON; LINATRON; NOT FOUND; 300 MG/ML SOL INJ CX 50 AMP VD INC X 2 ML (EMB HOSP); BU_
1163700310029; LEVORIN; LEVORIN; NOT FOUND; LEUCOVORINA CALCICA 3 MG - CX COM 6 AMP DE SOL INJ 1 ML; BU_
1163700310010; LEVORIN; LEVORIN; NOT FOUND; 15 MG COM CT BL AL PLAS INC X 10; BU_
1163700120017; LEUCOCITIM; LEUCOCITIM; NOT FOUND; 150 MCG PO LIOF CT FA VD INC + DIL X 1 ML; BU_
1163700120025; LEUCOCITIM; LEUCOCITIM; NOT FOUND; 300 MCG PO LIOF CT FA VD INC+ DIL X 1 ML; BU_
1163700120033; LEUCOCITIM; LEUCOCITIM; NOT FOUND; 400 MCG PO LIOF CT FA VD INC + DIL X 1 ML; BU_
