62600; AEROMED ; AEROMED; NOT FOUND; XAR. 2 MG 120 ML x 1 (/5ML); MDQ
95754; ALIVGLOS ; ALIVGLOS; NOT FOUND; POM BABY 45 G x 1; MDQ
95749; ALIVGLOS ; ALIVGLOS; NOT FOUND; POM. 45 G x 1; MDQ
64157; AMPLIMED ; AMPLIMED; NOT FOUND; CAPS 500 MG x 12; MDQ
63046; AS-MED ; AS MED; NOT FOUND; CPR 100 MG x 100 (INF); MDQ
63047; AS-MED ; AS MED; NOT FOUND; CPR 100 MG x 200 (INF); MDQ
63048; AS-MED ; AS MED; NOT FOUND; CPR 500 MG x 200 (ADLT); MDQ
96938; ASSEPMED ; ASSEPMED; NOT FOUND; SOL TOP. 1 % 30 ML x 1; MDQ
96946; ASSEPMED ; ASSEPMED; NOT FOUND; SPRAY 1 % 50 ML x 1; MDQ
72107; ATROVEX NF ; ATROVEX NF; NOT FOUND; CPR REVEST x 100; MDQ
65011; ATROVEX NF ; ATROVEX NF; NOT FOUND; CPR REVEST x 20; MDQ
64749; ATROVEX NF ; ATROVEX NF; NOT FOUND; GOTAS 20 ML x 1; MDQ
63106; AZITROMED ; AZITROMED; NOT FOUND; CPR 500 MG x 2; MDQ
63107; AZITROMED ; AZITROMED; NOT FOUND; CPR 500 MG x 3; MDQ
