542012060001804, DIGEVITA, DIGEVITA, NOT FOUND, 4 MG/ML SOL OR CT FR PLAS OPC GOT X 20 ML, NV7
542012060001504, DEPANTEX, DEPANTEX, NOT FOUND, 50 MG/G POM DERM CT BG AL X 30 G, NV7
542012040000506, DIPIRONA SÓDICA, DIPIRONA SODICA, NOT FOUND, 500 MG/ML SOL OR CT FR PLAS OPC  GOT X 10 ML , NV7
542012040000606, DIPIRONA SÓDICA, DIPIRONA SODICA, NOT FOUND, 500 MG/ML SOL OR CT FR PLAS OPC  GOT X 20 ML, NV7
542012060001904, DISFLAT, DISFLAT, NOT FOUND, 75 MG/ML EMU OR CT FR PLAS OPC GOT X 10 ML, NV7
542012060002004, DISFLAT, DISFLAT, NOT FOUND, 75 MG/ML EMU OR CT FR PLAS OPC GOT X 15 ML, NV7
