28865, SEMAP , SEMAP, NOT FOUND, CPR 20 MG x 6, J_C
48703, SIBELIUM , SIBELIUM, NOT FOUND, CPR 10 MG x 30, J_C
93337, SIMPONI , SIMPONI, NOT FOUND, CANETA. 50 MG 0.50 ML x 1, J_C
69871, SOYFIT , SOYFIT, NOT FOUND, CPR REVEST 125 MG x 28, J_C
49624, SPORANOX , SPORANOX, NOT FOUND, CAPS 100 MG x 10, J_C
47356, SPORANOX , SPORANOX, NOT FOUND, CAPS 100 MG x 15, J_C
47294, SPORANOX , SPORANOX, NOT FOUND, CAPS 100 MG x 4, J_C
57193, SPORANOX , SPORANOX, NOT FOUND, CPR PULSO 100 MG x 28, J_C
77533, STELARA , STELARA, NOT FOUND, F.AMP 45 MG 0.50 ML x 1, J_C
9818, STUGERON , STUGERON, NOT FOUND, CPR 25 MG x 30, J_C
28634, STUGERON , STUGERON, NOT FOUND, CPR 75 MG x 30, J_C
59632, SUFENTA , SUFENTA, NOT FOUND, A.IV 50 Y 5 ML x 5 (/ML), J_C
51329, SYSTEN , SYSTEN, NOT FOUND, PARCHE 100 6.40 MG x 8, J_C
51325, SYSTEN , SYSTEN, NOT FOUND, PARCHE 25 1.60 MG x 8, J_C
51326, SYSTEN , SYSTEN, NOT FOUND, PARCHE 50 3.20 MG x 6, J_C
51327, SYSTEN , SYSTEN, NOT FOUND, PARCHE 50 3.20 MG x 8, J_C
54070, SYSTEN CONTI , SYSTEN CONTI, NOT FOUND, PARCHE x 8, J_C
53554, SYSTEN SEQUI , SYSTEN SEQUI, NOT FOUND, PARCHE x 8, J_C
