75031; KLEYDERM ACT C ; KLEYDERM ACT C; NOT FOUND; CREME A/R 25 G x 1; HTZ
76608; KLEYDERM ACT THERM ; KLEYDERM ACT THERM; NOT FOUND; LOC.FA.FPS15 50 ML x 1; HTZ
78450; KLEYDERM ACT WHITE ; KLEYDERM ACT WHITE; NOT FOUND; LOCION FPS30 30 ML x 1; HTZ
78351; KLEYDERM ACTSUN ; KLEYDERM ACTSUN; NOT FOUND; LOC O/F FP30 60 ML x 1; HTZ
76659; KLEYDERM DECARPYL ; KLEYDERM DECARPYL; NOT FOUND; LOC A/QUEDA 50 ML x 1; HTZ
76660; KLEYDERM DECARPYL ; KLEYDERM DECARPYL; NOT FOUND; SHAM ENERG 150 ML x 1; HTZ
76661; KLEYDERM DRENOLYSE ; KLEYDERM DRENOLYSE; NOT FOUND; CREME A/CELU 200 ML x 1; HTZ
76662; KLEYDERM HYDRA E ; KLEYDERM HYDRA E; NOT FOUND; CR MAOS FP15 60 G x 1; HTZ
70548; KLEYDERM SUNCARE ; KLEYDERM SUNCARE; NOT FOUND; LOCION FPS 8 120 G x 1; HTZ
70549; KLEYDERM SUNCARE ; KLEYDERM SUNCARE; NOT FOUND; LOCION FPS15 120 G x 1; HTZ
70550; KLEYDERM SUNCARE ; KLEYDERM SUNCARE; NOT FOUND; LOCION FPS30 120 G x 1; HTZ
77858; KLEYDERM THERMAL C ; KLEYDERM THERMAL C; NOT FOUND; LOC DEMAQ 200 ML x 1; HTZ
75303; KLEYDERM THERMAL C ; KLEYDERM THERMAL C; NOT FOUND; MOUSSE LIMPE 150 ML x 1; HTZ
76663; KLEYDERM THERMAL C ; KLEYDERM THERMAL C; NOT FOUND; SOL LIMPE AD 200 ML x 1; HTZ
