48833, NARIX , NARIX, NOT FOUND, GTS NAS AD 0.05 % 15 ML x 1, CM5
75537, NARIX , NARIX, NOT FOUND, GTS NAS AD 0.05 % 30 ML x 1, CM5
48834, NARIX , NARIX, NOT FOUND, GTS NAS INF 0.01 % 15 ML x 1, CM5
146821, NATUMED OLEO CHIA , NATUMED OLEO CHIA, NOT FOUND, CAPS 500 MG x 60, CM5
135743, NATUMED OLEO COCO , NATUMED OLEO COCO, NOT FOUND, CAPS 1000 MG x 60, CM5
145601, NATUMED OLEO LINHA , NATUMED OLEO LINHA, NOT FOUND, CAPS 1000 MG x 45, CM5
141324, NATUMED OMEGA 3 , NATUMED OMEGA 3, NOT FOUND, CAPS 1000 MG x 30, CM5
146825, NATUMED VITAMINA D , NATUMED VITAMINA D, NOT FOUND, CAPS 200 IU x 60, CM5
146831, NATUMED VITAMINA E , NATUMED VITAMINA E, NOT FOUND, CAPS 10 MG x 60, CM5
64663, NEBACIMED , NEBACIMED, NOT FOUND, POM. 15 G x 1, CM5
50809, NEOMED , NEOMED, NOT FOUND, POM. 3.50 MG 10 G x 1 (/G), CM5
145939, NEUROTON , NEUROTON, NOT FOUND, SOL ORAL MAR 120 ML x 1, CM5
69046, NEVRALGEX , NEVRALGEX, NOT FOUND, CPR x 100, CM5
55657, NEVRALGEX , NEVRALGEX, NOT FOUND, CPR x 120, CM5
73021, NEVRALGEX , NEVRALGEX, NOT FOUND, CPR x 30, CM5
78514, NIMESULIDA GOTA MG , NIMESULIDA GOTA, NOT FOUND, GOTAS 50 MG 15 ML x 1 (/ML), CM5
77540, NIMESULIDA MG , NIMESULIDA, NIMESULIDA, GEL. 20 MG 30 G x 1 (/G), CM5
73022, NITRA.MICONAZOL MG , NITRA MICONAZOL, NITRATO MICONAZOL, CREME DERMAT 20 MG 28 G x 1 (/G, CM5
70616, NITRA.MICONAZOL MG , NITRA MICONAZOL, NITRATO MICONAZOL, LOC. 20 MG 30 ML x 1 (/G), CM5
61400, NORFLOXMED , NORFLOXMED, NOT FOUND, CPR 400 MG x 14, CM5
61401, NORFLOXMED , NORFLOXMED, NOT FOUND, CPR 400 MG x 7, CM5
