9251, SABAO SULFUROSO , SABAO SULFUROSO, NOT FOUND, SABAO 90 G x 1, GRA
73029, SABONETE ANTISSEPT , SABONETE ANTISSEPT, NOT FOUND, SAB FRESH 90 G x 1, GRA
73030, SABONETE ANTISSEPT , SABONETE ANTISSEPT, NOT FOUND, SAB SPORT 90 G x 1, GRA
73031, SABONETE ANTISSEPT , SABONETE ANTISSEPT, NOT FOUND, SAB TRAD 90 G x 1, GRA
73118, SABONETE BEBE , SABONETE BEBE, NOT FOUND, SAB GLI/E DO 90 G x 1, GRA
73119, SABONETE BEBE , SABONETE BEBE, NOT FOUND, SAB GLI/LAVA 90 G x 1, GRA
72823, SABONETE BEBE , SABONETE BEBE, NOT FOUND, SAB L E DOCE 250 ML x 1, GRA
72822, SABONETE BEBE , SABONETE BEBE, NOT FOUND, SAB L GLIC 250 ML x 1, GRA
72824, SABONETE BEBE , SABONETE BEBE, NOT FOUND, SAB L LAVAND 250 ML x 1, GRA
72893, SABONETE BEBE , SABONETE BEBE, NOT FOUND, SAB.GLICERI. 90 G x 1, GRA
73032, SABONETE ERVA DOCE , SABONETE ERVA DOCE, NOT FOUND, SAB LIQ 200 ML x 1, GRA
72825, SABONETE ERVA DOCE , SABONETE ERVA DOCE, NOT FOUND, SABONETE 90 G x 1, GRA
72894, SABONETE GLICERINA , SABONETE GLICERINA, NOT FOUND, SAB LIQ 200 ML x 1, GRA
72896, SABONETE GLICERINA , SABONETE GLICERINA, NOT FOUND, SAB.GLI/ALG 90 G x 1, GRA
72895, SABONETE GLICERINA , SABONETE GLICERINA, NOT FOUND, SAB.GLI/MEL 90 G x 1, GRA
55563, SABONETE GLICERINA , SABONETE GLICERINA, NOT FOUND, SABAO 90 G x 1, GRA
9947, SUPOS GLICERINA , SUPOS GLICERINA, NOT FOUND, SUP AD 5 G x 12, GRA
9948, SUPOS GLICERINA , SUPOS GLICERINA, NOT FOUND, SUP INF 1.65 G x 12, GRA
90492, SUPOS GLICERINA , SUPOS GLICERINA, NOT FOUND, SUP LACT x 12, GRA
