1206900080024; DOBUTAM; DOBUTAM; NOT FOUND; 25 MG/ML SOL INJ CX C/ 1 AMP 20 ML; L8B
1206900080016; DOBUTAM; DOBUTAM; NOT FOUND; 25 MG/ML SOL INJ CX C/ 3 AMP 10 ML; L8B
1206900190024; DACARZIN; DACARZIN; NOT FOUND; 100 MG PO LIOFILIZADO INJ CX C/ 1 FR/AMP X 10 ML; L8B
1206900190040; DACARZIN; DACARZIN; NOT FOUND;  200 MG PO LIOF INJ CT FA VD AMB X 25 ML; L8B
1206900250019; DOXELIB; DOXELIB; NOT FOUND; 20 MG SOL INJ + DIL CT FR AMP VD INC 0.5 ML + FR DIL X 1.5 ML; L8B
1206900250027; DOXELIB; DOXELIB; NOT FOUND; 80 MG SOL INJ + DIL CT FR AMP VD INC 2 ML + FR DIL X 6 ML; L8B
