49335, HELMI-PED , HELMI PED, NOT FOUND, SUSP 30 ML x 1, STF
78622, HIDRAFIL , HIDRAFIL, NOT FOUND, C.ANT/AG MAO 50 G x 1, STF
57739, HIDRAFIL , HIDRAFIL, NOT FOUND, CR.EYECARE 15 G x 1, STF
76056, HIDRAFIL , HIDRAFIL, NOT FOUND, GEL ANT/AGI 30 G x 1, STF
91003, HIDRAFIL , HIDRAFIL, NOT FOUND, GEL FACIAL 60 ML x 1, STF
53494, HIDRAFIL , HIDRAFIL, NOT FOUND, GEL. 60 G x 1, STF
78624, HIDRAFIL , HIDRAFIL, NOT FOUND, K A AG/MA/EY 95 G x 1, STF
86235, HIDRAFIL , HIDRAFIL, NOT FOUND, K AAG/M/E NC 95 G x 1, STF
50799, HIDRAFIL , HIDRAFIL, NOT FOUND, LOC. 120 ML x 1, STF
49157, HIDRAFIL , HIDRAFIL, NOT FOUND, LOC. 60 ML x 1, STF
109613, HIDRAFIL , HIDRAFIL, NOT FOUND, LOCAO CREMOS 150 G x 1, STF
91005, HIDRAFIL , HIDRAFIL, NOT FOUND, LOCAO FACIAL 60 ML x 1, STF
78123, HIDRAFIL , HIDRAFIL, NOT FOUND, SAB LIQ FAC 60 ML x 1, STF
53495, HIDRAFIL , HIDRAFIL, NOT FOUND, SABAO 100 G x 1, STF
78124, HIDRAFIL , HIDRAFIL, NOT FOUND, TONICO HIDRA 200 ML x 1, STF
54673, HIDRAPEL , HIDRAPEL, NOT FOUND, CREME 60 G x 1, STF
56726, HIDRAPEL , HIDRAPEL, NOT FOUND, LOC. 120 ML x 1, STF
54674, HIDRAPEL PLUS , HIDRAPEL PLUS, NOT FOUND, CREME 60 G x 1, STF
56727, HIDRAPEL PLUS , HIDRAPEL PLUS, NOT FOUND, LOC. 120 ML x 1, STF
