533007102133412, HYTOS PLUS, HYTOS PLUS, NOT FOUND, 4 MG/ML + 0.75 MG/ML XPE CT FR VD AMB X 100 ML + CP MEDIDA, U_Q
533007101137414, HYTOS PLUS, HYTOS PLUS, NOT FOUND, 48 MG/ML + 9 MG/ML SOL OR CT FR VD AMB CGT X 15 ML, U_Q
533020701169411, HERPEX, HERPEX, NOT FOUND, 10MG/G GEL CT BG AL X 10G, U_Q
533006801135114, HALOPERIDOL, HALOPERIDOL, HALOPERIDOL, 2 MG/ML SOL OR CT FR PLAS OPC GOT X 20 ML, U_Q
533006901172410, HEBRIN, HEBRIN, NOT FOUND, SOL TOP CT FR VD AMB X 30 ML, U_Q
533007001132410, HISTADIN, HISTADIN, NOT FOUND, 1 MG/ML XPE CT FR VD AMB X 100 ML, U_Q
533007002112413, HISTADIN, HISTADIN, NOT FOUND, 10 MG COM CT BL AL PLAS INC X 12 , U_Q
533007004115411, HISTADIN D, HISTADIN D, NOT FOUND, 5 MG + 120 MG DRG DESINT CALC CT BL AL PLAS INC X 12, U_Q
533007003135417, HISTADIN D, HISTADIN D, NOT FOUND, 1 MG/ML + 12 MG/ML XPE CT FR VD AMB X 60 ML, U_Q
