70848; ELANCYL ; ELANCYL; NOT FOUND; GEL A/M/MI L 200 ML x 1; P_F
73420; ELANCYL ; ELANCYL; NOT FOUND; GEL L RED 75 ML x 1; P_F
76124; ELANCYL ; ELANCYL; NOT FOUND; K GEL D/VENT 150 ML x 1; P_F
74759; ELANCYL CE REVERSE ; ELANCYL CE REVERSE; NOT FOUND; FRASCO. 100 ML x 1; P_F
78224; ELANCYL CE REVERSE ; ELANCYL CE REVERSE; NOT FOUND; K DUO CE RE 100 ML x 1; P_F
76527; ELANCYL CE REVERSE ; ELANCYL CE REVERSE; NOT FOUND; K DUO CR+NEC 100 ML x 1; P_F
78225; ELANCYL CE REVERSE ; ELANCYL CE REVERSE; NOT FOUND; LIQ RE ABD 75 ML x 1; P_F
68236; ELANCYL CONC L RED ; ELANCYL CONC L RED; NOT FOUND; FRASCO. 100 ML x 1; P_F
70126; ELANCYL CRO.ACTIVO ; ELANCYL CRO ACTIVO; NOT FOUND; GEL DIA/NOIT 150 ML x 1; P_F
68573; ELANCYL FER BUSTE ; ELANCYL FER BUSTE; NOT FOUND; LOC. 75 ML x 1; P_F
69022; ELANCYL FERM CORPS ; ELANCYL FERM CORPS; NOT FOUND; CREME 200 ML x 1; P_F
71779; ELANCYL GOMMAGE ; ELANCYL GOMMAGE; NOT FOUND; GEL ESF/TON 150 ML x 1; P_F
64148; ELUTION ; ELUTION; NOT FOUND; XAMP 200 ML x 1; P_F
