57220, AGUA TERMAL , AGUA TERMAL, NOT FOUND, AERO 150 ML x 1, AVN
57221, AGUA TERMAL , AGUA TERMAL, NOT FOUND, AERO 300 ML x 1, AVN
57219, AGUA TERMAL , AGUA TERMAL, NOT FOUND, AERO 50 ML x 1, AVN
68985, AGUA TERMAL , AGUA TERMAL, NOT FOUND, SPR.CO/VISAG 150 ML x 1, AVN
64140, AKERAT , AKERAT, NOT FOUND, CREME 200 ML x 1, AVN
112790, ANTIROUGEURS , ANTIROUGEURS, NOT FOUND, CREME 30 ML x 1 (FORT), AVN
144288, ANTIROUGEURS , ANTIROUGEURS, NOT FOUND, GEL CALM 50 ML x 1, AVN
112789, ANTIROUGEURS , ANTIROUGEURS, NOT FOUND, LEITE LIMP 300 ML x 1, AVN
71541, AVENE SOLAR , AVENE SOLAR, NOT FOUND, B LAB FPS 40 4.50 G x 1, AVN
71542, AVENE SOLAR , AVENE SOLAR, NOT FOUND, BISNAG AUT B 100 ML x 1, AVN
64128, AVENE SOLAR , AVENE SOLAR, NOT FOUND, CR C DOR F50 10 G x 1, AVN
64130, AVENE SOLAR , AVENE SOLAR, NOT FOUND, CR COLO F50+ 50 ML x 1, AVN
64121, AVENE SOLAR , AVENE SOLAR, NOT FOUND, CR.C FPS 20 50 ML x 1, AVN
69373, AVENE SOLAR , AVENE SOLAR, NOT FOUND, CR.FPS50 Z/S 15 ML x 1, AVN
64122, AVENE SOLAR , AVENE SOLAR, NOT FOUND, CREME FPS20 50 ML x 1, AVN
69368, AVENE SOLAR , AVENE SOLAR, NOT FOUND, CREME FPS40 50 ML x 1, AVN
64131, AVENE SOLAR , AVENE SOLAR, NOT FOUND, CREME FPS50+ 50 ML x 1, AVN
100616, AVENE SOLAR , AVENE SOLAR, NOT FOUND, E T S C F50+ 50 ML x 1, AVN
100610, AVENE SOLAR , AVENE SOLAR, NOT FOUND, E T S CO F30 50 ML x 1, AVN
100614, AVENE SOLAR , AVENE SOLAR, NOT FOUND, EMU T S F50+ 50 ML x 1, AVN
100612, AVENE SOLAR , AVENE SOLAR, NOT FOUND, EMU T SE F30 50 ML x 1, AVN
64132, AVENE SOLAR , AVENE SOLAR, NOT FOUND, EMUL FPS50+ 50 ML x 1, AVN
72684, AVENE SOLAR , AVENE SOLAR, NOT FOUND, EMULS FPS 40 50 ML x 1, AVN
76519, AVENE SOLAR , AVENE SOLAR, NOT FOUND, EMULSA FPS30 50 ML x 1, AVN
64123, AVENE SOLAR , AVENE SOLAR, NOT FOUND, GEL CR.FPS20 50 ML x 1, AVN
75458, AVENE SOLAR , AVENE SOLAR, NOT FOUND, K AE+CLE+ELU 50 ML x 1, AVN
78558, AVENE SOLAR , AVENE SOLAR, NOT FOUND, K CRC50+/ATE 50 ML x 1, AVN
115884, AVENE SOLAR , AVENE SOLAR, NOT FOUND, K E TSF30+AT 100 ML x 1, AVN
78559, AVENE SOLAR , AVENE SOLAR, NOT FOUND, K EMU50+/ATE 50 ML x 1, AVN
164622, AVENE SOLAR , AVENE SOLAR, NOT FOUND, KETSF30SC+GC 125 ML x 1, AVN
164621, AVENE SOLAR , AVENE SOLAR, NOT FOUND, KETSF50SC+AT 100 ML x 1, AVN
68555, AVENE SOLAR , AVENE SOLAR, NOT FOUND, LEITE FPS 40 100 ML x 1, AVN
72685, AVENE SOLAR , AVENE SOLAR, NOT FOUND, LOC MINE F50 100 ML x 1, AVN
68884, AVENE SOLAR , AVENE SOLAR, NOT FOUND, LOC.POS SOL 200 ML x 1, AVN
64133, AVENE SOLAR , AVENE SOLAR, NOT FOUND, LOCIO FPS50+ 100 ML x 1, AVN
70461, AVENE SOLAR , AVENE SOLAR, NOT FOUND, PO FPS50 C/S 10 G x 1, AVN
78560, AVENE SOLAR , AVENE SOLAR, NOT FOUND, SPRAY 50+INF 200 ML x 1, AVN
76004, AVENE SOLAR , AVENE SOLAR, NOT FOUND, SPRAY FPS 30 400 ML x 1, AVN
68885, AVENE SOLAR , AVENE SOLAR, NOT FOUND, SPRAY FPS 40 200 ML x 1, AVN
69370, AVENE SOLAR , AVENE SOLAR, NOT FOUND, SPRAY FPS 50 100 ML x 1, AVN
70283, AVENE SOLAR , AVENE SOLAR, NOT FOUND, SPRAY FPS20 200 ML x 1, AVN
76518, AVENE SOLAR , AVENE SOLAR, NOT FOUND, STICK FPS30 3 G x 1, AVN
76823, AVENE SOLAR , AVENE SOLAR, NOT FOUND, STICK FPS50 10 G x 1, AVN
