144292; CICALFATE ; CICALFATE; NOT FOUND; CREME 100 ML x 1; AVN
64143; CICALFATE ; CICALFATE; NOT FOUND; CREME 40 ML x 1; AVN
146852; CICALFATE ; CICALFATE; NOT FOUND; EMULS POST-A 40 ML x 1; AVN
66475; CICALFATE ; CICALFATE; NOT FOUND; LOC. 40 ML x 1; AVN
61027; CLEAN AC ; CLEAN AC; NOT FOUND; CREME 40 ML x 1; AVN
61028; CLEANANCE ; CLEANANCE; NOT FOUND; EMULS 40 ML x 1; AVN
67703; CLEANANCE ; CLEANANCE; NOT FOUND; EMULS COLOR 40 ML x 1; AVN
64145; CLEANANCE ; CLEANANCE; NOT FOUND; EMULS K. 40 ML x 1; AVN
61029; CLEANANCE ; CLEANANCE; NOT FOUND; GEL. 200 ML x 1; AVN
91092; CLEANANCE ; CLEANANCE; NOT FOUND; GEL. 75 ML x 1; AVN
146856; CLEANANCE ; CLEANANCE; NOT FOUND; LOC AGUA LIM 400 ML x 1; AVN
64144; CLEANANCE ; CLEANANCE; NOT FOUND; LOC. 200 ML x 1; AVN
146858; CLEANANCE ; CLEANANCE; NOT FOUND; SAB P O T A 100 G x 1; AVN
78561; CLEANANCE ; CLEANANCE; NOT FOUND; SO EMULS F30 50 ML x 1; AVN
109611; COLD CREAM ; COLD CREAM; NOT FOUND; BALSAMO LABI 15 ML x 1; AVN
64146; COLD CREAM ; COLD CREAM; NOT FOUND; BARRA. 100 G x 1; AVN
83392; COLD CREAM ; COLD CREAM; NOT FOUND; CREME MAOS 50 ML x 1; AVN
71564; COLD CREAM ; COLD CREAM; NOT FOUND; CREME MAOS 75 ML x 1; AVN
64725; COLD CREAM ; COLD CREAM; NOT FOUND; EMULS 400 ML x 1; AVN
144295; COLD CREAM ; COLD CREAM; NOT FOUND; GEL. 100 ML x 1; AVN
72705; COLD CREAM ; COLD CREAM; NOT FOUND; GEL. 250 ML x 1; AVN
115865; COLD CREAM ; COLD CREAM; NOT FOUND; K BARRA DUO 100 G x 1; AVN
115869; COLD CREAM ; COLD CREAM; NOT FOUND; K C MAO DUO 50 ML x 1; AVN
75744; COLD CREAM ; COLD CREAM; NOT FOUND; K E400ML+AE 50 ML x 1; AVN
154124; COLD CREAM ; COLD CREAM; NOT FOUND; LOC HIDR 100 ML x 1; AVN
68158; COLD CREAM ; COLD CREAM; NOT FOUND; STICK. 4 G x 1; AVN
70302; COUVRANCE ; COUVRANCE; NOT FOUND; B.NAT FPS15 30 ML x 1; AVN
71390; COUVRANCE ; COUVRANCE; NOT FOUND; CR C F15 DOR 10 G x 1; AVN
71389; COUVRANCE ; COUVRANCE; NOT FOUND; CR C F15 SAB 10 G x 1; AVN
64139; CPI ; CPI; NOT FOUND; CR.PEL INTOL 40 ML x 1; AVN
