87516, SAFLUTAN , SAFLUTAN, NOT FOUND, FLAC. 4.50 Y 0.30 ML x 30, MSD
53416, SANDRENA , SANDRENA, NOT FOUND, GEL SACHET 0.50 MG 0.50 G x 28, MSD
53417, SANDRENA , SANDRENA, NOT FOUND, GEL SACHET 1 MG 1 G x 28, MSD
28140, SINEMET , SINEMET, NOT FOUND, CPR 250 MG x 30 (/25), MSD
56884, SINGULAIR , SINGULAIR, NOT FOUND, CPR MASC 4 MG x 10, MSD
56771, SINGULAIR , SINGULAIR, NOT FOUND, CPR MASC 4 MG x 30, MSD
56885, SINGULAIR , SINGULAIR, NOT FOUND, CPR MASC CER 5 MG x 10, MSD
53171, SINGULAIR , SINGULAIR, NOT FOUND, CPR MASC CER 5 MG x 30, MSD
56886, SINGULAIR , SINGULAIR, NOT FOUND, CPR REVEST 10 MG x 10, MSD
53172, SINGULAIR , SINGULAIR, NOT FOUND, CPR REVEST 10 MG x 30, MSD
64740, SINGULAIR , SINGULAIR, NOT FOUND, SACHE BABY 4 MG x 10, MSD
64741, SINGULAIR , SINGULAIR, NOT FOUND, SACHE BABY 4 MG x 30, MSD
9743, SPOROSTATIN U.F. , SPOROSTATIN U F, NOT FOUND, CPR 500 MG x 20, MSD
150789, STEZZA , STEZZA, NOT FOUND, CPR REVEST x 28, MSD
150790, STEZZA , STEZZA, NOT FOUND, CPR REVEST x 84, MSD
54560, STOCRIN , STOCRIN, NOT FOUND, CAPS 200 MG x 90, MSD
62010, STOCRIN , STOCRIN, NOT FOUND, CPR REVEST 600 MG x 30, MSD
9821, STYPTANON , STYPTANON, NOT FOUND, F.AMP LIOF 20 MG 2 ML x 1, MSD
