89269, NASORUB , NASORUB, NOT FOUND, POM. 12 G x 24, PLB
70485, NASORUB , NASORUB, NOT FOUND, POM. 40 G x 30, PLB
70486, NASORUB , NASORUB, NOT FOUND, POM. 9 G x 24, PLB
69266, NEOSALDOR , NEOSALDOR, NOT FOUND, DRAG x 20, PLB
70136, NEOSALDOR , NEOSALDOR, NOT FOUND, DRAG x 200, PLB
68435, NEVRALDOR , NEVRALDOR, NOT FOUND, GOTAS 500 MG 10 ML x 1 (/ML), PLB
67406, NEVRALDOR , NEVRALDOR, NOT FOUND, GOTAS 500 MG 20 ML x 1 (/ML), PLB
82223, NORFLOXACINO MG , NORFLOXACINO, NORFLOXACINO, CPR REVEST 400 MG x 14, PLB
68091, NORFLOXINO , NORFLOXINO, NOT FOUND, CPR 400 MG x 14, PLB
