1057100100019; GUARATUABA; GUARATUABA; NOT FOUND; FRS. C/50 COMP.; BLF
1057100980014; GARGO; GARGO; NOT FOUND; CXS. C/12 PAST.; BLF
1057100090035; GRETIVIT; GRETIVIT; NOT FOUND; FRS. C/250 ML LQ.; BLF
1057100090030; GRETIVIT; GRETIVIT; NOT FOUND; FRS. C/50 DRGS.; BLF
1057100290012; GLUFCAPS; GLUFCAPS; NOT FOUND; FRS. C/50 DRGS.; BLF
1057100290012; GLUFCAPS STRESS; GLUFCAPS STRESS; NOT FOUND; FRS C/ 30 COMP; BLF
1057100070077; GARGOJUICE; GARGOJUICE; NOT FOUND; 1.5 MG/ML COLUT SPR CT FR VD INC NEB X 30 ML; BLF
1057100070020; GARGOJUICE; GARGOJUICE; NOT FOUND; CXS. C/12 PAST.; BLF
1057100070069; GARGOJUICE; GARGOJUICE; NOT FOUND; 3 MG PAS CT STR X 12; BLF
1057100990011; GELMINEX; GELMINEX; NOT FOUND; 40 MG + 13.6 MG + 10 MG GEL CT BG AL X 20 G; BLF
