505102901115310, LOPRIL-D, LOPRIL D, NOT FOUND, 50 MG + 25 MG COM CT BL AL/AL X 16, BMS
505102902111319, LOPRIL-D, LOPRIL D, NOT FOUND, 50 MG + 25 MG COM CT BL AL/AL X 30, BMS
505102801110317, LISODREN, LISODREN, NOT FOUND, 500 MG COM CT FR VD AMB X 100, BMS
505103101112315, LUFTAL MAX, LUFTAL MAX, NOT FOUND, 125 MG CAP GEL MOLE CT BL AL PLAS INC X 10, BMS
505103103115311, LUFTAL MAX, LUFTAL MAX, NOT FOUND, 125 MG COM CT 1 BL AL PLAS INC X 10, BMS
505103001118311, LUFTAL, LUFTAL, NOT FOUND, 40 MG COM CT 2 BL AL PLAS INC X 10, BMS
505103002130315, LUFTAL, LUFTAL, NOT FOUND, 75 MG ML EMU OR CT FR PLAS OPC GOT X 15 ML, BMS
