56199, NEOCATE , NEOCATE, NOT FOUND, PO 400 G x 1, DN0
81258, NEOCATE ADVANCE , NEOCATE ADVANCE, NOT FOUND, PO 400 G x 1, DN0
154082, NEOCATE LCP , NEOCATE LCP, NOT FOUND, PO 400 G x 1, DN0
67738, NUTILIS , NUTILIS, NOT FOUND, LATA 225 G x 1, DN0
115471, NUTILIS , NUTILIS, NOT FOUND, LATA 300 G x 1, DN0
54283, NUTRIDRINK , NUTRIDRINK, NOT FOUND, LIQD BAUNIL. 200 ML x 1, DN0
54284, NUTRIDRINK , NUTRIDRINK, NOT FOUND, LIQD CHOCOLA 200 ML x 1, DN0
54285, NUTRIDRINK , NUTRIDRINK, NOT FOUND, LIQD FRU TRO 200 ML x 1, DN0
54287, NUTRIDRINK , NUTRIDRINK, NOT FOUND, LIQD MORANGO 200 ML x 1, DN0
76154, NUTRIDRINK , NUTRIDRINK, NOT FOUND, PO BAUNILHA 325 G x 1, DN0
76155, NUTRIDRINK , NUTRIDRINK, NOT FOUND, PO NEUTRO 325 G x 1, DN0
91007, NUTRIDRINK , NUTRIDRINK, NOT FOUND, PO S/SABOR 800 G x 1, DN0
90011, NUTRIDRINK COMPACT , NUTRIDRINK COMPACT, NOT FOUND, LIQ BAUNILHA 125 ML x 4, DN0
90016, NUTRIDRINK COMPACT , NUTRIDRINK COMPACT, NOT FOUND, LIQ CAPPUCCI 125 ML x 4, DN0
115821, NUTRIDRINK COMPACT , NUTRIDRINK COMPACT, NOT FOUND, LIQ CHOCOLAT 125 ML x 4, DN0
115822, NUTRIDRINK COMPACT , NUTRIDRINK COMPACT, NOT FOUND, LIQ MORANGO 125 ML x 4, DN0
155762, NUTRIDRINK MAX , NUTRIDRINK MAX, NOT FOUND, K CAPU+S/SAB 700 G x 1, DN0
100029, NUTRIDRINK MAX , NUTRIDRINK MAX, NOT FOUND, PO BAUNILHA 350 G x 1, DN0
154083, NUTRIDRINK MAX , NUTRIDRINK MAX, NOT FOUND, PO CAPPUCINO 350 G x 1, DN0
158176, NUTRIDRINK MAX , NUTRIDRINK MAX, NOT FOUND, PO S/SABOR 700 G x 1, DN0
100018, NUTRIDRINK MAX , NUTRIDRINK MAX, NOT FOUND, PO SEM SABOR 350 G x 1, DN0
56201, NUTRIDRINK MULTIFI , NUTRIDRINK MULTIFI, NOT FOUND, LIQD BAUNIL. 200 ML x 1, DN0
65542, NUTRIDRINK MULTIFI , NUTRIDRINK MULTIFI, NOT FOUND, LIQD CHOCOLA 200 ML x 1, DN0
56203, NUTRIDRINK MULTIFI , NUTRIDRINK MULTIFI, NOT FOUND, LIQD MORANGO 200 ML x 1, DN0
76458, NUTRIDRINK PROTEIN , NUTRIDRINK PROTEIN, NOT FOUND, LIQD BAUNIL. 200 ML x 1, DN0
76459, NUTRIDRINK PROTEIN , NUTRIDRINK PROTEIN, NOT FOUND, LIQD CHOCOLA 200 ML x 1, DN0
76460, NUTRIDRINK PROTEIN , NUTRIDRINK PROTEIN, NOT FOUND, LIQD MORANGO 200 ML x 1, DN0
59016, NUTRINI ENERGY M/F , NUTRINI ENERGY M F, NOT FOUND, LIQD 200 ML x 1, DN0
59017, NUTRINI ENERGY M/F , NUTRINI ENERGY M F, NOT FOUND, LIQD 500 ML x 1, DN0
67884, NUTRINI MAX MF , NUTRINI MAX MF, NOT FOUND, FRASCO. 500 ML x 1, DN0
59662, NUTRINI MULTI FIBE , NUTRINI MULTI FIBE, NOT FOUND, LIQD 200 ML x 1, DN0
59663, NUTRINI MULTI FIBE , NUTRINI MULTI FIBE, NOT FOUND, LIQD 500 ML x 1, DN0
95430, NUTRINI PEPTI , NUTRINI PEPTI, NOT FOUND, BOLSA. 500 ML x 1, DN0
59664, NUTRINI STANDARD , NUTRINI STANDARD, NOT FOUND, LIQD 200 ML x 1, DN0
59665, NUTRINI STANDARD , NUTRINI STANDARD, NOT FOUND, LIQD 500 ML x 1, DN0
67647, NUTRISON AD CUBISO , NUTRISON AD CUBISO, NOT FOUND, LIQD 1000 ML x 1, DN0
66704, NUTRISON AD CUBISO , NUTRISON AD CUBISO, NOT FOUND, LIQD 500 ML x 1, DN0
54524, NUTRISON AD HEPATO , NUTRISON AD HEPATO, NOT FOUND, PO ENV.BAUNI 90 G x 1, DN0
54541, NUTRISON AD PEPTIS , NUTRISON AD PEPTIS, NOT FOUND, LIQD 500 ML x 1, DN0
67582, NUTRISON AD PEPTIS , NUTRISON AD PEPTIS, NOT FOUND, LIQD S/F 1000 ML x 1, DN0
67853, NUTRISON ADV DIASO , NUTRISON ADV DIASO, NOT FOUND, FRASCO. 500 ML x 1, DN0
67854, NUTRISON ADV DIASO , NUTRISON ADV DIASO, NOT FOUND, PACK 1000 ML x 1, DN0
54531, NUTRISON ADV IMUNO , NUTRISON ADV IMUNO, NOT FOUND, PO ENV.BAUNI 90 G x 1, DN0
54532, NUTRISON ADV IMUNO , NUTRISON ADV IMUNO, NOT FOUND, PO ENV.MORAN 90 G x 1, DN0
54538, NUTRISON ADV NEFRO , NUTRISON ADV NEFRO, NOT FOUND, PO ENV.BAUNI 90 G x 1, DN0
54514, NUTRISON ADV OLIGO , NUTRISON ADV OLIGO, NOT FOUND, PO ENV.LARAN 90 G x 1, DN0
106096, NUTRISON ADV PROTI , NUTRISON ADV PROTI, NOT FOUND, LIQ S/F. 500 ML x 1, DN0
54547, NUTRISON ADV PULMO , NUTRISON ADV PULMO, NOT FOUND, PO ENV.BAUNI 90 G x 1, DN0
54527, NUTRISON ADV TCM , NUTRISON ADV TCM, NOT FOUND, PO.E.BAU.C/S 90 G x 1, DN0
54528, NUTRISON ADV TCM , NUTRISON ADV TCM, NOT FOUND, PO.E.BAU.S/S 90 G x 1, DN0
148466, NUTRISON ENERGY , NUTRISON ENERGY, NOT FOUND, LIQD TP 1000 ML x 1, DN0
67870, NUTRISON ENERGY MF , NUTRISON ENERGY MF, NOT FOUND, FRASCO. 500 ML x 1, DN0
67871, NUTRISON ENERGY MF , NUTRISON ENERGY MF, NOT FOUND, PACK 1000 ML x 1, DN0
59653, NUTRISON ENERGY PL , NUTRISON ENERGY PL, NOT FOUND, LIQD 1000 ML x 1, DN0
59652, NUTRISON ENERGY PL , NUTRISON ENERGY PL, NOT FOUND, LIQD 500 ML x 1, DN0
73788, NUTRISON M FIBER , NUTRISON M FIBER, NOT FOUND, FRASCO. 500 ML x 1, DN0
73789, NUTRISON M FIBER , NUTRISON M FIBER, NOT FOUND, PACK 1000 ML x 1, DN0
67873, NUTRISON P PLUS MF , NUTRISON P PLUS MF, NOT FOUND, PACK 1000 ML x 1, DN0
67872, NUTRISON P PLUS MF , NUTRISON P PLUS MF, NOT FOUND, PACK 500 ML x 1, DN0
155030, NUTRISON PR PL ENE , NUTRISON PR PL ENE, NOT FOUND, PACK 1000 ML x 1, DN0
63676, NUTRISON SOYA , NUTRISON SOYA, NOT FOUND, LATA 400 G x 1, DN0
65546, NUTRISON SOYA , NUTRISON SOYA, NOT FOUND, LATA 800 G x 1, DN0
56227, NUTRISON SOYA , NUTRISON SOYA, NOT FOUND, PO S/SACAROS 400 G x 1, DN0
65545, NUTRISON SOYA , NUTRISON SOYA, NOT FOUND, PO S/SACAROS 800 G x 1, DN0
78543, NUTRISON SOYA M FI , NUTRISON SOYA M FI, NOT FOUND, LATA S/LAC 800 G x 1, DN0
73847, NUTRISON STANDARD , NUTRISON STANDARD, NOT FOUND, FRASCO. 500 ML x 1, DN0
73848, NUTRISON STANDARD , NUTRISON STANDARD, NOT FOUND, PACK 1000 ML x 1, DN0
