78587; SOL FISIOLOGIC TOP ; SOL FISIOLOGIC TOP; NOT FOUND; LIQ TOP 0.90 % 100 ML x 1; G_V
77803; SOL FISIOLOGIC TOP ; SOL FISIOLOGIC TOP; NOT FOUND; LIQ TOP 0.90 % 500 ML x 1; G_V
76809; SORO FISIOLOGICO ; SORO FISIOLOGICO; NOT FOUND; BOLSA S/F 0.90 % 500 ML x 24; G_V
68951; SORO FISIOLOGICO ; SORO FISIOLOGICO; NOT FOUND; SOLN INJ. 0.90 % 250 ML x 50; G_V
68952; SORO FISIOLOGICO ; SORO FISIOLOGICO; NOT FOUND; SOLN INJ. 0.90 % 500 ML x 25; G_V
70561; SORO GLICO FISIOLO ; SORO GLICO FISIOLO; NOT FOUND; F.AMP 1:1 1 % 500 ML x 25; G_V
54933; SORO GLICOSADO ; SORO GLICOSADO; NOT FOUND; SOLN INJ. 5 % 250 ML x 1; G_V
46264; SORO GLICOSADO ; SORO GLICOSADO; NOT FOUND; SOLN INJ. 5 % 500 ML x 1; G_V
