77622; SOL CLORETO SODIO ; SOL CLORETO SODIO; NOT FOUND; BOLSA S/F 0.90 % 1000 ML x 16; TXX
77223; SOL CLORETO SODIO ; SOL CLORETO SODIO; NOT FOUND; S INJ S/F BO 0.90 % 100 ML x 72; TXX
74791; SOL CLORETO SODIO ; SOL CLORETO SODIO; NOT FOUND; SOLN INJ. 0.90 % 1000 ML x 15; TXX
74790; SOL CLORETO SODIO ; SOL CLORETO SODIO; NOT FOUND; SOLN INJ. 0.90 % 500 ML x 30; TXX
75221; SOL GLICOCLORETADA ; SOL GLICOCLORETADA; NOT FOUND; S INJ S/F BO 500 ML x 30; TXX
75607; SOL GLICOSE ; SOL GLICOSE; NOT FOUND; SOL INJ BOLS 5 % 1000 ML x 16; TXX
75606; SOL GLICOSE ; SOL GLICOSE; NOT FOUND; SOL INJ BOLS 5 % 500 ML x 30; TXX
75320; SOL MANITOL ; SOL MANITOL; NOT FOUND; SOLN INJ. 20 % 250 ML x 1; TXX
75466; SOL RINGER LACTATO ; SOL RINGER LACTATO; NOT FOUND; SOLN INJ. 500 ML x 30; TXX
