75383, CENOURA & BRONZE , CENOURA BRONZE, NOT FOUND, GEL H P S 110 ML x 1, HY_
75374, CENOURA & BRONZE , CENOURA BRONZE, NOT FOUND, L BRON FPS4 110 ML x 1, HY_
75382, CENOURA & BRONZE , CENOURA BRONZE, NOT FOUND, LOC H P S 110 ML x 1, HY_
75381, CENOURA & BRONZE , CENOURA BRONZE, NOT FOUND, LOC K FPS50 110 ML x 1, HY_
75375, CENOURA & BRONZE , CENOURA BRONZE, NOT FOUND, LOCION FPS 8 110 ML x 1, HY_
75376, CENOURA & BRONZE , CENOURA BRONZE, NOT FOUND, LOCION FPS15 110 ML x 1, HY_
75379, CENOURA & BRONZE , CENOURA BRONZE, NOT FOUND, LOCION FPS30 110 ML x 1, HY_
75380, CENOURA & BRONZE , CENOURA BRONZE, NOT FOUND, LOCION FPS50 110 ML x 1, HY_
75372, CENOURA & BRONZE , CENOURA BRONZE, NOT FOUND, O BRONZ FPS2 110 ML x 1, HY_
75373, CENOURA & BRONZE , CENOURA BRONZE, NOT FOUND, S O B B FPS4 110 ML x 1, HY_
75378, CENOURA & BRONZE , CENOURA BRONZE, NOT FOUND, SPR SP FPS30 110 ML x 1, HY_
75377, CENOURA & BRONZE , CENOURA BRONZE, NOT FOUND, SPRA R FPS15 110 ML x 1, HY_
