75664; REDERMIC ; REDERMIC; NOT FOUND; CREME UV FLU 140 ML x 1; LRP
73996; REDERMIC ; REDERMIC; NOT FOUND; CREME XL 40 ML x 1; LRP
75446; REDERMIC ; REDERMIC; NOT FOUND; K R XL+PHY 60 ML x 1; LRP
72735; REDERMIC ; REDERMIC; NOT FOUND; K RED15ML+AT 50 ML x 1; LRP
73427; REDERMIC ; REDERMIC; NOT FOUND; K.RE+AT40+50 90 ML x 1; LRP
72336; REDERMIC ; REDERMIC; NOT FOUND; KIT RED+ANT x 1; LRP
69051; REDERMIC ; REDERMIC; NOT FOUND; TUBO 40 ML x 1; LRP
105413; REDERMIC HYALU C ; REDERMIC HYALU C; NOT FOUND; CREME 40 ML x 1; LRP
105414; REDERMIC HYALU C ; REDERMIC HYALU C; NOT FOUND; CREME OLHOS 15 ML x 1; LRP
105416; REDERMIC HYALU C ; REDERMIC HYALU C; NOT FOUND; CREME UV F25 40 ML x 1; LRP
71725; REDERMIC OLHOS ; REDERMIC OLHOS; NOT FOUND; CREME 15 ML x 1; LRP
90828; REDERMIC R ; REDERMIC R; NOT FOUND; CREME 30 ML x 1; LRP
130498; REDERMIC R ; REDERMIC R; NOT FOUND; CREME OLHOS 15 ML x 1; LRP
78464; REDERMIC+ ; REDERMIC; NOT FOUND; CREME OLHOS 15 ML x 1; LRP
80700; REDERMIC+ ; REDERMIC; NOT FOUND; CREME UV 40 ML x 1; LRP
78463; REDERMIC+ ; REDERMIC; NOT FOUND; CREME. 40 ML x 1; LRP
90832; ROSALIAC AR INTENS ; ROSALIAC AR INTENS; NOT FOUND; GEL FLUIDO 40 ML x 1; LRP
