538912050016013; PRIMOLUT-NOR; PRIMOLUT NOR; NOT FOUND; 10 MG COM CT BL AL PLAS INC X 30; BYP
538914120022803; PRIMOSISTON; PRIMOSISTON; NOT FOUND; 2 MG + 0.01 MG COM CT BL AL PVC/CTFE INC X 30; BYP
538912050016113; PRIMOSISTON; PRIMOSISTON; NOT FOUND; 2 MG + 0.01 MG COM CT BL AL PLAS INC X 30; BYP
538901501114417; PROMIRA; PROMIRA; NOT FOUND; 400 MG COM REV CT BL AL/AL X 05; BYP
538901502110415; PROMIRA; PROMIRA; NOT FOUND; 400 MG COM REV CT BL AL AL X 07; BYP
538912030009902; PRIMOVIST; PRIMOVIST; NOT FOUND; 181.43 MG/ML SOL INJ CT SER VD INC X 10 ML; BYP
538912050016213; PROVIRON; PROVIRON; NOT FOUND; 25 MG COM CT BL AL PLAS INC X 20; BYP
538902501118313; PRIMOGYNA; PRIMOGYNA; NOT FOUND; 1 MG DRG CT BL CALEND AL PLAS INC X 28; BYP
538902502114311; PRIMOGYNA; PRIMOGYNA; NOT FOUND; 2 MG DRG CT BL CALEND AL PLAS INC X 28; BYP
