58884; SALIKER ; SALIKER; NOT FOUND; XAMP 125 ML x 1; LRP
72133; SUBSTIANE ; SUBSTIANE; NOT FOUND; CREME 40 ML x 1; LRP
74599; SUBSTIANE ; SUBSTIANE; NOT FOUND; CREME XL 40 ML x 1; LRP
76305; SUBSTIANE ; SUBSTIANE; NOT FOUND; GEL OLHOS 15 ML x 1; LRP
73428; SUBSTIANE ; SUBSTIANE; NOT FOUND; K.SU+AT40+50 90 ML x 1; LRP
78589; SUBSTIANE ; SUBSTIANE; NOT FOUND; LOCION UV 40 ML x 1; LRP
85191; SUBSTIANE + ; SUBSTIANE; NOT FOUND; CREME 40 ML x 1; LRP
104569; SUBSTIANE + ; SUBSTIANE; NOT FOUND; CREME UV F15 40 ML x 1; LRP
140284; SUBSTIANE + ; SUBSTIANE; NOT FOUND; SERUM PUMP 30 ML x 1; LRP
85087; SUBSTIANE+ OLHOS ; SUBSTIANE OLHOS; NOT FOUND; GEL . 15 ML x 1; LRP
