75083; KALIMA ; KALIMA; NOT FOUND; KIT LOC+SAB x 1; TSK
76310; KALIMA ; KALIMA; NOT FOUND; LOC. 150 G x 1; TSK
71273; KALIMA ; KALIMA; NOT FOUND; LOC. 200 ML x 1; TSK
66841; KALIMA ; KALIMA; NOT FOUND; SAB.HIDRATAN 150 G x 1; TSK
81182; KALIMA ; KALIMA; NOT FOUND; SAB.HIDRATAN 80 G x 1; TSK
105738; KIARITA ; KIARITA; NOT FOUND; GEL CRE CLAR 30 G x 1; TSK
73423; KLASSIS ; KLASSIS; NOT FOUND; CREME FPS 18 25 G x 1; TSK
154172; KLASSIS ; KLASSIS; NOT FOUND; CREME FPS18 30 G x 1; TSK
78627; KLASSIS ; KLASSIS; NOT FOUND; EMULGEL FP20 25 G x 1; TSK
154171; KLASSIS ; KLASSIS; NOT FOUND; EMULGEL FP20 30 G x 1; TSK
