1040400250020; FENICLOR; FENICLOR; NOT FOUND; 5 MG/ML SOL OC CT FR PLAS OPC GOT X 10 ML; LR3
1040419290022; FLOGILID; FLOGILID; NOT FOUND; 50 MG/ML SUS OR CT FR VD AMB X 15 ML ; LR3
1040419290014; FLOGILID; FLOGILID; NOT FOUND; 100 MG COM CT BL AL PLAS INC X 12; LR3
1040419230011; FLOXATRAT; FLOXATRAT; NOT FOUND; 400 MG COM CT BL AL PLAS INC X 14; LR3
1040419400030; FLUCOZIX; FLUCOZIX; NOT FOUND; 150 MG C/01 CAPSULA; LR3
1040400540036; FRUCTOGENASE; FRUCTOGENASE; NOT FOUND; INJETAVEL 100X10 ML; LR3
1040400540010; FRUCTOGENASE; FRUCTOGENASE; NOT FOUND; INJETAVEL 50X20 ML; LR3
