1040401730029; LUPAREN; LUPAREN; NOT FOUND; 75 MG INJETAVEL 50X3 ML; LR3
1040401730010; LUPAREN; LUPAREN; NOT FOUND; 50 MG COM REV CT BL AL PLAS INC X 20; LR3
1040419340021; LOSAPROL; LOSAPROL; NOT FOUND; 10 MG C/14 CAPSULAS; LR3
1040419340046; LOSAPROL; LOSAPROL; NOT FOUND; 20 MG C/07 CAPSULAS; LR3
1040419340038; LOSAPROL; LOSAPROL; NOT FOUND; 20 MG C/14 CAPSULAS; LR3
1040419450011; LIFE-VIT; LIFE VIT; NOT FOUND; COM REV CT FR PLAS OPC X 30; LR3
1040401690037; LINCOTAX; LINCOTAX; NOT FOUND; 300 MG INJETAVEL 50X1 ML; LR3
1040401700032; LINCOTAX; LINCOTAX; NOT FOUND; 600 MG INJETAVEL 50X2 ML; LR3
1040401710034; LUPECTRIN; LUPECTRIN; NOT FOUND; SUSPENSAO 100 ML; LR3
