1040400920045; SALIMETIN; SALIMETIN; NOT FOUND; ESPORTISTA AEROSSOL; LR3
1040400920025; SALIMETIN; SALIMETIN; NOT FOUND; CREME EVANESCENTE 30 GRAMA; LR3
1040400920033; SALIMETIN; SALIMETIN; NOT FOUND; GEL PLUS ESPORTISTA 30 GRA; LR3
1040400370036; SULFATO FERROSO; SULFATO FERROSO; NOT FOUND; 0.125 G/ML SOL OR CT FR VD CGT X 30 ML; LR3
1040400370028; SULFATO FERROSO; SULFATO FERROSO; NOT FOUND; FERROSO LIQUIDO 100 ML; LR3
1040400370017; SULFATO FERROSO; SULFATO FERROSO; NOT FOUND; FERROSO C/50 DRAGEAS; LR3
1040401100043; SUPLEDIN; SUPLEDIN; NOT FOUND; SOLUCAO 240 ML; LR3
1040401100027; SUPLEDIN; SUPLEDIN; NOT FOUND; C/20 DRAGEAS; LR3
