1021602350016; XELJANZ; XELJANZ; NOT FOUND; 5 MG COM REV CT FR PLAS OPC X 60; PFZ
1021602350024; XELJANZ; XELJANZ; NOT FOUND; 5 MG COM REV CT FR PLAS OPC X 180; PFZ
1021601290011; XALATAN; XALATAN; NOT FOUND; 50 MCG/ML SOL OFT CT FR PLAS TRANS GOT X 2.5 ML ; PFZ
1238900930018; XALACOM; XALACOM; NOT FOUND; 2.5 ML; PFZ
1238900410014; XALATAN; XALATAN; NOT FOUND; SOLUCAO OFTALMICA - FRASCO COM 2.5 ML; PFZ
1021601490019; XALACOM; XALACOM; NOT FOUND; 50 MCG/ML + 5 MG/ML SOL OFT CT FR PLAS TRANS GOT X 2.5 ML; PFZ
