1134301550030; ESPIRONOLACTONA; ESPIRONOLACTONA; ESPIRONOLACTONA; 100 MG COM CT BL AL PLAS AMB X 500 (EMB HOSP); HPO
1134301550014; ESPIRONOLACTONA; ESPIRONOLACTONA; ESPIRONOLACTONA; 100 MG COM CT BL AL PLAS AMB X 16 ; HPO
1134301550049; ESPIRONOLACTONA; ESPIRONOLACTONA; ESPIRONOLACTONA; 50 MG COM CT BL AL PLAS AMB X 30; HPO
1134301550057; ESPIRONOLACTONA; ESPIRONOLACTONA; ESPIRONOLACTONA; 50 MG COM CT BL AL PLAS AMB X 500 (EMB HOSP); HPO
1134300540023; ERITRAM; ERITRAM; NOT FOUND; 250 MG/ 5 ML SUS OR FR VD AMB X 60 ML; HPO
1134300350011; ESTROLIOL; ESTROLIOL; NOT FOUND; 0.625 MG/G CREM VAG CT BG PLAS OPC X 25 G; HPO
1134301290039; ESKAVIT; ESKAVIT; NOT FOUND; 10 MG/ ML SOL INJ CX 100 AMP VD AMB X 1 ML ; HPO
1134301290020; ESKAVIT; ESKAVIT; NOT FOUND; 10 MG/ ML SOL INJ CX 50 AMP VD AMB X 1 ML; HPO
1134301290012; ESKAVIT; ESKAVIT; NOT FOUND; 10 MG/ML SOL INJ CT 5 AMP VD AMB X 1 ML; HPO
