522600901133414, CLORCIN-PED, CLORCIN PED, NOT FOUND, 250 MG/5 ML PO PREP EXTEMP CT 01 FR VD AMB X 100 ML + SER DOS, STF
522600501135411, CALCI-PED, CALCI PED, NOT FOUND, SUS OR CT FR VD AMB X 250 ML, STF
522604002168315, CLINDOXYL, CLINDOXYL, NOT FOUND, 1% + 5% GEL CT BG AL PLAS TRANS X 45 G, STF
522604001161317, CLINDOXYL, CLINDOXYL, NOT FOUND, 1% + 5% GEL CT BG AL PLAS TRANS X 30 G, STF
522600801163419, CLINAGEL, CLINAGEL, NOT FOUND, 10.3 MG/G GEL DERM CT BG AL REV X 45 G, STF
522600701169318, CLARIPEL, CLARIPEL, NOT FOUND, 40 MG/G GEL CT BG AL X 30, STF
