1071501010011; TEGREZIN; TEGREZIN; NOT FOUND; 200 MG COM CT ENV KRAFT PE X 20; CAZ
1071501010021; TEGREZIN; TEGREZIN; NOT FOUND; 200 MG COM CT ENV KRAFT PE X 200 (EMB HOSP); CAZ
1071501010038; TEGREZIN; TEGREZIN; NOT FOUND; 200 MG COM CT ENV KRAFT PE X 500 (EMB HOSP); CAZ
1071500890035; TRICOMAX; TRICOMAX; NOT FOUND; 100 MG/G + 20.000 UI/G CREM VAG CT BG AL X 50 G + 10 APLIC DESCART; CAZ
1071501030012; TRIPSOL; TRIPSOL; NOT FOUND; 25 MG COM CT ENV AL X 20; CAZ
1071501500019; TETRABEN; TETRABEN; NOT FOUND; 20 MG/G POM DERM CT BG AL X 20; CAZ
1071500420020; TERMOPRIN; TERMOPRIN; NOT FOUND; 0.05 G/ML XPE FR VD AMB X 100 ML; CAZ
1071500420016; TERMOPRIN; TERMOPRIN; NOT FOUND; 500 MG/ML SOL OR CT FR PLAS OPC GOT X 10 ML; CAZ
1071500420038; TERMOPRIN; TERMOPRIN; NOT FOUND; 500 MG COMP CX 50 ENV KRAFT POLIET X 4; CAZ
1071501350017; TRATZOL; TRATZOL; NOT FOUND; 100 MG CAP GEL DURA BL AL PLAST INC X 4; CAZ
