81753; RENNOVEE A S HOMME ; RENNOVEE A S HOMME; NOT FOUND; CPR x 60; RE2
77350; RENNOVEE B SOLUTIO ; RENNOVEE B SOLUTIO; NOT FOUND; CAPS x 42; RE2
78967; RENNOVEE CELSOLUTI ; RENNOVEE CELSOLUTI; NOT FOUND; CAPS x 128; RE2
77720; RENNOVEE CELSOLUTI ; RENNOVEE CELSOLUTI; NOT FOUND; CAPS x 64; RE2
78709; RENNOVEE CICLOSOLU ; RENNOVEE CICLOSOLU; NOT FOUND; CAPS x 60; RE2
81754; RENNOVEE DETOX SOL ; RENNOVEE DETOX SOL; NOT FOUND; CPR x 90; RE2
81755; RENNOVEE DRAINSOLU ; RENNOVEE DRAINSOLU; NOT FOUND; CAPS x 30; RE2
81756; RENNOVEE HA N SOLU ; RENNOVEE HA N SOLU; NOT FOUND; CAPS x 30; RE2
156802; RENNOVEE L SOLUTIO ; RENNOVEE L SOLUTIO; NOT FOUND; CAPS LIPOTRA x 64; RE2
81777; RENNOVEE L SOLUTIO ; RENNOVEE L SOLUTIO; NOT FOUND; CAPS x 120; RE2
77351; RENNOVEE L SOLUTIO ; RENNOVEE L SOLUTIO; NOT FOUND; CAPS x 60; RE2
78956; RENNOVEE OSTEOSOLU ; RENNOVEE OSTEOSOLU; NOT FOUND; CAPS x 84; RE2
78613; RENNOVEE OXISOLU ; RENNOVEE OXISOLU; NOT FOUND; CAPS x 60; RE2
81757; RENNOVEE P P HOMME ; RENNOVEE P P HOMME; NOT FOUND; CAPS x 30; RE2
81758; RENNOVEE SUNB OPTI ; RENNOVEE SUNB OPTI; NOT FOUND; CAPS x 60; RE2
78616; RENNOVEE SUNGO DAY ; RENNOVEE SUNGO DAY; NOT FOUND; CAPS x 60; RE2
78615; RENNOVEE SUNGO NIG ; RENNOVEE SUNGO NIG; NOT FOUND; CAPS x 60; RE2
77352; RENNOVEE T SOLUTIO ; RENNOVEE T SOLUTIO; NOT FOUND; CAPS x 42; RE2
