75492, TABINE , TABINE, NOT FOUND, F.AMP 100 MG 1 ML x 1, MIZ
75491, TABINE , TABINE, NOT FOUND, F.AMP 1000 MG 10 ML x 1, MIZ
75493, TABINE , TABINE, NOT FOUND, F.AMP 500 MG 5 ML x 1, MIZ
85540, TACROFORT , TACROFORT, NOT FOUND, CAPS 1 MG x 50, MIZ
109198, TEEN DERM GEL , TEEN DERM GEL, NOT FOUND, GEL ESPUMOSO 150 ML x 1, MIZ
109342, TEEN DERM K CONCEN , TEEN DERM K CONCEN, NOT FOUND, SERUM 30 ML x 1, MIZ
109187, TEEN DERM MASK , TEEN DERM MASK, NOT FOUND, GEL ESFOLIAN 40 ML x 1, MIZ
75962, TOPLANINA , TOPLANINA, NOT FOUND, F.AMP 400 MG x 1, MIZ
77414, TOPORAN , TOPORAN, NOT FOUND, F.AMP LIOF 4 MG x 1, MIZ
