78717, LECITINA SOJA , LECITINA SOJA, LECITINA SOJA, CAPS 500 MG x 40, C_S
46702, LECITINA SOJA , LECITINA SOJA, LECITINA SOJA, CAPS 500 MG x 80, C_S
60634, LEVEDURA CERVEJA , LEVEDURA CERVEJA, NOT FOUND, CPR 250 MG x 150, C_S
46610, LEVEDURA CERVEJA , LEVEDURA CERVEJA, NOT FOUND, CPR 250 MG x 200, C_S
159920, LICOPENO+SELENIO , LICOPENO SELENIO, NOT FOUND, CAPS x 60, C_S
112628, LIPOCORP AUTHENTIC , LIPOCORP AUTHENTIC, NOT FOUND, CAPS x 30, C_S
112630, LIPOCORP CELL , LIPOCORP CELL, NOT FOUND, CAPS x 30, C_S
112634, LIPOCORP FIRMAX , LIPOCORP FIRMAX, NOT FOUND, CAPS x 30, C_S
161177, LIPOCORP MAGRICORP , LIPOCORP MAGRICORP, NOT FOUND, CAPS x 60, C_S
112637, LIPOCORP OLEO CHIA , LIPOCORP OLEO CHIA, NOT FOUND, CAPS x 60, C_S
112652, LIPOCORP OLEO COCO , LIPOCORP OLEO COCO, NOT FOUND, CAPS x 60, C_S
112659, LIPOCORP OMEGA 3 , LIPOCORP OMEGA 3, NOT FOUND, CAPS 1000 MG x 60, C_S
112664, LIPOCORP PIC CROMO , LIPOCORP PIC CROMO, NOT FOUND, CAPS x 60, C_S
112671, LIPOCORP QUITOSANA , LIPOCORP QUITOSANA, NOT FOUND, CAPS 500 MG x 60, C_S
158998, LIPOMAGRIN , LIPOMAGRIN, NOT FOUND, CAPS x 60, C_S
