58475; ALBEZIN ; ALBEZIN; NOT FOUND; CPR MASC 400 MG x 1; BRT
58476; ALBEZIN ; ALBEZIN; NOT FOUND; SUSP ORAL 400 MG 10 ML x 1; BRT
57582; AMBROL ; AMBROL; NOT FOUND; XAR. AD 30 MG 100 ML x 1 (/5ML); BRT
57583; AMBROL ; AMBROL; NOT FOUND; XAR. INF 15 MG 100 ML x 1 (/5ML); BRT
57451; AORTEN ; AORTEN; NOT FOUND; CPR 25 MG x 30; BRT
67342; AORTEN ; AORTEN; NOT FOUND; CPR 25 MG x 500; BRT
79068; APETIPLUS ; APETIPLUS; NOT FOUND; XAR ABACAXI 240 ML x 1; BRT
79069; APETIPLUS ; APETIPLUS; NOT FOUND; XAR CEREJA 240 ML x 1; BRT
88116; APETIPLUS ; APETIPLUS; NOT FOUND; XAR UVA 1 240 ML x 1; BRT
