32688, ACEMEDROX , ACEMEDROX, NOT FOUND, CPR 10 MG x 5, BNK
60322, ACIVERAL , ACIVERAL, NOT FOUND, CPR 200 MG x 25, BNK
54953, ACIVERAL , ACIVERAL, NOT FOUND, CREME 50 MG 10 G x 1 (/G), BNK
48721, ALCALONE PLUS , ALCALONE PLUS, NOT FOUND, SUSP 240 ML x 1, BNK
55812, ALETIR , ALETIR, NOT FOUND, CPR 10 MG x 6, BNK
55813, ALETIR , ALETIR, NOT FOUND, SOLN ORAL 1 MG 75 ML x 1 (/ML), BNK
54169, ALGIRONA , ALGIRONA, NOT FOUND, CPR 500 MG x 200, BNK
50753, ALGIRONA , ALGIRONA, NOT FOUND, GOTAS 500 MG 10 ML x 1 (/ML), BNK
60323, AMOXITAN , AMOXITAN, NOT FOUND, SUSP 250 MG 150 ML x 1 (/5ML), BNK
48726, APETIL , APETIL, NOT FOUND, CPR x 20, BNK
874, APETIL , APETIL, NOT FOUND, LIQD 100 ML x 1, BNK
60324, ASMIFEN , ASMIFEN, NOT FOUND, CPR 1 MG x 20, BNK
60325, ASMIFEN , ASMIFEN, NOT FOUND, XAR. 1 MG 100 ML x 1 (/5ML), BNK
