533007701118410; MAZITRON; MAZITRON; NOT FOUND; 500 MG CAP GEL DURA CT BL AL PLAS INC X 3; U_Q
533017801131114; MALEATO DE DEXCLORFENIRAMINA + BETAMETASONA; MALEATO DEXCLORFENIRAMINA BETAMETASONA; NOT FOUND; 0.4 MG/ML + 0.05 MG/ML  XPE CT FR VD AMB X 120 ML; U_Q
533012120056903; MUCOFAN; MUCOFAN; NOT FOUND; 20 MG/ML XPE CT FR PLAS TRANS X 100 ML  ; U_Q
533021101130423; MUCOFAN; MUCOFAN; NOT FOUND; 50 MG/ML XPE CT FR PLAS TRANS X 100 ML; U_Q
533012120056803; MUCOFAN; MUCOFAN; NOT FOUND; 50 MG/ML SOL OR CT FR VD AMB CGT X 20 ML  ; U_Q
533022601171410; MAXINOM; MAXINOM; NOT FOUND; (1 MG + 3.5 MG + 6000 UI)/ML SUS OFT CT FR PLAS OPC GOT X 5 ML; U_Q
533022602176416; MAXINOM; MAXINOM; NOT FOUND; (1 MG + 3.5 MG + 6000 UI)/G POM OFT CT BG AL X 3.5 G; U_Q
533012120058906; MALEATO DE TIMOLOL; MALEATO TIMOLOL; MALEATO TIMOLOL; 5 MG/ML SOL OFT CT FR PLAS OPC X  5 ML ; U_Q
533007801155113; MIDAZOLAM; MIDAZOLAM; MIDAZOLAM; 5 MG/ML SOL INJ CX 5 AMP VD INC X 3 ML; U_Q
533023901118416; METACOROL; METACOROL; NOT FOUND; 100 MG COM CT BL AL PLAS INC X 20; U_Q
