511102201118417; DIGEST; DIGEST; NOT FOUND; CAPS CX C/ 30; HBF
511101901167412; DEXADERM (DEXAMETAZONA); DEXADERM DEXAMETAZONA; NOT FOUND; CREME BISN C/ 15 G; HBF
511102101113413; DICLOSOD (DICLOF.SÓDICO); DICLOSOD DICLOF SODICO; NOT FOUND; 50 MG COMP CX C/ 20; HBF
511102402113420; DIPIRAN; DIPIRAN; NOT FOUND; 500 MG COMP CX C/ 100 (DIPIRONA); HBF
511102403136424; DIPIRAN; DIPIRAN; NOT FOUND; 500 MG/ML SOL ORAL GTS FR C/ 10 ML (DIPIRONA); HBF
511102001119411; DIABINIL (APEX); DIABINIL APEX; NOT FOUND; 5 MG COM CT 3 BL AL PLAS INC X 10; HBF
511101801162419; DERMICIN; DERMICIN; NOT FOUND; POM BG C/ 15 G; HBF
