538902801111314; NATELE; NATELE; NOT FOUND; CAP GEL MOLE CT BL AL PLAS INC X 14; BYP
538902802118411; NATELE; NATELE; NOT FOUND; CAP GEL MOLE CT BL AL PLAS INC X 28; BYP
538902803114418; NATELE; NATELE; NOT FOUND; CAP GEL MOLE CT BL AL PLAS INC X 7; BYP
538912050015913; NEOVLAR; NEOVLAR; NOT FOUND; 0.25 MG + 0.05 MG DRG CT BL CALEND AL PLAS INC X 21; BYP
538914100022703; NAPROSYN; NAPROSYN; NOT FOUND; 500 MG COM CT BL AL PLAS INC X 10; BYP
538912020009403; NAPROSYN; NAPROSYN; NOT FOUND; 250 MG COM CT BL AL PLAS INC X 15; BYP
538912020009503; NAPROSYN; NAPROSYN; NOT FOUND; 500 MG COM CT BL AL PLAS INC X 20; BYP
538912050012113; NEXAVAR; NEXAVAR; NOT FOUND; 200 MG COM REV CT BL AL / AL X 60; BYP
538912050015813; NEBIDO; NEBIDO; NOT FOUND; 250 MG/ML SOL INJ CT AMP VD AMB X 4 ML; BYP
538912050015513; NERISONA; NERISONA; NOT FOUND; 1 MG/G CREM DERM CT BG AL X 15G; BYP
538912050015613; NERISONA; NERISONA; NOT FOUND; 1 MG/G POM DERM CT BG AL X 15G; BYP
