68008, VICHY DESODORANTE , VICHY DESODORANTE, NOT FOUND, AERO A/T 125 ML x 1, VCY
74144, VICHY DESODORANTE , VICHY DESODORANTE, NOT FOUND, K AE AT+T AT 155 ML x 1, VCY
74146, VICHY DESODORANTE , VICHY DESODORANTE, NOT FOUND, K DIO R A/T 50 ML x 1, VCY
74142, VICHY DESODORANTE , VICHY DESODORANTE, NOT FOUND, K DUO AE A/T 125 ML x 1, VCY
74145, VICHY DESODORANTE , VICHY DESODORANTE, NOT FOUND, K DUO R PMSD 50 ML x 1, VCY
79273, VICHY DESODORANTE , VICHY DESODORANTE, NOT FOUND, R HV S/R 72H 30 ML x 1, VCY
68350, VICHY DESODORANTE , VICHY DESODORANTE, NOT FOUND, ROLLON A/T 50 ML x 1, VCY
150198, VICHY DESODORANTE , VICHY DESODORANTE, NOT FOUND, ROLLON ID FI 50 ML x 1, VCY
75059, VICHY DESODORANTE , VICHY DESODORANTE, NOT FOUND, ROLO P/S 48H 50 ML x 1, VCY
75964, VICHY DESODORANTE , VICHY DESODORANTE, NOT FOUND, ROLO S/A 24H 50 ML x 1, VCY
68009, VICHY DESODORANTE , VICHY DESODORANTE, NOT FOUND, ROLON PM S/D 50 ML x 1, VCY
68007, VICHY DESODORANTE , VICHY DESODORANTE, NOT FOUND, TRAT A/T 30 ML x 1, VCY
75060, VICHY DESODORANTE , VICHY DESODORANTE, NOT FOUND, TRAT A/T 48H 50 ML x 1, VCY
76725, VICHY HOMME , VICHY HOMME, NOT FOUND, CR LIFTAC EY 15 ML x 1, VCY
77644, VICHY HOMME , VICHY HOMME, NOT FOUND, CR LIFTAC PU 30 ML x 1, VCY
74185, VICHY HOMME , VICHY HOMME, NOT FOUND, CR NORMAC CG 50 ML x 1, VCY
74194, VICHY HOMME , VICHY HOMME, NOT FOUND, CR RETI-FILL 50 ML x 1, VCY
74195, VICHY HOMME , VICHY HOMME, NOT FOUND, CR SE BAU CA 75 ML x 1, VCY
74201, VICHY HOMME , VICHY HOMME, NOT FOUND, G LIMP NETTO 125 ML x 1, VCY
74181, VICHY HOMME , VICHY HOMME, NOT FOUND, MOUSSE RASER 200 ML x 1, VCY
74180, VICHY HOMME , VICHY HOMME, NOT FOUND, MOUSSE RASER 50 ML x 1, VCY
74199, VICHY HOMME , VICHY HOMME, NOT FOUND, ROLLON PS. 50 ML x 1, VCY
78380, VICHY HOMME , VICHY HOMME, NOT FOUND, ROLO C/E 72H 50 ML x 1, VCY
74173, VICHY HOMME , VICHY HOMME, NOT FOUND, STIC Y HY MA 4 ML x 1, VCY
74200, VICHY HOMME , VICHY HOMME, NOT FOUND, VAPORIZADOR 100 ML x 1, VCY
