66931, PIOLENDIX , PIOLENDIX, NOT FOUND, LIQD 1 % 60 ML x 1, C6R
113627, PROCTOLIV , PROCTOLIV, NOT FOUND, POM 6APLIC 30 G x 1, C6R
77539, PROCTOLIV , PROCTOLIV, NOT FOUND, POM+10APL 50 G x 1, C6R
66933, PROPOLIS , PROPOLIS, NOT FOUND, GOTAS 30 ML x 1, C6R
66935, PROPOLIS , PROPOLIS, NOT FOUND, SPRAY GENGIB 30 ML x 1, C6R
66937, PROPOLIS , PROPOLIS, NOT FOUND, SPRAY MENTA 30 ML x 1, C6R
66939, PROPOLIS , PROPOLIS, NOT FOUND, SPRAY NAT 30 ML x 1, C6R
66942, PROPOLIS , PROPOLIS, NOT FOUND, SPRAY ROMA 30 ML x 1, C6R
