62744, LEVOFLOXACINO MG , LEVOFLOXACINO, LEVOFLOXACINO, CPR REVEST 250 MG x 7, BF8
62747, LEVOFLOXACINO MG , LEVOFLOXACINO, LEVOFLOXACINO, CPR REVEST 500 MG x 7, BF8
68088, LISINOPRIL MG , LISINOPRIL, LISINOPRIL, CPR 10 MG x 30, BF8
62732, LORATA+PSEUDOEF.MG , LORATA PSEUDOEF, NOT FOUND, DRAG x 12, BF8
62735, LORATA+PSEUDOEF.MG , LORATA PSEUDOEF, NOT FOUND, XAR. 60 ML x 1, BF8
62725, LORATADINA MG , LORATADINA, LORATADINA, CPR 10 MG x 12, BF8
63570, LOSARTAN POTAS.MG , LOSARTAN POTAS, NOT FOUND, CPR REVEST 50 MG x 14, BF8
63571, LOSARTAN POTAS.MG , LOSARTAN POTAS, NOT FOUND, CPR REVEST 50 MG x 28, BF8
