129340, OLEO DE CARTAMO , OLEO CARTAMO, NOT FOUND, CAPS 1000 MG x 120, ST0
119418, OLEO DE CHIA , OLEO CHIA, NOT FOUND, CAPS 1000 MG x 60, ST0
119414, OLEO DE CHIA , OLEO CHIA, NOT FOUND, CAPS 500 MG x 60, ST0
129356, OLEO DE COCO , OLEO COCO, OLEO COCO, CAPS 1000 MG x 120, ST0
90035, OLEO DE LINHACA , OLEO LINHACA, NOT FOUND, CAPS 1000 MG x 60, ST0
123129, OLEO DE LINHACA , OLEO LINHACA, NOT FOUND, CAPS 500 MG x 60, ST0
119425, OLEO FIG DE BACALH , OLEO FIG BACALH, OLEO FIGADO BACALHAU, CAPS 250 MG x 90, ST0
129339, OMEGA 3 OLEO PEIXE , OMEGA 3 OLEO PEIXE, NOT FOUND, CAPS 1000 MG x 60, ST0
119443, OMEGA 3 OLEO PEIXE , OMEGA 3 OLEO PEIXE, NOT FOUND, CAPS 500 MG x 60, ST0
149921, OMEGA 3 OLEO PEIXE , OMEGA 3 OLEO PEIXE, NOT FOUND, CAPS x 120, ST0
