1101302300015; ADACNE; ADACNE; NOT FOUND; 1.0 MG/G GEL CT BG PLAS LAM X 15 G; GMK
1101302300023; ADACNE; ADACNE; NOT FOUND; 1.0 MG/G GEL CT BG PLAS LAM X 30 G; GMK
1101302490027; ADACNE CLIN; ADACNE CLIN; NOT FOUND; 1 MG/G + 10 MG/G GEL DERM CT BG AL REV PLAS X 10G; GMK
1101302490019; ADACNE CLIN; ADACNE CLIN; NOT FOUND; 1 MG/G + 10 MG/G GEL DERM CT BG AL REV PLAS X 30 G; GMK
1101302490035; ADACNE CLIN; ADACNE CLIN; NOT FOUND; 1 MG/G + 10 MG/G GEL DERM CT BG AL REV PLAS X 45 G; GMK
1101300330022; ALGI TANDERIL; ALGI TANDERIL; NOT FOUND; GOTAS 20 ML; GMK
1101300330014; ALGI TANDERIL; ALGI TANDERIL; NOT FOUND; SOFT GEL BISN 60 GR; GMK
1101300570041; ALGI TANDERIL; ALGI TANDERIL; NOT FOUND; 30 MG + 125 MG + 50 MG + 300 MG COM CT BL AL PLAS INC X 30; GMK
1101300570023; ALGI TANDERIL; ALGI TANDERIL; NOT FOUND; 30 MG + 125 MG + 50 MG + 300 MG COM CT BL AL PLAS INC X 12; GMK
1101300400012; ALERGOSAN; ALERGOSAN; NOT FOUND; CREME 30 GR; GMK
1101300460013; AEROCRIL; AEROCRIL; NOT FOUND; AEROSOL 5MG; GMK
1101300460041; AEROCRIL; AEROCRIL; NOT FOUND; SOL NASAL 2% 17.5ML; GMK
1101300460058; AEROCRIL; AEROCRIL; NOT FOUND; SOL NASAL 4% 13ML; GMK
1101300411502; AEROCORT S; AEROCORT S; NOT FOUND; 50 MCG + 100 MCG/DOSE AER BUCAL CT LT AL X 200 DOSES; GMK
