1101300500033; FLUICIS; FLUICIS; NOT FOUND; 20 MG/G GRAN EFEV CT 16 ENV AL X 5 G; GMK
1101300500041; FLUICIS; FLUICIS; NOT FOUND; 40 MG/G GRAN EFEV CT 16 ENV AL X 5 G; GMK
1101300500051; FLUICIS; FLUICIS; NOT FOUND; 120 MG/G GRAN EFEV CT 16 ENV AL X 5 G; GMK
1101300500017; FLUICIS; FLUICIS; NOT FOUND; XAROPE 100 ML; GMK
1101300180012; FLUIZAN; FLUIZAN; NOT FOUND; ADULTO 100 ML; GMK
1101300180039; FLUIZAN; FLUIZAN; NOT FOUND; PEDIATRICO 100 ML; GMK
1101300390017; FLOGESIC; FLOGESIC; NOT FOUND; 50MG 20 COMP; GMK
1101302270027; FLUTICAN; FLUTICAN; NOT FOUND; 50 MCG/DOSE SUS NAS CT FR PLAS OPC X 10 ML; GMK
