9044000160035; CIANOTRAT; CIANOTRAT; NOT FOUND; SOL INJ EM CX C/ 12 AMP; DLT
1044000160051; CIANOTRAT; CIANOTRAT; NOT FOUND; 2500MCG/ML+50MG/ML+50MG/ML SOL INJ CT 1 AMP VD INC X 2 ML + 4MG/ML SOL INJ CT 1 AMP VD INC X 1ML; DLT
1044000160035; CIANOTRAT; CIANOTRAT; NOT FOUND; 2500MCG/ML+50MG/ML+50MG/ML SOL INJ CT 2 AMP VD INC X 2 ML; DLT
1044000150018; CALFERON; CALFERON; NOT FOUND; SUSP EM FR C/ 240 ML; DLT
1044000570017; CRONOPLEX; CRONOPLEX; NOT FOUND; 7.5 MG/ML SOL OR CT FR PLAS OPC CGT X 20 ML; DLT
1044000570025; CRONOPLEX; CRONOPLEX; NOT FOUND; FR C/ 20 DRG; DLT
1044000030047; CALMAPAX; CALMAPAX; NOT FOUND; FR C/ 100 ML; DLT
