500900802164310; CILOXAN; CILOXAN; NOT FOUND; 3 MG/G POM OFT CT BG AL X 3.5 G; ALC
500900801176315; CILOXAN; CILOXAN; NOT FOUND; 3.0 MG/ML SOL OTO CT FR PLAS OPC GOT X 5 ML; ALC
500900803179311; CILOXAN; CILOXAN; NOT FOUND; 3 MG/ML SOL OFT CT FR PLAS TRANS GOT X 5 ML; ALC
500900701163416; CILODEX; CILODEX; NOT FOUND; 3 MG/G + 1 MG/G POM OFT CT BG AL X 3.5 G; ALC
500900702178417; CILODEX; CILODEX; NOT FOUND; 3.0 MG/ML+1.0 MG/ML SUS OFT CT FR PLAS OPC GOT X 5 ML; ALC
500900901170319; CIPRO HC; CIPRO HC; NOT FOUND; 2.0 MG/ML + 10.0 MG/ML SUS OTO CT FR VD TRANS CGT X 10 ML; ALC
500901101178410; CLAROFT; CLAROFT; NOT FOUND; 0.12 MG/ML SOL OFT CT FR PLAS OPC GOT X 15 ML; ALC
500901001173311; CLARIL; CLARIL; NOT FOUND; 0.25 MG/ML + 3.0 MG/ML SOL OFT CT FR PLAS TRANS GOT X 15 ML; ALC
500900601177318; CERUMIN; CERUMIN; NOT FOUND; 0.4MG/ML + 140MG/ML SOL OTO CT FR PLAS OPC GOT X 8 ML; ALC
