500903501173110, TOBRAMICINA + DEXAMETASONA, TOBRAMICINA DEXAMETASONA, NOT FOUND, 3 MG/ML + 1 MG/ML SUS OFT CT 1 FR PLAS TRANS GOT X 5 ML, ALC
500903401160319, TOBRADEX, TOBRADEX, NOT FOUND, 3.0 MG/G + 1.0 MG/G POM OFT CT BG AL X 3.5 G, ALC
500903402175311, TOBRADEX, TOBRADEX, NOT FOUND, 3.0 MG/ML + 1.0 MG/ML SUS OFT CT FR PLAS TRANS GOT X 5 ML, ALC
500903901171311, TRISORB, TRISORB, NOT FOUND, 3.0 MG/ML + 1.0 MG/ML + 2.0 MG/ML CT FR GOT PLAS TRANS X 15 ML, ALC
500903301174113, TARTARATO DE BRIMONIDINA, TARTARATO BRIMONIDINA, NOT FOUND, 2.0 MG/ML SOL OFT CT FR PLAS OPC CGT X 5 ML, ALC
500903701164311, TOBREX, TOBREX, NOT FOUND, 3 MG/G POM OFT CT BG AL X 3.5 G, ALC
500903601178114, TOBRAMICINA, TOBRAMICINA, TOBRAMICINA, 3.0 MG/ML SOL OFT CT FR PLAS TRANS GOT X 5 ML, ALC
500903702179310, TOBREX, TOBREX, NOT FOUND, 3 MG/ML SOL OFT CT FR PLAS TRANS GOT X 5 ML, ALC
500903801177316, TRAVATAN, TRAVATAN, NOT FOUND, 0.04 MG/ML SOL OFT CT FR PLAS TRANS GOT X 2.5 ML, ALC
500912110006403, TRAVATAN, TRAVATAN, NOT FOUND, 0.04 MG/ML SOL OFT CT FR PLAS TRANS GOT X 5.0 ML, ALC
