541512030000114; CLAVICIN; CLAVICIN; NOT FOUND; 500 MG + 100 MG PO SOL INJ CT 50 FR VC INC; AA0
541512030000514; CEFLEN; CEFLEN; NOT FOUND; 1 G PO LIOF INJ CT 50 FA VD INC; AA0
541512030000604; CELLOZINA; CELLOZINA; NOT FOUND; 1 G PO INJ CX 25  FA VD INC; AA0
541512100003503; CELLOZINA; CELLOZINA; NOT FOUND; 1 G PO INJ CT FA VD INC; AA0
541512100003613; CELLOZINA; CELLOZINA; NOT FOUND; 1 G PO INJ CX 50 FA VD TRANS; AA0
541512030001214; CELLTRIAXON; CELLTRIAXON; NOT FOUND; 1 G PO INJ IV CT 100 FA VD INC; AA0
