76085, LACTOFOS , LACTOFOS, NOT FOUND, PO.SACHET 6 G x 10, HBA
104591, LACTOFOS , LACTOFOS, NOT FOUND, PO.SACHET 6 G x 15, HBA
106724, LACTOFOS , LACTOFOS, NOT FOUND, PO.SACHET 6 G x 30, HBA
57128, LECITINA SOJA , LECITINA SOJA, LECITINA SOJA, CAPS 500 MG x 45, HBA
75131, LEVEDO CERVEJA , LEVEDO CERVEJA, NOT FOUND, CPR 500 MG x 350, HBA
58980, LICOPENE , LICOPENE, NOT FOUND, CAPS 250 MG x 30, HBA
78111, LINHACA , LINHACA, NOT FOUND, POTE 250 G x 1, HBA
73444, LUTENE , LUTENE, NOT FOUND, CAPS 200 MG x 15, HBA
57756, LUTENE , LUTENE, NOT FOUND, CAPS x 30, HBA
