57146; OLEO DE ALHO ; OLEO ALHO; NOT FOUND; CAPS x 45; HBA
99495; OLEO DE CHIA ; OLEO CHIA; NOT FOUND; CAPS x 60; HBA
94899; OLEO DE COCO ; OLEO COCO; OLEO COCO; CAPS 1 G x 60; HBA
72874; OLEO DE PEIXE ; OLEO PEIXE; NOT FOUND; CAPS 1000 MG x 30; HBA
142091; OLEO DE PEIXE ; OLEO PEIXE; NOT FOUND; CAPS 600 MG x 30; HBA
75138; OLEO FIG BACALHAU ; OLEO FIG BACALHAU; OLEO FIGADO BACALHAU; CAPS 250 MG x 45; HBA
75137; OLEO GERME TRIGO ; OLEO GERME TRIGO; NOT FOUND; CAPS 250 MG x 45; HBA
75139; OLEO LINHACA ; OLEO LINHACA; NOT FOUND; CAPS 1 G x 30; HBA
76887; OLEO LINHACA ; OLEO LINHACA; NOT FOUND; CAPS 1 G x 60; HBA
144150; OLEO ROSA MOSQUETA ; OLEO ROSA MOSQUETA; NOT FOUND; OLEO 100 ML x 1; HBA
57151; OLEO ROSA MOSQUETA ; OLEO ROSA MOSQUETA; NOT FOUND; OLEO 15 ML x 1; HBA
76731; OLEO ROSA MOSQUETA ; OLEO ROSA MOSQUETA; NOT FOUND; OLEO 30 ML x 1; HBA
78280; OMEGA MATER ; OMEGA MATER; NOT FOUND; CAPS 1000 MG x 60; HBA
129180; OMEGA MATER ; OMEGA MATER; NOT FOUND; CAPS x 30; HBA
