1008500060067; GLICOFISIOLÓGICA; GLICOFISIOLOGICA; NOT FOUND; AMP 1000 ML; BME
1008500060016; GLICOFISIOLÓGICA; GLICOFISIOLOGICA; NOT FOUND; AMP 250 ML; BME
1008500060080; GLICOFISIOLÓGICA; GLICOFISIOLOGICA; NOT FOUND; AMP 500 ML; BME
1008500060119; GLICOSE A 5% + CLORETO DE SÓDIO A 0,9%; GLICOSE A 5 CLORETO SODIO A 0 9; NOT FOUND; 50 MG/ML + 9 MG/ML SOL INJ IV CX 10 AMP PLAS SIST FECH X 1000 ML; BME
1008500060097; GLICOSE A 5% + CLORETO DE SÓDIO A 0,9%; GLICOSE A 5 CLORETO SODIO A 0 9; NOT FOUND; 50 MG/ML + 9 MG/ML SOL INJ IV CX 30 AMP PLAS SIST FECH X 250 ML; BME
1008500060100; GLICOSE A 5% + CLORETO DE SÓDIO A 0,9%; GLICOSE A 5 CLORETO SODIO A 0 9; NOT FOUND; 50 MG/ML + 9 MG/ML SOL INJ IV CX 20 AMP PLAS SIST FECH X 500 ML; BME
1008500390011; GLICERINA; GLICERINA; NOT FOUND; AMP 500 ML; BME
1008500020024; GLICINA; GLICINA; GLICINA; AMP 2000 ML; BME
1008500410012; GLUCONATO CALCIO; GLUCONATO CALCIO; NOT FOUND; AMP 10 ML; BME
