525403301111418; DICLIN; DICLIN; NOT FOUND; 2 MG + 0.035 MG COM REV CT CART EST CAL AL PVC X 21; M_S
525403302118416; DICLIN; DICLIN; NOT FOUND; 2 MG + 0.035 MG COM REV CT CART EST CAL AL PVC X 63; M_S
525403202113412; DEXA CITONEURIN; DEXA CITONEURIN; NOT FOUND; COM REV EST 2 BL AL PLAS AMB X 10; M_S
525403201151418; DEXA CITONEURIN; DEXA CITONEURIN; NOT FOUND; SOL INJ EST 3 AMP VD INC X 2 ML + 3 AMP VD INC X 1 ML; M_S
525403401116411; DINAVITAL; DINAVITAL; NOT FOUND; 1G + 1G COM EFER CT TB PLAS INC X 10; M_S
525414030045004; DEXA-CITONEURIN NFF; DEXA CITONEURIN NFF; NOT FOUND; (100 MG + 100 MG) + (5 MG + 4.37 MG) SOL INJ IM CT 1 AMP VD AMB X 1 ML + 1 AMP VD AMB X 2 ML ; M_S
525414030045104; DEXA-CITONEURIN NFF; DEXA CITONEURIN NFF; NOT FOUND; (100 MG + 100 MG) + (5 MG + 4.37 MG) SOL INJ IM CT 3 AMP VD AMB X 1 ML + 3 AMP VD AMB X 2 ML; M_S
525418501111118; DICLOFENACO SÓDICO; DICLOFENACO SODICO; DICLOFENACO SODICO; 100 MG CAP GEL DURA MICROG EST CART BL AL PLAS INC X 10; M_S
525417401164114; DIPROPIONATO DE BETAMETASONA + ÁCIDO SALICÍLICO; DIPROPIONATO BETAMETASONA ACIDO SALICILICO; NOT FOUND; 0.5 MG/G + 30 MG/G POM DERM CT BG AL X 30 G ; M_S
